,person,text
325,holt,None.
326,holt,It was a hypothetical question.
327,holt,So? How did Sergeant Jeffords do?
328,holt,That does make me happy.
329,holt,Peralta.
330,holt,Do you have a m*rder suspect to question?
331,holt,"You got him, babe. I understood the wordplay, yes."
332,holt,Are those gummy bears wrapped in a fruit roll-up?
333,holt,I pity your dentist.
334,holt,Brief me on the hotel robberies.
335,holt,Keep me updated.
336,holt,Good-bye.
337,holt,"Now I know you'd all prefer to go to a bar, drink beer, and eat chips of various textures. But our CompStat numbers are due tomorrow morning, so I need these arrests on the books today."
338,holt,Dismissed.
339,holt,"I'm worried.The CompStat numbers are due tomorrow at 9:00 A.M., but at this rate, we won't be finished until your daughters are grown and married."
340,holt,Are you saying you want to secretly perform scientific experiments on your friends and coworkers to increase efficiency?
341,holt,"Sounds fun, let's do it."
342,holt,"Good. What's this red area here, the Diaz triangle?"
343,holt,"Mt. Diaz. Humorous, yes."
344,holt,The bathroom.
345,holt,Ca-caw!
346,holt,Ca-caw!
347,holt,"It's good, but we can do better. Tell me about the Boyle-Linetti Reaction."
348,holt,"Well, I really can't blame her on this one. Maybe we should just, uh, empty lost and found."
349,holt,"Oh, my God, we're doomed. Boyle looks like a lesbian."
350,holt,Well done.
351,holt,"I think we should keep going, make the office even more efficient."
352,holt,Are you familiar with the story ofMoneyball?A man uses statistics and logic to win several baseball games. It's my favorite film.
353,holt,The statistical analysis...  It's so beautiful.
354,holt,"This office is becoming a powerhouse of paperwork processing. I'm flying high, Sergeant, and I'm never coming down."
355,holt,"Hello, Peralta."
356,holt,Updates on the case?
357,holt,"Yes, she told me yesterday."
358,holt,"Santiago wants to make Captain one day. I know, because I've frequently caught her wearing my hat and looking into a mirror."
359,holt,"I support her decision. That's what good detectives do. They have each other's back, no matter what."
360,holt,Back to the drawing board.
361,holt,"The problem is, we didn't take Peralta into account. In our next trial--"
362,holt,"Please, I'm open to any ideas about efficiency."
363,holt,"Well, I suppose it's possible we may have been a tad enthusiastic in our pursuit of efficiency..."
364,holt,"Fine, message received. Jeffords and I will get right to work."
365,holt,Get the h*ll out of my chair.
366,holt,Make sure that phrase is not in your official report.
367,holt,"I want you and Santiago to tail Augustine until he makes the drop, and then arrest him and the buyer."
368,holt,That's enough. Peralta and Santiago will tail Augustine. Boyle and Diaz will join them in a surveillance van unless you have a problem with that.
369,holt,"Come in and shut the door. I have some news, which you must promise to keep secret. Madeline Wuntch is making me head of public relations for the NYPD. I'm being forced out of the Nine-Nine. I don't wish to make a big deal of it, so please limit your reactions to one second; go."
370,holt,That's plenty.
371,holt,"I'm not going anywhere. Madeline's not some invincible succubus. She's a regular succubus, and she can be defeated. We just need to find the letter."
372,holt,"Before our current police commissioner was hired, a mutual friend told me Madeline wrote a letter to the mayor telling him it was a mistake. She apparently called her now-boss a ""simpering buffoon""."
373,holt,"A copy of that letter exists in the mayor's archives. I can't go snooping around without alerting Madeline, so it won't be easy, and we don't have much time, but I need you to find that letter. Are you with me?"
374,holt,Well done. Now get me Madeline and a bucket of water. It's time to melt a witch.
375,holt,"Madeline, thank you for coming."
376,holt,Care to sit? I'm sure you'd like to take some weight off your cloven hooves.
377,holt,"Actually I was calling you a goat, you goat."
378,holt,I'd like to talk about my promotion.
379,holt,"Don't count your gross fish babies before they've hatched, Madeline."
380,holt,It doesn't matter how I got it.
381,holt,"Yes, well, who wouldn't want to see a man fight a crocodile? Now, Madeline, before one of us starts weeping like a war widow, would you like to give me my precinct back?"
382,holt,"You have until tomorrow, you grackle."
383,holt,Wuntch.
384,holt,"So nice of you to greet us, Madeline. I thought surely you'd still be crushed under that house in Munchkinland."
385,holt,"Describing your breakfast? I came out as a gay cop in the 1980s, so it's gonna take more than reassigning me to break my spirit. I'll turn this place around just like I did the Nine-Nine."
386,holt,"Thank you, Chief Wuntch. I'm excited to be back. I look forward to doing meaningful work, beginning with my eight-point plan for community engagement."
387,holt,"Oh, no."
388,holt,"I know you've been working on picking a name for the pigeon mascot for, uh, several months now. I feel like you might need a breather, so I've prepared an eight-point presentation on community engagement."
389,holt,"Well, it says here it's scheduled ""after everyone leaves."""
390,holt,Very well. My thoughts are: who cares?
391,holt,No.
392,holt,What does it matter? Why'd you even choose a pigeon anyway? It's a terrible mascot.
393,holt,"They're carriers of disease, and they eat garbage!"
394,holt,You can't make me.
395,holt,...Paulie.
396,holt,"Actually, that's exactly your place to say. You are my assistant. What precisely did you think your job was?"
397,holt,Hmm.
398,holt,"I'd like to propose a truce. Our feud is getting in the way of the NYPD's business. Madeline, the PR department is a joke. Their work here is meaningless. Nine weeks to choose the name Paulie. I knew instantly it should be Pepper, Officer Pepper O'Pigeon."
399,holt,I could turn this department around if you'd let me. You're wasting my talents.
400,holt,"No, Madeline, I don't have my own pigeon pants."
401,holt,"I can't put that pigeon head on, Gina. Wuntch has defeated me. This is how it ends, with me standing on the urine-soaked floor of an elementary school bathroom in a third-rate bird costume. I quit."
402,holt,"I thought your reality show was to be called ""Gina in a Bottle."""
403,holt,Community engagement.
404,holt,Inspiring words. I'm going to give that speech. Help me with that pigeon head.
405,holt,Let's blow some tiny minds.
406,holt,Mm.
407,holt,"Just remember, we're here as PR representatives. I don't wanna be disruptive."
408,holt,I would hate it if these doors opened and everyone stopped working to applaud us.
409,holt,Yes.
410,holt,"Hmm, strange to be on this side of the desk."
411,holt,I'm fairly certain that's a dog.
412,holt,"Sergeant Jeffords, hello."
413,holt,"Well, I won't take up too much of your time. Because the Nine-Nine was Captain Dozerman's last  precinct, you will be seated at the front of the funeral. I wanted to alert you that there'll be press, cameras—"
414,holt,"Oh, I noticed in the bullpen that you had changed the case numbering system. I found, when I was commanding officer, that—"
415,holt,I was making a suggestion.
416,holt,"Yes, well, I know my way out."
417,holt,Yes.
418,holt,"No, I most definitely left."
419,holt,"Let me stop you right there, Peralta. I'm not the Chief of Detectives. I'm not the Vulture's boss. I'm just some guy in PR."
420,holt,"I can't save your ass. I don't work here anymore. And the sooner you accept that, the better."
421,holt,"No. Until this morning, some small part of me still believed I would be captain of the Nine-Nine again. What a fool I was. I should never have returned. It's like visiting your childhood home and seeing it's been replaced by a denim pants store."
422,holt,"I can't. I've been asked to deliver a toast here after the funeral, a message of hope. This is what I have so far: ""Pain."" That's it."
423,holt,"Maybe I will. But first, you're gonna have one drink with me, Sergeant. For old times' sake?"
424,holt,One drink.
425,holt,Everyone I work with is a stupidface. Especially Bryce.
426,holt,Hmm?
427,holt,Hmm?
428,holt,Hmm?
429,holt,"Yes, you already mentioned the yogurt."
430,holt,"But the Vulture told you not to, and you had to listen. He's your captain now, Terry."
431,holt,"Hmm. ""Everything is garbage."" I should put that in my message of hope."
432,holt,And now for a message of hope.
433,holt,Everything is garbage.
434,holt,"You find something you care about, and it's taken from you: your colleague, your dream job, your mango yogurt."
435,holt,Never love anything. That's the lesson. To Captain Dozerman.
436,holt,I have one. Holt saves your ass.
437,holt,"I was moved by your speech, Peralta."
438,holt,The syntax was problematic.
439,holt,And your vocabulary is a true indictment of the public school system.
440,holt,"But the fact that you're not willing to give up in the face of adversity is inspiring. I love the Nine-Nine, and I'm not gonna turn my back on the squad. So I fixed your problem with the Vulture."
441,holt,I may just be a guy in PR. But what does the Vulture love more than anything?
442,holt,No. Publicity.
443,holt,"Captain Pembroke, how would you like your face on the NYPD website?"
444,holt,"In exchange for media attention, the Vulture will not bust you down or stand in the way of you two dating."
445,holt,Anything for the Nine-Nine.
446,holt,"Santiago, thank you for coming in. It's no secret the NYPD has an image problem."
447,holt,"Police approval ratings are, pardon my language, in the commode. All the headlines are about the bad cops, but there are good cops too, and I want to put up posters that showcase some of our best. I'd like you to be on the first one."
448,holt,"I think this campaign is very promising. Santiago, what's your take?"
449,holt,"I didn't ask you, and you're not a police officer."
450,holt,"Look strong, but fair. But approachable. But professional. And fun. But not too fun. This is your job. Can you handle all that?"
451,holt,Did you win?
452,holt,"That's enough, Gina."
453,holt,"And all I'm saying as a, if not the, boss here is, if you're not gonna support me, you can leave."
454,holt,"Well, you must feel like a celebrity. A regular Ira Glass."
455,holt,"Yes, this is unfortunate, but let's not overreact to one graffito."
456,holt,This is easily dealt with. I'll just issue a statement saying vandals will be prosecuted.
457,holt,I see.
458,holt,"Hmm. I'm surprised she hasn't marched in here to say ""I told you so."""
459,holt,Yes.
460,holt,"Gina, as you predicted, there was some backlash to the poster campaign."
461,holt,"I think a problem the police have had is our inability to admit our mistakes, so this campaign was, um...a mistake. You told me that, but I got defensive and didn't listen. I should have been open to criticism, as this department should be open to criticism. That's why I'm replacing these with...these. My email address is at the bottom, and I intend to respond to every message I receive. Before we put them up, I want to hear your thoughts."
462,holt,For whom?
463,holt,"Look, Gina, is that a talking raisin?"
464,holt,"The task force? Oh, I thought you'd be handing me another vapid PR assignment."
465,holt,But I'm his boss.
466,holt,What's going on?
467,holt,"Yes, yours is an idiot, and mine is a fork-tongued lizard witch. The Oolong Slayer. He's back."
468,holt,What's your plan?
469,holt,Wrong. We're gonna work the case in secret.
470,holt,"No one can know about this, understood?"
471,holt,"If I recall correctly, the Oolong Slayer last struck five years ago. He left behind no DNA or fingerprints, but he did leave his calling card, a tea bag in his victim's mouth."
472,holt,"Very cool—I mean, awful. What's our strategy?"
473,holt,Let's not overlook the fact that he turned his crime scenes into tea parties for dollies.
474,holt,"You look into the B&Es and I'll check out the juvie angle. Now, before we begin in earnest, I'd like to propose a toast."
475,holt,A 25-year-old port seems appropriate.
476,holt,To catching a serial killer.
477,holt,I'll take your word for it. The juvie angle didn't pan out.
478,holt,"Good work, Peralta."
479,holt,We create a diversion while Gina copies his customer files.
480,holt,"Let's do this. Oh, hey, pal, that's my ginkgo."
481,holt,I'm still young enough to beat that ginkgo out of your hands.
482,holt,"Partner. Not many people buy that tea, and only one has been doing so since the killings first began, and he has a record. His name? Braxton O'Reilly."
483,holt,Still counts. Let's get that psycho.
484,holt,Where is Braxton O'Reilly? Where is that psycho monster?
485,holt,Our condolences.
486,holt,"It was an error, but—"
487,holt,"I don't know why you insisted on eating here, Gina. It seems like your average greasy spoon."
488,holt,"Peralta, what are you doing here?"
489,holt,"No, no, we can't be seen together. Gina, did you know about this?"
490,holt,"Are you insane? We were just suspended for screwing up this case. I shouldn't even be talking to you. Wuntch can probably hear us right now. She has super sonar hearing, because she's a bat."
491,holt,"That's your dream. Mine was to run the Nine-Nine, and that will never happen again. Just give the case to Major Crimes."
492,holt,Am I invited? Drop the weapon.
493,holt,"Now say ""punk."""
494,holt,Punk!
495,holt,"Thank you, Peralta."
496,holt,"No, for giving me one last chance to be a real cop before going back to a lifetime of PR drivel."
497,holt,That's troubling.
498,holt,"No, no. I think you should take sole credit. Wuntch will only use it to sink me. I'm glad your dream came true, Peralta. Now, if you'll excuse me, the drivel calls."
499,holt,"Hello, squad."
500,holt,"Good news. The Vulture is out, and I'm back."
501,holt,I didn't. I guess someone just had my back.
502,holt,She wanted to make a proper entrance.
503,holt,"Good morning, Boyle. It's Halloween; I'm surprised you didn't put on a costume."
504,holt,Does it matter if I say no?
505,holt,"Squad, that's enough. You're making Boyle feel bad on purpose. He's Elvis."
506,holt,"Elvis Stojko, the Canadian figure skater."
507,holt,I never agreed to that.
508,holt,"The first year, by sheer, dumb luck, Jake eked out a feeble victory."
509,holt,Sad because the competition was so dismal.
510,holt,"This year's the tie-breaker, a final heist to decide once and for all the true king of the Nine-Nine."
511,holt,"This year, we both attempt to steal the same object, instead of Jake attempting to steal one from me."
512,holt,";The crown will be locked in this briefcase, which in turn will be locked in the interrogation room."
513,holt,"With the first pick of the draft, I choose Terry."
514,holt,I pick Gina.
515,holt,"Hang on, Santiago. I'm not sure I can trust you. You're Peralta's... paramour. Maybe you should be on his team."
516,holt,"Yeah, Amy's out. By midnight, whoever has the crown will be the king of the Nine-Nine."
517,holt,I'm good.
518,holt,"Yes, I'm the fool. You fool."
519,holt,"Sergeant, are you familiar with the Hungarian fencing term, Hosszú Gorcs?"
520,holt,"It's a strategy of letting your opponent win points early to give them a sense of overconfidence, thus exposing a much easier target for you later."
521,holt,"Of course. Jeffords, we'll rendezvous later."
522,holt,"Well, that's an intriguing proposition. You certainly could be useful—"
523,holt,"To Jake! I got you, Peralta! You're not fooling anyone!"
524,holt,"Because the cleavage cloaks the camera with its curves. That will be all, spy. Sorry I said cleavage."
525,holt,"It's go time, Sergeant."
526,holt,And...Ding.
527,holt,Time for the twin twist.
528,holt,"Nothing—just enjoying a taste of my favorite beverage, the soda pop."
529,holt,Hmm.
530,holt,Ahh. It's delicious.
531,holt,"Why would I have the crown, Jake? Isn't it still in the interrogation room?"
532,holt,"No, after you."
533,holt,"It was the worst thing in the world—worse than a fruit-forward Riesling. No, I'm not exaggerating. Anyhow, I cleverly ditched the crown in a trash can. Wait a minute so as to not arouse suspicion and then retrieve it."
534,holt,"I know you're joking, but on the off chance you aren't—No."
535,holt,Damn it. That son of a bitch is good.
536,holt,"Hello, Peralta."
537,holt,Midnight nears.
538,holt,Tick tock indeed.
539,holt,"You know it's ""for whom."" Don't try to provoke me."
540,holt,Wait—what?
541,holt,"Yes, I too need to be excused."
542,holt,I don't know who has it.
543,holt,"Oh, Santiago. There's my protégé."
544,holt,Janitor? Address? Al?
545,holt,I wouldn't have it any other way. You are my wisest detective.
546,holt,Love? Ha. What's love compared to the respect of a workplace superior?
547,holt,We should apologize.
548,holt,Fat chance.
549,holt,"Alpha Team, this is the Golden Sparrow. Rendezvous at Drop Zone Yankee."
550,holt,Or did you?
551,holt,"Of course we're looking for Al, you imbecile! Sorry."
552,holt,Al? Al? Where's Al?
553,holt,Good God. Are you Al the janitor?
554,holt,I don't understand what is happening.
555,holt,What?
556,holt,And I threw the crown in the trash can.
557,holt,Gladly.
558,holt,Drinks are on us.
559,holt,Drinks are on me.
560,holt,Just call the U.S. marshal who handles our case. She'll explain everything.
561,holt,Tell that to the Dutch Hookbill.
562,holt,And how do you propose to pull that off?
563,holt,I'm Raymond. I don't care for baseball.
564,holt,I don't think Evan gets what we're doing here.
565,holt,Jake!
566,holt,Ah!
567,holt,Why isn't he coming in?
568,holt,What would it take for him to intervene? Do I actually have to kill you?
569,holt,Ugh!
570,holt,I think so.
571,holt,"It's 2016, man. This is on you."
572,holt,There's nothing false about it. We committed several felonies and escaped from jail.
573,holt,"Figgis is in town, and we have no car, no money, no guns; we can't go back to our houses because the police are looking for us."
574,holt,Absolutely not.
575,holt,"Nothing, I just think that we can do it alone."
576,holt,"All right. The Nine-Nine bailed me out once before when I was taken hostage by Bob, a man I had put my trust in, like a fool. I don't want them to rescue me again. It's embarrassing. I need to clean up my own mess."
