person,text
Bob Ross,"- Hello, Im Bob Ross, and Id like to welcome you to the 20 second joy of painting series. First of all, let me thank you for inviting us back for another series of painting shows"
Bob Ross,"And if this is your first time with us, allow me to give you a personal invitation, to drag up your paints and spend a relaxing half hour with us as we put some of natures master pieces on canvas"
Bob Ross,"So Ill tell you what, lets start out today, have them run all the colors across the screen that you need to paint along with us at home"
Bob Ross,"And while theyre doing that, come on up here and let me know you what Ive got done already. I have a 18 x 24 inch canvas, but you use whatever size is convenient for you"
Bob Ross,"And this is a pre-stretched, double prime canvas. And Ive covered the entire canvas with just a thin, even coat, of liquid white"
Bob Ross,"And the liquid white is on there, only to make the canvas wet it makes it slick. It allows us to actually blend the painting on the canvas, so were not working ourselves to death here on the palette"
Bob Ross,"So Ill tell you what, lets grab an old brush and lets just have some fun today. Well start today with an old two-inch brush. Well go into a small amount of the Prussian blue"
Bob Ross,"This is a very strong color, takes very very little paint. Just pull a little out and then tap the bristles into it"
Bob Ross,"Im gonna reach right here and get a little bit of the midnight in black and just sort of mix them together. So we have black and blue, or blue and black. Whatever your preference"
Bob Ross,"Lets go right up here to the canvas. Now then, in doing landscapes, normally you want the whole thing to be darker at the top, and then lighter toward the horizon"
Bob Ross,"And by starting at the top and making little crisscross strokes, allowing the color to blend with the liquid white thats on the canvas, that will happen automatically"
Bob Ross,"Its very easy, just like so, well just make little xs, little crisscross strokes. Allow that color to blend, there. And If youre working on a dry canvas, this would be very difficult"
Bob Ross,"But since this canvas is wet, and youre continually blending color, this is very simple, very simple. This is truly the lazy mans way of painting. There we go"
Bob Ross,"And I think Ill have some big fluffy clouds in this one today, so Im just gonna leave an area sort of open here, and thats where my clouds will live"
Bob Ross,"Alright, Im gonna come down, oh I dont know, maybe to about like there. Just sort of let it happen, dont worry about it"
Bob Ross,"If youve painted with me before, you know that we dont make mistakes, we just have happy accidents. Because very quickly, you can learn to work with anything that happens here"
Bob Ross,"I think Ill have a little water in this, so while I have that same color on the brush, just Prussian blue and midnight black, just gonna put a little indication of some water here"
Bob Ross,"Maybe Ill put a little more color on my brush, make it a little darker, there we go. Alright. paintbrush strokes Theyre both in the outside in and leave an area open here"
Bob Ross,"If everything works just right, thatll look like a little sheen of light coming across the water. And it will certainly enhance your painting. There, I put a little more of the color"
Bob Ross,"Well go on the other side, do the same thing. But pull from the outside in. See if you start here and you go across, look all the horrible line you get here"
Bob Ross,And then you have to really work to blend that out. So start from the outside and pull toward the center. Or wherever you want your little light sheen to be here. Okay let me wash the old brush
Bob Ross,"Thats the fun part of this whole technique. Course they dont think so around the station here. Because Ive covered everything, as you will see. Put the paint thinner, shake off the excess"
Bob Ross,"paintbrush tapping chuckles And just beat the devil out of it. Okay now with a clean brush, we can just go across here and blend all this together"
Bob Ross,"paintbrush strokes There, but see that light spot still remains in there. Its not very distinct but its strong enough to indicate what were trying to show"
Bob Ross,"And we can blend the sky, and I dont want to overblend it. I like to have little areas that show variations, so its just not a flat, dead sky"
Bob Ross,"But in your painting, you sort of look at it, and you decide how you want it. And you step back and take a look see every once in awhile so you can see it from a distance"
Bob Ross,"paintbrush strokes There we are. Because if you back up and look at your painting, its much easier to see. Sometime when youre standing, this close to it, its sort of difficult to, to see"
Bob Ross,"Lets use a one-inch brush, then Im gonna make a happy little cloud up here in the sky. For that, lets take just titanium white. Ill be right back, dont go away"
Bob Ross,"A little big of the bright red, very small amount though. Put a little sunshine on this cloud. Okay lets go up here. Now then, very gently, and all were doing is just sort of tapping the canvas"
Bob Ross,Just let the corner of the brush touch and begin thinking where your little cloud would live in your little world. And this piece of canvas is your world
Bob Ross,And on here you can do anything that your heart desires. You can create any illusion that you want here
Bob Ross,"You can find peace and tranquility here, or you can make big storms that just, just depends on what your mood is that day"
Bob Ross,"There, painting is sort of a way of capturing the second of time and a mood, putting it on canvas"
Bob Ross,"And maybe a hundred years from now someone will look at your painting and theyll know that you had a fantastic day. And then on this day, you truly did experience the joy of painting. There we are"
Bob Ross,"Just sort of let these little things just work around and have fun, let them play. Clouds are very free, they may be one of the freest things in nature"
Bob Ross,"They just sort of float around in the sky and have a good time. There we are. Okay, now well go back to our two-inch brush"
Bob Ross,"paintbrush tapping Be sure its good and dry and very carefully, just gonna take the corner of the brush, the top corner, and just go in little tiny circles. Little, tiny circles"
Bob Ross,"I dont wanna touch the top edge up here at all yet. Very gently. This is two hairs and some air. Just whisper light, whisper light"
Bob Ross,"blows air Because you can destroy these little things that youve made in here very easy. Very light, barely touching, very gentle, caress it"
Bob Ross,"There we are, now- paintbrush tapping I just beat the brush to knock off any excess paint. Now very lightly we can fluff this cloud, we can lift it"
Bob Ross,"But this is a very gentle touch, just barely lifting upward. But you can see how that cloud is beginning to fluff up. There, and then very lightly, one hair and some air"
Bob Ross,"Just go across now takes out all the little tap marks, brings everything together and make some of the most fantastic clouds youve ever seen. And its very simple. paintbrush strokes Alright, shoot"
Bob Ross,"We got a nice little cloud there. Now that, maybe today. Tell you what. Lets build a very simple little mountain. Everybody seems to like mountains, so lets, lets make us one"
Bob Ross,"Well take us from black, some Prussian blue. Im gonna get a little van dyke brown too, what the heck. Maybe even alizarin crimson, just good dark color"
Bob Ross,"There, okay, now pull it out as flat as you can get it. Take the knife, cut across, then get a little roll of paint, and it should live right out on the edge of the knife"
Bob Ross,"You can see how its right out on the edge there. Okay, lets go up here. Now then you have to make a major decision. Come right up here. Now you have to decide in your world where your mountain lives"
Bob Ross,"Maybe, it lives right here. And you can make any kind of mountain that you want, its up to you"
Bob Ross,"Up to you, well just, well make something maybe today that maybe sort of resembles the Tetons or mountains in that area. And the Tetons have a, they have a lot of little points on them"
Bob Ross,"Little jagged, ragged things, and thats what well make. But you can make a mountain thats very smooth. Its totally up to you. Once again, painting is a very individual thing"
Bob Ross,Thats the reason we use no patterns and no tracings. Cause then were just painting somebody elses thing
Bob Ross,"I wanna teach you to make a world that belongs only to you and its unique to you and your personality. There, okay"
Bob Ross,"Now well take a two-inch brush, and we wanna grab this paint and pull it, and theres two things. Maybe the most important one, is it removes excess paint so the next layer will stick much easier"
Bob Ross,"But it also creates this nice, misty area at the base of the mountain. And mountains are always more distinct on the top, then they are on the bottom. If you can see the entire mountain"
Bob Ross,"Because theres mist and now we have wonderful pollution, that hang around down here at the bottom. And it breaks up and diffuses light, so thats why you have misty look at the base of the mountains"
Bob Ross,"Alright. paintbrush strokes And by using brushstrokes when you pull this, I hope thatll show up, but you can literally lay out all your highlights and shadows. Can you see whats happening"
Bob Ross,"Without being commited. Its sort of a sneaky little way of seeing what your mountains gonna look like before you paint it. But you can lay out everything, that easy"
Bob Ross,"Now then, lets just take a, well just use that same old titanium white, right here. Pull it out, once again, as flat as you can get it. Cut across, and a little roll of paint"
Bob Ross,"See, lets do that one more time. Cause thats so important, pulling out flat, cut across, little roll of paint. That easy, lets go up here. Now then, you have to start making some big decisions"
Bob Ross,"chuckles Ive mentioned before in other shows when I was teaching my son Steve to paint, I used to tell him, Just pretend youre a whisper, floating right across the mountain and youre not even"
Bob Ross,"touching it, youre just, youre just floating right across there.  There. See how you can create all kinds of little things"
Bob Ross,"Anything that you want, you just decide where these little things live in your world"
Bob Ross,"And just barely touching it, and you want the paint to break like this, thats what makes all those beautiful little, little things you see in there. And it happens automatically"
Bob Ross,"All you have to do is learn to make the knife barely, barely touch the canvas, gentle. We receive a lot of letters"
Bob Ross,"One of the things that I hear over and over again is people are having trouble doing this. Normally you can equate it to one or two problems. First of all, the paints too thin"
Bob Ross,"We use a very firm, dry paint. Much firmer than traditional oil painting paints. Secondly, the pressure that youre applying, if you apply too much pressure, its gonna look just like your ice to cake"
Bob Ross,"Everyday I get letters from people and they say, theyve watched the show and theyve tried it and its working, and they take the paintings and they show it to friends and relatives and they dont"
Bob Ross,"believe that they painted them. Thats always wonderful to hear. For a little shadow here Im taking little Prussian blue and white, and just mixing it here together"
Bob Ross,"Once again, you can even use a small edge, see and pull out a little roll of paint, or you can use a small knife, whichever is convenient for you"
Bob Ross,"We have two different sized knives, so pick out the one that you like. And you go back in here now, and begin putting in some little shadow areas. I want this to remain quite dark"
Bob Ross,I dont wanna get too much going on back here. These areas are deep in shadows here. There we are. paintbrush tapping But this is where you begin forming all these little things
Bob Ross,"This is where the little mountain goat lives, right up in here. He needs a little place to call home too just like the rest of us. And you have to take care of gods little creatures, there"
Bob Ross,"paintbrush tapping He could be over in here, like that. Wherever, wherever, just sort of let your imagination go"
Bob Ross,"And you can come right along in here and any place you wanna show a little, a little break here. You just put a little shadow and automatically itll happen"
Bob Ross,"Lets take another good clean, dry, two-inch brush. And I wanna create mist at the base of this mountain. So all you need to do is tap, but follow these angles when you tap, dont just chop across"
Bob Ross,"Itll look like, look like somebody took a big razor blade and cut your mountain off. Just tap and then gently lift upward. The same angle that the mountain flows here, same angle"
Bob Ross,"Itll create a beautiful, soft, misty effect, right at the base of your mountain. Okay, shoot, we got a pretty good looking little mountain there too"
Bob Ross,"Alright, lets, lets take the old round brush today. Im gonna use that same basic mountain color"
Bob Ross,"We had Prussian blue and black, little alizarin crimson, paintbrush tapping There, I think we had some van dyke brown. Im gonna reach up here get a little sap green put in there too"
Bob Ross,Lets start making some foliage leaves
Bob Ross,"Back here in front of this mountain, with the old round brush here, we can just take, and just begin tapping, paintbrush tapping Just aside basically, where you want these things to live"
Bob Ross,"There maybe theres a bigger one right there. Big strong one that lives right up here, wherever. You have to make big decisions. There they go, okay, little bit more of the color"
Bob Ross,"paintbrush tapping Alright, maybe, maybe theres a big tree here on the side. But just sort of let your imagination go. Think where, think of if you were a tree where youd like to live"
Bob Ross,"This tree, he lives right here in front of the mountain. He has one of the prettiest views. He looks out over this mountain, and watches, watches everything happen"
Bob Ross,"Sometimes, sometimes you get carried away and these trees keep growing on you. Thats alright. This is your tree. So you make it anyway that you want. Anyway that you want them"
Bob Ross,"In your world you can have anything. Anything, there. Okay, right on down, maybe, somewhere in there we dont care at this point. Lets see mix up a little more color"
Bob Ross,"Black, blues, some brown, little crimson. Little of sap green, ran out of color. There, now then maybe in our world, well have, shoot, lets get crazy"
Bob Ross,gently laughs Maybe theres another tree over here. Thatll sort of block everything in
Bob Ross,"Make sort of a nice composition, that way itll force your eye to go in here and look at this mountain when were done. There, got a little hair there"
Bob Ross,"You get a little hair, just use the corner of your brush and lift it off the canvas, no big deal. These brushes are natural bristles so they do shed. There, till you, till you get those out. Alright"
Bob Ross,"Okay now, maybe, maybe well have some reflections in our water, so all you have to do is just bring some of this color right down. Just let it go. paintbrush tapping Something like that"
Bob Ross,"If we have a tall tree on this side, then were gonna have very long reflections in the water. Alright. paintbrush tapping Okay now, we have to make a big decision. Where does water and land meet"
Bob Ross,"Somewhere right in here in my world. paintbrush strokes There, so just, just begin pulling this down"
Bob Ross,"We dont know exactly whats gonna happen, but somewhere in here well have all this come together. Doesnt really matter at this point. Now very lightly, go across"
Bob Ross,"And thatll create the illusion of instant reflections in your water, that easy. Now have several of each brush going. Let me pick up another little round brush here"
Bob Ross,"I would take a little cad yellow, little yellow ochre, be right back, Im gonna pick up little sap green, but mix these colors on the brush, that way you have a multitude of things happening in that"
Bob Ross,"brush. Look at all the different tones and colors. I dont know if you can ever mix that. If you just sat and tried to mix each one individually. Okay, lets go up in here"
Bob Ross,"And I just wanna put little indications of some little things, some little highlights on these trees. Just tap, thats all you gotta do. Just tap it"
Bob Ross,"But think about forming shape, dont just hit it random. Think about where the light would play through here, and all these little things would shine and sparkle. There, heres another one"
Bob Ross,"These are just some little background trees. Okay, very loose, right there. And it helps to make up little stories about your scene"
Bob Ross,"Give it, give these characters personalities and then they become individuals to you. Become very special, become your friends"
Bob Ross,"I wanna add a little big of that Indian young, a little bright red here and there"
Bob Ross,"I wanna give this a little, a little indication that maybe Jack Frost has been through here and had a good day and things are beginning to change colors"
Bob Ross,"There, and you can get as wild with autumn scenes as you want, this some of the most beautiful reds and golds in nature. Hmm. There we are"
Bob Ross,"Do you want a little more of the sap green, little cad yellow, maybe, whew lets put a big tree here. paintbrush tapping Think about individual things in there"
Bob Ross,"And once again, this is just gonna end up being a background tree. I think Im gonna put some things in front of it. But you wanna make it look pretty good, because a lot of it is gonna show through"
Bob Ross,"And people would think youve worked for months trying to get in there and put all those little, little individual things in there. And we dont tell them any different, thats, thats our secret"
Bob Ross,"Thats our secret. Cause a lot of people would never believe you could paint this much detail using a big old crazy brush like this. But you can, there. You can do anything"
Bob Ross,As long as you believe you can do it
Bob Ross,"You know it helps to mentally, when you decide youre gonna paint a picture, paint it mentally, several times, and get those strokes sort of worked out in your mind"
Bob Ross,"Know what you want, before you start. Have a general idea of what you want. But do it mentally, just like athletes, they psyche themselves up before big event. You can do that for painting too"
Bob Ross,"Okay, tell you what, maybe over here well put a nice little sparkler. Okay, before we go too far here, I better decide what were gonna do. Im gonna put some nice little tree trunks back in here"
Bob Ross,"So well take some paint thinner, paint thinner. Ill just use some van dyke brown for that, maybe a little dark sand and mixed with it. Give it a little, a little flavor"
Bob Ross,"But this paint should be very thin, almost like ink. This is a script liner brush, it holds a lot of paint, but it needs to be very thin. Lets go up here, maybe, maybe, maybe"
Bob Ross,"Yup, right here lives a big old, strong tree. A little more of the paint thinner, load the brush full again"
Bob Ross,"But let the brush wiggle and jiggle, so its just not a plain old, straight, telephone pole looking tree. I sort of like the trees to have character. There, be individuals"
Bob Ross,"I dont want all my trees to grow up to be just telephone poles. There we go, but maybe in your world, thats what you want. And theres freedom on this canvas, you can do anything here"
Bob Ross,"You can even string wire on your tree if you want to, its okay. There. And over there, this is the tree that lives right along, and he too has a beautiful view of the mountain. Alright"
Bob Ross,"paintbrush swishing in water And we can come back, Ill take a little paint thinner, and little, little white. But at least itll touch a bright red in it"
Bob Ross,"You can come right back in here, and add some highlights to your tree. Your mountain tells you the lights coming from the right side. That easy. You can make it a little tree to stand out there"
Bob Ross,"Okay, back to my brown. Dont want the other side left out, itll get jealous. And nothing worse than a mad tree, Ill tell ya"
Bob Ross,"And maybe theres a little that lives right here, in front of that great, big one"
Bob Ross,"But by doing it this way, painting that tree first and then painting trees in front of it, it creates the illusion of depth and distance in your painting. Its not, its not flat. Its not flat"
Bob Ross,"So many paintings I see are just very flat. This way you build depth. Youll be able to see between things and look back in there and just awe, its fantastic"
Bob Ross,"Ive painted literally, tens of thousands of paintings, and I still get excited every time I see this work. Every time there"
Bob Ross,"Okay just all kinds of little limbs and sticks and twigs and wherever you think they should live. But if that paint doesnt flow for you, chances are you dont have enough paint thinner"
Bob Ross,"Just add a little more paint thinner, youll, it will begin sticking on. Go back to my round brush onto a little yellow ochre, little bit of bright red, and just mix them together"
Bob Ross,"Well put some, maybe a little more of the red. Lets sparkle this up. Were gonna have fall colors, lets go crazy"
Bob Ross,"Maybe on this one here, we can see- Oh, thats a nice one, look at there, but right over the top of that other tree. Its alright, we dont care. There, see. Just pretend its not there"
Bob Ross,"Dont pay any attention to it. Cause you want it to look natural. In nature, one tree does not worry about being in front of another tree. It just grows wherever it can get to most light and water"
Bob Ross,"And thats where we want our paintings to look. There, and maybe theres a few, bright little things on this side. Look at there, this whole round brush is just fantastic things"
Bob Ross,"Even if youve never painted before, this son of a gun will just drop them right in there. Okay, maybe its a little land out here. We need something for this to stand though"
Bob Ross,Ill take a little van dyke brown. Lets go right in here. And lets decide where the land lives. And this is just the base color. Well come back and highlight it
Bob Ross,"Ill tell you what, maybe theres a little, a little peninsula that lives right out here. Wherever you want it, just sort of drop it in. On the other side here, just a little. There it goes. There"
Bob Ross,"Now, we can take a little titanium white, little dark sienna, kind of just mix them together but looslely so the colors not over mixed, and just barely, caress the top of that"
Bob Ross,"Just let it, just let it pick up here and there. Dont push hard though with the knife. This is just like laying snow on the mountain"
Bob Ross,"Cause if you push hard, its gonna destory the under color, and we dont want that. And lets take us a fan brush. Im gonna dip it in a little liquid white"
Bob Ross,"Just a thin pain because one of our golden rules, thin pain will stick to a thick paint. Take the same colors and mix them on the brush here. Alright, lets go up in here"
Bob Ross,"Just gonna push upward, with the fan brush. Just pop in a few little grassy areas that live right back in here. Follow the lay of the land here, thats very important"
Bob Ross,"This is where you create that flow of the land. Thats where its created, right here. Just by making these little areas, you can see exactly how this flows, there we go"
Bob Ross,paintbrush strokes Dont kill all your little dark areas. These dark areas at the base of trees and stuff are extremely important. Theyre the shadows deep in there
Bob Ross,"Thats where the little bunny rabbit hides. lightly chuckles And he has to have a place to hide. Take a little liquid white, pull it out very flat, cut across, lets get a little paint on here"
Bob Ross,"Lets just put us in a little water line. This light area separates the two darks, and cleans up the bottom and brings it altogether"
Bob Ross,"Just brings it together- act like youre trying to cut hole, right in the canvas. And this whole canvas is very tough, very tough. Okay, now then. Here we are"
Bob Ross,"paintbrush strokes Yeah, lets get crazy. gently laughs Lets get crazy. We got a minute or so left. And you know, if you painted with me, I like big trees"
Bob Ross,"We have one, see right in front of everything though. Lives right there. Just van dyke brown. And we take out same brown and white we used. Lets just touch, barely touch"
Bob Ross,"GIve it a little, a little pull here. Just a little pull, see. Maybe this whole, tree. Maybe its about dead. Just put a few limbs on it, and let it sort of just hang around out here"
Bob Ross,"A little paint thinner and the liner brush. And well just put a big old limb here and there. Just like so. Few of them still hanging on, still hanging on"
Bob Ross,"Not too many, dont want ruin the illusion that this old tree is just hanging around here and dead. Okay, I think we have pretty nice little painting there. Hope youve enjoyed this one"
Bob Ross,"And from all of us here, Id like to wish you happy painting, and god bless my friend. music playing"
Bob Ross,"- Hello, welcome back. Im certainly glad you could join us today. Its a fantastic day here and I hope it is wherever youre at"
Bob Ross,"So, I tell you what, lets start out today and run all the colors across the screen that you need to paint along with us"
Bob Ross,"While theyre doing that, come on up here, let me show you what weve got already"
Bob Ross,Weve got our standard old pre-stretched canvas and I use an 18 x 24 but you can use any size thats convenient for you
