person,text
Bob Ross,"Just mix em together, like so. Black, dark sienna, little alizarin crimson, very dark color though. Very dark color. Alright, maybe today well do a scene thats deep in the woods here"
Bob Ross,"I dont know, lets just start off and have some fun. Lets just take and begin putting in the indication of all kinds of little shapes"
Bob Ross,And well just start off tapping in some very basic little shapes and sort of see what happens. Just see what happens. Now I made this grey mixture today because I want this to be very subdued
Bob Ross,And this grey will mix with everything that we put on there and itll cause that to happen automatically. And if theres any of this grey showing through then itll look just right. There
Bob Ross,Just begin laying in all kinds of little shapes. And right now all were looking for is just some basic ideas. Were not looking for a lot of detail
Bob Ross,Well come back and look at what we have and then well begin picking out each individual little thing. Right now all were doing basically is blocking in some ideas
Bob Ross,"So we have the midnight black, dark sienna, a little alizarin crimson, maybe right here, what the heck. Well have some here too. Just let these things run right on through. There"
Bob Ross,"Now when youre playing at home try this liquid grey, as I call it, itll make some beautiful effects for you. Mix these mediums together. We have the clear, the black, the white, mix em together"
Bob Ross,"You wont believe some of the effects. Personally, I like to take a little of the liquid white and clear and put it together. And it gives the white, oh, it gives it a little bit of transparence"
Bob Ross,"Sometimes that comes in very handy for creating certain effects and certain illusions. There we go. Okay, a little bit more of the black and the crimson. There"
Bob Ross,"But see you can begin finding little shapes in here and all were using is just the corner of the two inch brush. But these little shapes will, theyll just sort of begin to appear. Its real easy"
Bob Ross,Its one of the nicest ways to sort of just lay out a little painting. There
Bob Ross,"Okay, now lets take our liner brush, well dip it in some paint thinner, and well go right into some of the brown, a little Van Dyke brown is fine"
Bob Ross,"Make this paint very thin, turn it, bring the bristles to a nice, sharp point. See how sharp that is. We like paint in there. Now then we can go up here and begin picking out little individual things"
Bob Ross,"If you have trouble making the paint flow off your liner brush then add more paint thinner. Its all you have to do. Keep the paint very thin, very loose, and itll just slide right off your brush"
Bob Ross,"See, and we can just put the indication of all kinds of little things"
Bob Ross,"In some of these light areas, these little holes here, there you just put the indication of a few little sticks and twigs that are showing through. There. See, maybe right in here, we dont know"
Bob Ross,"Well separate all this with highlights, were gonna come back in put all kinds of little highlights"
Bob Ross,"Right now all were interested in is just creating the illusion of a lot of little things happening in here. Okay, lets do that also over here on the other side"
Bob Ross,"Well need something going on over here too. There, maybe theres a tree there too, we dont know. Wherever, wherever. There. See, maybe back in here. All kinds of little doers"
Bob Ross,"There, and then you say, say theres one there. There he goes, right on up. Just sort of let your imagination just take you astray here. There we go. Maybe right in here"
Bob Ross,"But see, just by putting these little sticks in here you begin making out little individual things that easy. And itll just happen for you automatically"
Bob Ross,Practice this a little bit and youll be amazed at what you can do by just throwing some color on a canvas. Alright. Wash the old brush. And well just wipe it off on a paper towel
Bob Ross,And Ill just use the same little dirty brush since I have it going here
Bob Ross,"Lets take a little bit of the yellow, a little yellow, reach up here, grab a little black, we put that in there and thatll make a beautiful green color. There, tap it a little bit"
Bob Ross,"That gets that little roll of paint right out on the edge of the bristles. Okay. Now then, lets go up in here and begin picking up all these little individual things"
Bob Ross,"Maybe back in here lives a happy tree right there. Just think about form and shape for this tree. And just begin dropping him out. There. See there. There he is. We knew he was there, didnt we. Yeah"
Bob Ross,"And maybe add a little of the yellow ochre and Indian yellow, maybe way back in there, oh, there he is, theres another little rascal. Boy, my little squirrel would love to live back in here"
Bob Ross,"Theres so many things happening. There. So you just, just sort of look at these things though and drop em in. And all were doing is just using the corner of the brush"
Bob Ross,"Its really all we have going here, just the corner of the brush. But think about individuals. Lets add a little touch of the bright red here and there. There, oh, thats nice"
Bob Ross,"Ive probably painted 25, 30 thousand paintings now and I still get excited every time I see this work. Its fascinating. There we go. Are you beginning to see all these little things"
Bob Ross,"Isnt that exciting that it happens that easy. Shoot. Thats the joy of painting. That truly is the joy of painting, when you get to the point that you have no fear"
Bob Ross,"Lets go over on the other oval over on the other side here. We dont want him left out. See there, theres another little tree, little bush"
Bob Ross,"Little Indian yellow maybe and a little touch of the bright red, put a little sparkler way back there. See, just by varying color and shape and form you can create all kinds of things"
Bob Ross,"All kinds of things. There. I like these little paintings. They make you feel good inside and thats what lifes all about. Makes you happy. There. See, layer after layer"
Bob Ross,This layering effect is what causes it to have depth and distance and keeps it from being just a flat old piece of canvas. Theres dimension in there just because of the layers
Bob Ross,"Im gonna dip the brush into the least little touch of liquid white, just the least little touch. There. Okay. And we can come back in here and drop in all kinds of little rascals, theres another"
Bob Ross,"There. But see how, see how nice that grey works back in there for you. Its really a fantastic way to paint. Maybe Ill put another one right here"
Bob Ross,"See, you just keep seeing things and you just add more and more. There. Boy, I bet theres a mosquito or two that lives back in there. Thats a beautiful place. But you know what"
Bob Ross,"You know me, I think there oughta be, maybe lets have, lets have, I see something happening right here"
Bob Ross,"Lets take a little liquid white, a little bit of the, little bit of the titanium white, Ill be right back, dont go away, and a little touch of the phthalo blue. Little touch"
Bob Ross,"Okay, we have a very light blue on there now. Lets go right up in here. And maybe in our world, look right here, watch, watch, watch, watch"
Bob Ross,"Maybe theres a little bit of water just plays along and blip, falls over. See, just let it, blip. Gotta make that little noise. Maybe it just spills right along like that"
Bob Ross,"Comes right outta there, blip, there it fell again. Son of a gun, blip. Look at that, see, just blip, and splash when it hits. Push upward to make that splashy effect"
Bob Ross,And we have a happy little stream thats just running right outta there. That easy. Where is it gonna go. Now we have to start making some big decisions here
Bob Ross,"Tell you what, lets just take a, well grab a one inch brush here, and well take a little touch of sap green. Im just gonna throw it right there"
Bob Ross,"I wanna reflect all these nice colors right into the water. Put a little sap green there. Maybe, maybe a little yellow ochre. Oh, thats pretty. There"
Bob Ross,"Maybe even a little touch of white right through there. And there, a little bright spot. Maybe back to some green. This is just sap green on a one inch brush. Im pulling it straight down"
Bob Ross,"Straight down. Thisll let that blend together. Lets go over on the other side over here. Over in here maybe well have a little more of that. Shoot, that looks good. That looks good enough to eat"
Bob Ross,"A little yellow ochre right in there. Maybe, maybe, maybe a little more green. I dont know, but you can just put all kinds of beautiful colors right in here like this"
Bob Ross,"Now then, we get a clean two inch brush and I wanna grab that firmly and pull it down. Very firm. Grab it and pull down. Straight down, like so. And then across"
Bob Ross,"See that, makes it look like reflections in the water. There. Now then, lets go back to our little fan brush here"
Bob Ross,"Maybe this water comes right on down here, bounces around, and just begins to play and have fun. Shoot, we dont know where it goes. Just make all kinds of beautiful effects. You know what we need"
Bob Ross,"Lets have some little stones that live out here. For that let me get out a little liquid white and well put that right up here, like so"
Bob Ross,"And Im gonna add a little bit of dark sienna to that, maybe even a little yellow ochre. Just make a very nice, warm little light brown color. Okay"
Bob Ross,"Now then, well take our, lets use the old filbert brush, well go right into, well go right into a little dark sienna and Van Dyke brown mixed together"
Bob Ross,"Okay, now then, both sides of the brush, now right here well take one side and go through this thin color that weve made, see. Its brown on one side, light on the other"
Bob Ross,"And maybe up in here in our world maybe theres just all kinds of little stones. Look at that, see em. Just all kinds of happy little stones live up in here"
Bob Ross,And you can make as many or as few as you want in your world. Theres another one. These are just everywhere. They live right here in this brush. Maybe they come right over here. Just all kinds of em
Bob Ross,"All kinds of em. Maybe theres a big one here. Great old big one. Maybe, more paint, maybe, maybe right here. Just sort of make up your mind where you think they should live and drop em in"
Bob Ross,"Theres some. But make em all different sizes. Some are big, some are small. Theyre like people"
Bob Ross,"Im gonna grab the bottom of these and pull em down just a little bit, just the bottom, and then go lightly across. Thatll create a little reflection in the water. Just a little reflection. There"
Bob Ross,"See there. Now then, well take our fan brush, and it has liquid white mixed with titanium white with a least little touch of the phthalo blue in it. There. Okay, a lot of paint on the bristles"
Bob Ross,"Now then, well come right in here with this color and lets just begin to wrap a little water right around these rocks. Thatll set them right down into the painting, brings everything together"
Bob Ross,"See there. Now lets go over to the other side here. Maybe, here it comes, right on through, a little water right there"
Bob Ross,"And our world, maybe this waters coming along here and all of a sudden, swoop, falls over again. See there. You can drop that water over as many times as you want"
Bob Ross,"Maybe, maybe theres a stone that lives right there. You can have as many little rocks and stuff. Maybe theres another one down here at the bottom of this little waterfall. Its up to you"
Bob Ross,"Bring that water right there, and that pushes that stone right into it. Comes down, falls over. And well have a few little splashes down here where it hits. There. See"
Bob Ross,"Now we can take our paint thinner, little bit of the brown, thin it down very thin, and lets go back in here and put the indication here and there of a few more sticks and twigs and little things"
Bob Ross,"Now maybe down here in the foreground, maybe theres some stuff over here, so for that lets go back into our black, little dark sienna, little bit of the alizarin crimson, well just mix these on the"
Bob Ross,"brush. Tap a little bit of color right into the bristles, tap firmly. Alright, lets go up in here and lets decide where little things live over here"
Bob Ross,"There they are, theres a happy bush and he lives right there, like so. Get a little more color. And hes got a little friend here. There. Okay, good"
Bob Ross,These are so much fun to make and by putting some bushes here in the foreground that pushes everything back. See how far back this all went. Pushed that little waterfall way back in there. There
Bob Ross,"Maybe a few little things right in here. And we can take our knife and just go in here and scratch in the indication of a stick and a twig. There. Now, well just use that same old brush, Im lazy"
Bob Ross,"Its got color all over it, but thats alright. Well go right into the yellows here and the, lets see, weve got cad yellow, yellow ochre, a little of the Indian yellow"
Bob Ross,"Here and there were gonna touch a little bright red. Just like so. Okay, now then, lets go up here and put some highlights on this old bush. There. There he is. Just use the corner of a brush though"
Bob Ross,"And make all these little individual things. Little individual things. Little for this one. There. Maybe well touch a little red right here. Oh, thats nice, thats nice"
Bob Ross,Be careful with that red though. Too much of its distracting and almost invariably your eye will go to that red place. Almost cant help but look there
Bob Ross,"So dont get too much, can get too distracting on you very rapidly. Maybe right here. There. Okay, maybe a little sap green, little black here, there we go"
Bob Ross,"Over on this side maybe well put a few little leaves and stuff out here. There he is. Just all kinds of little things. Now you can make these as bright as you want em, or you can make em subdued"
Bob Ross,"Either way. I like em a little more subdued today, but maybe a week from now wed like to have em nice and bright again. Its up to you. And your mood changes continually"
Bob Ross,"And when your mood changes your painting will change. Its almost something you cant help, it just sort of happens"
Bob Ross,"Now I wanna take my little liner brush here and Im gonna take a little bit of paint thats almost white, very thin, and here and there put in a few little white trunks back here"
Bob Ross,"You always have some of those in the woods and they stand out very good against all this dark. They just sort of make it interesting. There. Just here and there. Okay, maybe a couple on the other side"
Bob Ross,"And we can just have some fun. Alright, Ill tell you what lets do, I think were to a point where we can take the contact paper off and lets see what we have"
Bob Ross,"So we just grab it, give it a pull, and there we go, we have two very nice ovals. Now we can really get crazy"
Bob Ross,"Lets take, well go right back to our original color, and I know Im gonna get a letter or two or 100 that say I like that painting just the way it was and you went and messed it up"
Bob Ross,But when you do yours if this is where you want it to stop then thats exactly the place to stop it. I wanna just show you what you can do with it here though
Bob Ross,"Lets go right out here into this area and lets just let these bushes and stuff continue a little bit, lets see what happens. Just let em continue a little"
Bob Ross,"Just sort of blend em right into the ones that you have and there they go. There. Now, lets go back, let me put just a touch of the liquid white on my brush"
Bob Ross,"The liquid white is there only to thin the color. Only to thin it. And well take a little of our color, oh, thats nice, tap the bristles, tap em into the color. Alright"
Bob Ross,"Now then, lets put a few little highlights up in here. All kinds of little things that are happening, just like so. There"
Bob Ross,"You know, its almost unreal to me with the completion of this series there will be over 230 Joy of Painting shows. Its a lot of shows, almost unreal to me"
Bob Ross,"And I hope youve had the opportunity to see em all if you want to. If you havent, give your station a call. Theyre donated to em free, so they can pick em up. Just let em know that you want em"
Bob Ross,"Cause if you dont let em know they dont know what you like and they like to hear from you. Tell you what, maybe down here theres a little bit of dirt"
Bob Ross,"Im gonna take some Van Dyke brown, lets go right in here. Lets put a little brown in here. There. Something about like so, I dont know, whatever you want. Let it go on out here"
Bob Ross,"Now then, well take a fan brush, put a little bit of our yellows and greens and all those different colors on it, and lets go up in here and well just pop in just a few little happy grassy areas"
Bob Ross,"right along in here. Wherever you think they should be. There we go. See there. That creates a lot of depth in your painting, a lot of depth. There. Oh, I see something nice"
Bob Ross,"And you know what we oughta do, we got a minute or so left here, lets have some fun. I always get in trouble right at the end of the show"
Bob Ross,"Lets take a fan brush and fill it full of Van Dyke brown, put a lot of color, and maybe a little dark sienna too. A lot of paint, lot of paint in there"
Bob Ross,"And maybe in our world there lives, are you brave. This is your bravery test for today. There lives, yep, you guessed it, a big old tree that lives right there. Big old tree"
Bob Ross,"But hes a happy tree, so its alright. Maybe hes got a friend that comes right down like that. There. I know Im gonna get some letters about this now. Gonna get in trouble about this. There we go"
Bob Ross,"Now then, lets take, lets take, heres a little titanium white, pull it out flat, cut across, and lets go up here, barely touch, just let it barely touch"
Bob Ross,"Maybe this is just a big old birch tree that lives right up here. Barely touch. Pull it. Maybe theres a little on the other side too. Just like so, there. See there"
Bob Ross,"Now lets do some on the other side. There. But when youre pulling this pull it sort of around. And all youre doing is barely touching the canvas, dont wanna put too much pressure on it"
Bob Ross,"Barely, barely graze it. There. Now then, lets go in here with our, well use the old liner brush, paint thinner, and well put in a few limbs on this big old, big old tree here"
Bob Ross,"Maybe theres one right here, comes right out, right over like that. There. Okay, well give him another one there. Wherever you want em. Just wherever you want em. Put a few right in there, like so"
Bob Ross,"There we go. We dont have to do too many. Ill put a few leaves on here, but just enough so you can see the indication of some here and there"
Bob Ross,"Okay, we can take our brush with the dark color, go back, tap in a few little things, like so. And well highlight those a little. There"
Bob Ross,"Okay, a little bit of the yellow, and lets come back in here and just put a few highlights on that. I hope youve enjoyed this one"
Bob Ross,"Its a very nice little painting, give you a lot of practice, and itll make you happy inside. The old clock on the wall tells me that its time to go, so well, think well call it a day"
Bob Ross,"Well call this one finished. From all of us, happy painting and God bless. gentle music"
Bob Ross,"- laughing Hi, welcome back. Im certainly glad you could join me today"
Bob Ross,"And I thought today wed just do a fantastic little painting, maybe sort of like a little fantasy painting, think youll enjoy it"
Bob Ross,"So I tell you what, lets have em start out, run all the colors across the screen that you need to paint along with me. While theyre doing that, let me show you what Ive done up here"
Bob Ross,"Today Ive taken a little black gesso on my standard ol 18 by 24 inch pre-stretched, double primed canvas, and Ive just sorta painted a little design right here"
Bob Ross,It just sorta goes around and right on into nothing there. Looks like a big eye or something right in the center
Bob Ross,"Now then, Ive let the black gesso dry completely, and then onto that, Ive taken a little bit, a very small amount of the liquid clear and covered the entire canvas. A very very small amount"
Bob Ross,"Then weve just made a mixture of alizarin crimson, little phthalo blue to make a lavender. And weve covered the entire canvas with it. And thats all we do"
Bob Ross,"The only reason I put the liquid clear on the top of the black gesso, is to make the application of the firm lavender color much much easier. Youll see that it really pays you great dividends"
Bob Ross,"And I thought today, thought today is such a fantastic day, that we just have a good time. So lets start out today with a little titanium white. Right on the ol two inch brush"
Bob Ross,"Shoot, get right in there with the big one. And well just load a little color onto the bristles. Just by tapping. Pull a little color out, well just tap it, sall you have to do"
Bob Ross,"Okay, lets go right up here. Now today, I wanna have a nice light shining right out of this area"
Bob Ross,"So were gonna start right in here with this very light paint, this pure white, and just begin working this outward. Just let it work outward. Just making like little criss-cross strokes right there"
Bob Ross,"This will be our light area in this painting. I wanna do a painting. I think in my mind I see a painting that. well, maybe theres big trees here and theres a stream of light coming through here"
Bob Ross,"Its just zinging right through there like that. And we can even take and pull it, and gives that impression already. But thats gonna be our light source in this painting"
Bob Ross,And these paintings can be done in a multitude of colors. Ive just picked lavender today because thats a nice color and its a nice day so I thought it would work well
Bob Ross,"But you can do em in phthalo blue, or sap green, or any of the transparent colors"
Bob Ross,"And if youre in doubt as to whether a color is transparent or not, take a little bit of it on your finger, just rub it on a black canvas"
Bob Ross,"If the canvas still looks black, then its transparent enough for what were doing. It may only be semi-transparent, but itll work for what were doing"
Bob Ross,"If you put it on here, like white for example, you put it on here and you can see the color, then its not transparent enough for what were doing. Okay, thats an easy way to try it out and see"
Bob Ross,"Lets wash our brush. Thats the fun part. Shake it off. laughing And just have a good time with it. Mm-kay, tell you what lets go right up here"
Bob Ross,"Lets have a little lavender, little phthalo blue, alizarin crimson, and well just sorta mix these on the brush"
Bob Ross,"I want this one, this lavender color, more to the red side, so well add more crimson than normal. There"
Bob Ross,"Im just gonna tap a little color into the bristles, be right back, Im gonna get a little touch of white. I wanna lighten that even more. There, maybe even a little more of the reddish color"
Bob Ross,"Good, I like that. Tap a little color, right into the bristles. like so. Okay, lets go right up here"
Bob Ross,"Maybe back in here, we can make out the indication of some nice little trees that are hanging over here. So all we wanna do here is just put the indication of some beautiful little branches right here"
Bob Ross,I dont want this to get too dark cause itll ruin that illusion back there. There. And all were looking for is very basic little shapes. Were not looking for detail at this point
Bob Ross,"Just very, very basic little shapes. Maybe back in here you can see the indication of some very soft little things. Mm-kay. Now then, lets take our liner brush"
Bob Ross,"Well dip it in a little of the paint thinner. little paint thinner, and well go right into that same color. We want this to be thin, like water though. Thin as ink"
Bob Ross,"And turn the bristles when you pull em out. Thatll bring it to a very sharp point. See there. Okay, lets go up here"
Bob Ross,"Now then we can go back in here, and begin putting here and there, the indication of a few sticks and little limbs that you can see, little trunks. There, see"
Bob Ross,"Just drop those on, wherever you think they should live. Thats exactly where they should live. There. Wouldnt this be a perfect place for my little squirrel to live"
Bob Ross,"I hope youve got to see him during this series. Ive showed a couple of times. Actually its a she. But, beautiful little creature. There we go"
Bob Ross,"Okay, maybe right here we can see something thats a little bigger. Just sorta let your imagination go here. Now then. Lets take. wash the ol brush. Let me find another two inch brush"
Bob Ross,"Well take a two inch brush here, and I wanna make a very, very light lavender color. Very light. So Ill pick up a little of that lavender that we were using, go into the titanium white"
Bob Ross,"maybe even a little more of the crimson. Ooh, thats nice. Thats very nice. Or you could use a little touch of the bright red, lets have a little of that. Thats even better"
Bob Ross,"Now, tap the bristles, once again. That loads that little, little edge of paint right out on the tips of the bristle there. Just give it a tap, a little push. You can see that"
Bob Ross,"see that little ridge of paint comes up right there. Theres also a corresponding one on the bristles, and thats what we actually paint with"
Bob Ross,"Now then, we can go up here, and the lights zinging through here, so we gonna have some very bright areas. There we go. Just tap em in. Mm, thats beautiful. And it works so easy"
