person,text
Bob Ross,"Lets have some little, like little rolling hills that live back in here"
Bob Ross,"Im gonna take, oh well use a little Prussian blue, a little Alizarin crimson, proportionately, much, much more blue than crimson. And, put a little white out here"
Bob Ross,"Maybe just a touch more of the blue. Ooh, thats nice. Thats nice"
Bob Ross,"So, I have the same color, but two different values here, by putting the white in it, this one, as you can see, is much lighter than this one. Alright, so lets take the lightest one first"
Bob Ross,"Lets go up in here. Come right up in here, and lets take, and lets just put us a very basic little shape. Something like so. Dont let these get too pointy"
Bob Ross,"This is a little, just a soft little hill. There. Just really push it into the fabric, and then scrape off all the excess. The value, or the color, will remain in the fabric"
Bob Ross,"Then well take our brush, and grab, and firmly pull the paint. Firmly pull it, just like so. There. We want it to get lighter toward the base. Okay, pull it right through there"
Bob Ross,"Think Ill have some trees over here, so Im not too worried about this side. I dont know, if we leave it blank, then for sure well have to put something over there. Alright"
Bob Ross,But thats really all you need. It gives the indication of a nice little rolling hill thats far away
Bob Ross,"And if you wanna make that illusion of depth and distance even greater, we go into that same color that we mixed, thats darker, and well once again pick up a little roll of paint on the knife"
Bob Ross,"Lets go back up in here. Come right back in here. Now then, lets drop right down like that, and lets just put another little hill in here"
Bob Ross,"It helps create that illusion of depth in your painting when you do that. Maybe it turns and goes up right there. I dont know. You decide. In your world, you make all these big decisions"
Bob Ross,"But once again, were firmly, firmly pushing that color right into the canvas. And then well take our two-inch brush, grab it, and just move the color"
Bob Ross,Allow it to actually just blend in the liquid white thats on the canvas. And you always want the base of the hill or mountain lighter than the top
Bob Ross,"And as you can see, look at the little light area in between these two. Thats a separator. Thats your good friend. Take care of it. Treasure it. There we are"
Bob Ross,"And sometimes Ill just dip the brush into a little color, sometimes its fun just to put a little dark area in there, and itll look like theres a whole other plane in there"
Bob Ross,"You can just play all kind of tricks, or you can take and lift gently upward a little bit, and itll look like you can make out the indication of little trees that live way back in the woods"
Bob Ross,"Way back on that hill. See there. I hope you can see those. Theyre quite small, but theyre there. Now then. Tell you what"
Bob Ross,"Lets take, well use that same lavender color, Im gonna add a little black to it. A little black, a little brown, little touch, maybe, of the crimson and sap green. There we are"
Bob Ross,"Lets go right up in here. Right under this, and we have to decide where well have some land areas. Maybe right in here. Well just put a nice little hill. And this is just the base color"
Bob Ross,"This is just, just so our light, our highlights will show when we put em on top of this. You could really put this on with a paint roller. laughs Doesnt matter"
Bob Ross,"Doesnt matter, but its a good place to practice with a brush. Cause so much of painting is a feel"
Bob Ross,"You, very quickly, you can feel just by touching the canvas, whether your paints too thick, too thin, you got too much on the brush. and it comes with just a little practice. There"
Bob Ross,"Now then, Ill just use the same old brush"
Bob Ross,"Im lazy today, I dont wanna wash em all, so well use the same old brush and go right into a little bit of the cad yellow, a little yellow ocher, maybe a little bit of sap green, There we are"
Bob Ross,"There. Just gently tap. See. You can see that little ridge of paint. Theres an identical one on the end of the brush, and thats what were after. Lets go up here. Now"
Bob Ross,"Just barely touch and tap downward. And this is one of the easiest, nicest ways of creating the effect of little fields or little grassy areas. Way back here in the distance. There"
Bob Ross,Just let the sun play through there. There we are. Okay
Bob Ross,"And sometimes, its fun just to take, and Ill just grab another brush here, I got a, it doesnt matter what you use, Ill pick up a one-inch, it happens to be handy. Doesnt matter, as I say"
Bob Ross,"Maybe theres a little tree that lives right here. Just a little bushy guy. There. We just put in a little dark color. And, lets give him a little friend. You know me"
Bob Ross,"I think everything needs a friend, even an old tree. Well take a little touch, a little bright red, a little yellow ochre, Im even into a little Indian yellow there. Just a little sparkly"
Bob Ross,"Get that little bit of paint right there. And lets go right up in here, and lets just, ooh, nice. Lets just put some little highlights on that little rascal right there"
Bob Ross,"And this little one here, he needs a few little things too. There"
Bob Ross,"Okay, now back to our color we were using, well come right in here, and just put a little grass down at the base of those two little trees. But see, that creates a whole other plane in your painting"
Bob Ross,"And these different planes are what give depth. Okay. Now, maybe, lets put a little more color right in here. We need that dark so light will show. There. Tell you what, watch here, watch here"
Bob Ross,"chuckles I get carried away. Maybe right here, maybe theres a happy little pond thats way back here. Pull straight down"
Bob Ross,"Im gonna get just the least little touch of titanium white and just sparkle it. Gotta make those little sounds, though, just pull it straight down, and then very gently, go across"
Bob Ross,"Very gently, just enough to wiggle it a little bit. Ill tell you, lets do it with a fan brush today"
Bob Ross,"Well take a little Van Dyke brown, a little dark sienna on the fan brush, and you can do it with knife, or you can do it with a fan brush"
Bob Ross,"Lets just put in the indication of a little bank, way back in the distance back here. This is just brown. Straight old brown"
Bob Ross,"Maybe theres a few little dark things that grow right along the edge of the water. Just lift upward, and it makes it look like little bushes, maybe little cattails that are dark in there, whatever"
Bob Ross,"Just make up little stories and drop em in. Little of the liquid white on the knife, and well come back in here and put a little touch of a waterline right along there"
Bob Ross,"Just act like youre trying to cut a whole in the canvas. There. Now then, well go back to our one-inch brush we were using, had black, Prussian blue, crimson, a little sap green. Same old colors"
Bob Ross,"Just should be very, very dark, though. Okay, now then. Maybe, just go, Im touching and sorta pulling downward. Just want a little touch of that lake left back here. Well put in some dark"
Bob Ross,"Alright, right there. chuckles Just sort of look at this and make a decision where you think it should be. Now. Brush is too slow, let me get a big one here"
Bob Ross,"You get lazy after a while, and you like these big brushes. Lets just fill this all in here with some of our nice, dark color. Once again, this dark is here only to make the light show"
Bob Ross,"Because without it, you just, you dont have any light. If you put light against light, you have nothing. If you put dark against dark, you have nothing"
Bob Ross,"So youre always playing games, light against dark, dark against light. Thats what makes it work. Just illusions. We only have a two-dimensional surface here, so everything is just illusions"
Bob Ross,"While were working on that illusion, lets get crazy here, what the heck. Take a look-see, decide, we said there was gonna be a big tree right here. Well, lets just have us a big tree"
Bob Ross,"Well just use the corner of the old two-inch brush. Same basic colors. Same colors. Let that old tree live right out there. Tell you what, while we got that going, lets have one over here too"
Bob Ross,"chuckles Youll get carried away with these, theyre fun. But you can make very detailed little trees and bushes with a two-inch brush"
Bob Ross,"It doesnt have to be a little Tiny Tim brush to make small things, or to make detail. You can make it with a very large brush"
Bob Ross,Its just a matter of practicing a little until it works for you and youre comfortable with it. There. Okay. Now then
Bob Ross,"Lets take, well use the old script liner brush, little bit of white, Im gonna reach down here and get a little titanium white, mix em together, maybe get a little more of the paint thinner on here"
Bob Ross,"Want this paint to be very thin, almost the consistency of ink. In fact, you can see it running there. Very thin. Lets go up here"
Bob Ross,"And here, we just put the indication of some little tree trunks here and there. A little more of the white. Yeah, thats better, now you can see em a little bit better"
Bob Ross,"And well put a few limbs and stems and all the little things that you need to hold up these happy little trees in here. Okay. Shoot, Ill tell you what, there might even be one over here. Who knows"
Bob Ross,"Wherever you want em. There. While I have that old brush going, Im gonna go into straight Van Dyke brown, same way, thin, very thin. Maybe, yeah. Lets do this"
Bob Ross,Maybe theres a little fence back here by the pond. Just goes right on down out of sight. And we can see some old rails still on the post. Makes it sort of interesting. Just breaks it up
Bob Ross,"Ill take a little light color, just put a little highlight on some of these. There. And we got a happy little fence that lives way back in the distance"
Bob Ross,"Back to our brush that has our greens and yellows on it. Little more of the sap green, oh there we go. Nice. Lets go back in here, and just begin tapping in some little grassy areas"
Bob Ross,"And while youre doing that, you know I get a lot of letters from fantastic people all over the country that send pictures of what theyre painting at home, from watching the show, and Id like to"
Bob Ross,share some of those with you. You would not believe what people are doing. This makes it all worthwhile
Bob Ross,"And a lot of people that are sending paintings have never had a painting lesson in their life, other than watching the television series. And this is what theyre accomplishing"
Bob Ross,"And maybe most important, it makes people understand and believe that they can do this. You dont have to be somebody special. Anybody can do this. You really can"
Bob Ross,"And that truly is the joy of painting, when you produce something like this, you know what a pleasure it is to give someone a gift that youve produced yourself"
Bob Ross,"Or to hang it in your home, and people come by and they say, You didnt do that. chuckles You didnt do that.  People wont believe that you can paint like that. But you can. You really can"
Bob Ross,"And every day, as I say, I see more and more evidences of it. Every day. Shoot, lets have fun. Maybe, in our world, lets have another little watery spot right here"
Bob Ross,"Just, just to break up the monotony a little"
Bob Ross,"There, just a little white, cause we have some blue, well, and we can add a little phthalo blue to the brush, if we want to, just to give it a little blue tone. There, okay. A little white"
Bob Ross,"And then, once again, just pull across. And now we have another happy little pond, right out here"
Bob Ross,"And, we can take our little grassy color, and lets come right down, and bring a little thing, a little peninsula right off into there. That easy"
Bob Ross,"You can just push that rascal right back in the distance. And just as many layers as you want of nice, beautiful areas down in there"
Bob Ross,"Tell you what, while we have this old brush going, lets go right up here. There we are. And lets just put some little sparklers on these trees. They need some nice little highlights on em too"
Bob Ross,There. And all were using is just the corner of the brush. Just the corner
Bob Ross,"There We load it exactly the same way as we did to make the grassy areas down below, but all were using is the corner, and going in the direction that we want these little limbs to hang here"
Bob Ross,"Touch a little bit of the bright red here, and lets put a little sparkler right in there. Ooh, thats nice. Like him"
Bob Ross,"Maybe a little yellow ochre, well give him a little friend that lives right there, and you can just vary these colors, back and forth, and put in all kinds of little things"
Bob Ross,"Alright, maybe on the other side over here, well give this tree some nice little highlights. And Im just using the opposite corner. There. Okay. But think about shape and form in your tree"
Bob Ross,"I know you get tired of hearing me say that, but thats probably the single most important thing, when youre making these trees. Its more important than what you use to make them with"
Bob Ross,"Its the fact that you give them form and shape. There we are. And thats whats gonna make your painting so special. And, the other thing, try to leave some dark areas at the base of your tree"
Bob Ross,"That gives the illusion of a big shadow underneath there. And it creates depth, once again"
Bob Ross,"Or if you feel that somethings needed in there, make it something very dark, like a very, very dark, dark green that you wont see so much. There. See, like that. Alright"
Bob Ross,"Lets go back to our little fan brush here that has the Van Dyke brown on it, and we can just, here and there, put a little touch of the brown to give the indication of a little dirt down there"
Bob Ross,"Lets take, lets have some fun. I like to do this. Well take a little liquid white, a little bit of dark sienna, a little Van Dyke brown, were gonna make a very thin paint here"
Bob Ross,"Just the consistency of liquid white, with a little bit of flavor in it. And well take our little filbert"
Bob Ross,"Well go right into Van Dyke brown, little dark sienna, just mix em together, but a lot of color on each side of the brush, a lot of color"
Bob Ross,And well go right down here and pull one side through this thin color
Bob Ross,"And, lets put, just the indication of some little stones that live, theres one out in the water, that live out here in our world. Wherever you want em"
Bob Ross,"And we can come back, little touch of the liquid white, go right in here, and just clean the bottom of em up some. There"
Bob Ross,"But isnt that a sneaky little, nice way of making some very effective little stones out here in your water. Tell you what lets do. Lets take a pull the contact paper off. And see what we have"
Bob Ross,"Alright. And you know me. laughs I never leave well enough alone. I think today, Ill just use the old fan brush that has the Van Dyke brown on it, and in our world, stand back and sorta look"
Bob Ross,"I like to have something that sorta projects right out of the scene when we do these little ovals. I just, I think thats neat. And maybe when you do yours, you dont want to have this big tree here"
Bob Ross,"Its up to you. Its really up to you. I just sorta like these. Now, lets put a little background material behind the tree. Just a dark color. Maybe theres a little bush back here"
Bob Ross,"Maybe this little bush comes right over. That way, itll push everything back. Hows that. Maybe it just sorta disappears into nothing. Whatever. Anyway that you want it"
Bob Ross,Back to our old two-inch brush that has the highlight colors on it
Bob Ross,"Put the least little touch of paint thinner on the brush so the paintll be much thinner, because were getting in quite a few layers of color here"
Bob Ross,"And as you know, the thin paint will stick to the thick paint. Thin to thick. And, maybe theres another one here. Just all kinds of little bushes. Get a little more of the sap green"
Bob Ross,"Lets just tap in some little grassy areas that just flow right down from there. Just like that. Now, sometimes its fun to do little things"
Bob Ross,"You have to make big decisions when you paint, because you have unlimited power. see, this tree right now, get a closeup on this tree. It looks like its behind those bushes. Now watch"
Bob Ross,"But pulling this through, we just put the tree in front of the bushes. chuckles And well put in a big old root that hangs out right down there. Shoot, see what you can do. Now"
Bob Ross,"Lets take paint thinner, were going to Van Dyke brown, well load a lot of color there. A lot of color. Very thin. Maybe hes got a little buddy. A little friend, lives right there"
Bob Ross,"Got a couple little arms on him, like that. There we go. There. Just a little guy that lives here"
Bob Ross,"Now, sometimes its fun, just load the liner brush with the Van Dyke brown and dark sienna mixture, then pull just one side through a little bit of that liquid white with a little color in it"
Bob Ross,"And you can make a nice thing thats already highlighted, that easy"
Bob Ross,"And if you wanna highlight the whole tree, we can take a little of that thin color on the liner brush, you can do it with a knife, whatever"
Bob Ross,"And just blend it back, so it gets darker, darker, darker as it works around the tree. Look at there. Isnt that sneaky. And it works so easy. Youll like it. There we are"
Bob Ross,"Now then, a little more of the paint thinner, and lets just begin putting some nice little limbs off this. There we go. And you put as many or as few as you want in your world"
Bob Ross,Just sort of let em go. And this is where it really pays if you got a little twitch in your hand. There
Bob Ross,Because you can make all these beautiful little limbs and dont want em all just exactly straight. Limbs grow every which way. Let em grow. Let em go. Just wherever you want em
Bob Ross,"Maybe right theres a old big one that comes right on off. There. Something like that. Okay, now, lets go down here, take a little of that Van Dyke brown, lets just do this real quick"
Bob Ross,"Take a little white, a little dark sienna, come right down here, and just barely touch, put the indication maybe of a little bit of grass down here"
Bob Ross,"And we can just take a fan brush, finish this thing up, pop in a few little happy bushes, right along the base here. And it makes one of the most interesting paintings"
Bob Ross,"I hope you try this one, cause I know that youll really like it. And when you show this one to people, theyll certainly get excited. Hope youve enjoyed this one"
Bob Ross,"From all of us here, happy painting, God bless, my friend"
Bob Ross,"instrumental music - Voiceover This program is brought to you by North Light Books, publisher of over 200 how-to books and videos for fine artists and graphic designers"
Bob Ross,"And by Langnickel, manufacturers of selected artist brushes"
Bob Ross,"- Hi, welcome back. Certainly glad you could join us today. Lets do a fantastic little painting together"
Bob Ross,"So tell you what, lets start out and have them run all the colors across the screen that you need to paint along with us"
Bob Ross,"And theyll come across, as usual, In the same order as I have them on the palette, starting with the white and working around. While theyre doing that, let me show you what Ive got done up here"
Bob Ross,"I have my standard old pre-stretched, double-prime canvas up here. I use an 18 by 24, but you use whatever size is convenient"
Bob Ross,"Now, today Ive covered the entire canvas with a thin, and let me say that again, a thin, thin even coat of liquid clear"
Bob Ross,"Now when youre using this clear, I say thin several times because you need such a very, very small amount. Its transparent, you cant see it. Theres a tendency to put too much on. Very little"
Bob Ross,"Okay, and with that, lets just have a good time today. Im gonna take little yellow ochre maybe. Little bit of yellow ochre. Lets just do a winter scene today thats very nice"
Bob Ross,"Ill be right back, let me get a little, little dark sienna mixed in with it. A little winter scene that is warm. Lets go up here"
Bob Ross,"Sometimes winter scenes can become so cold, theyre almost unpleasant. So lets do one today that has a lot of just beautiful little things happening in it"
Bob Ross,"And we just start out and use a two-inch brush and just make little circles and little patterns, just let all these little things just happen. There you go. This is a time to have fun. Just enjoy this"
Bob Ross,"Let it work and play. But try not to, I dont want to have just a dead old flat sky today. I want to have something that has movement and life in it, and is interesting, and its fun"
Bob Ross,"So by doing these little circles, going one way a while, then go the other way a while. Look at what happens. Look at all the forms and shapes that are happening. Just automatically"
Bob Ross,"Okay, a little more color. Put a little over in here. There. And try not to stay in one area and keep working it. Because itll just look like its dead. Its not interesting. There we are"
Bob Ross,"And this clear does not dilute the color. If you had liquid white on the canvas like wed normally use, it would dilute the color, because it would blend with it. And the white would continually mix"
Bob Ross,And today I thought wed just do something where we dont mix color. Alright. Maybe just a touch more color. We put a little something right up in here
Bob Ross,"Alright, boy that is a fantastic way of making a very effective little sky. Now then. Now comes the fun part. Lets wash the old brush"
Bob Ross,"If youve painted with me before, you know thats the most interesting part of this whole technique. And we wash our brushes, as usual, with odorless paint thinner"
Bob Ross,"Just shake off the excess and, cover everybody in about a two-block radius"
Bob Ross,"When youre doing this at home, you might want to get a little brush beater rack that you put down in the bottom of a waste paper basket, and itll save your happy home. Okay, now"
Bob Ross,"Im just gonna take a little bit of titanium white, right on that same old two-inch brush. Just a little, we dont need much. And lets go up in here"
Bob Ross,"And lets just start, maybe thisll be our light area. And lets just sort of bounce that around. Just bounce it around, let it play. There. Im using just the corner of the brush, though. Okay now"
Bob Ross,Sometimes its nice to leave the sky like we had it a minute ago. Sometimes its nice to take like this and add highlights to it. Its up to you
Bob Ross,"This piece of canvas is truly your world, and you can do anything here that makes you happy"
Bob Ross,"Its such a fantastic day here, I thought Id put a little bright spot in the sky, and I hope the painting brings a little brightness to your life when you do it"
Bob Ross,"But we dont need a great deal, I just want a little. Because I dont want to lose all these beautiful patterns that we have up here"
Bob Ross,"There, a little more white, you can make this as bright as you want it, and the more you blend it, of course, the more the dark sienna and yellow ochre will mix in there and dilute it. Okay"
Bob Ross,"Maybe just the least little touch right in here. Just so theres a little contrast in there. Maybe in our world, theres a little bit of light that zings right through that little cloud. Okay"
Bob Ross,"Now then, very lightly. Two hairs and some air, we can just blend that out. Alright. And that makes a very good, very effective little sky that you can do in just a couple of minutes"
Bob Ross,"And once again, we get to wash the old brush. Alright. Okay. I tell you what lets do. Lets mix up, lets make a little lavender color"
Bob Ross,"Well use a little alizarin crimson, a little touch of phthalo blue. Proportionately, much, much much much much more of the blue than crimson. Okay, and well put a little white out here"
Bob Ross,"And dilute that color down. Just value it down. Ooh, thats a nice lavender color. Alright, well grab the old two-inch brush here. Lets just take a two-inch brush and tap the corner"
Bob Ross,"Im just gonna tap the corner, see. Right into a little bit of that color. Were not getting a great deal of paint on the brush"
Bob Ross,"Well go up in here, and maybe in our world there lives just the indication of some very, very soft little bushes back in here"
Bob Ross,"And all were using is the top corner of the two-inch brush, and with this we can form basic shapes. And thats all were looking for"
Bob Ross,"I dont want these to be too distinct, because then theyll look like theyre too close to us. I want these to be far back in the distance. Very basic little shapes. Alright, very good"
Bob Ross,Something about like that. And wherever you think they should be
Bob Ross,"And you can vary these a little bit, some of them be a little darker than others, and the ones that are lighter like that, when the painting is finished, will look like theyre much much farther away"
Bob Ross,"So if you put one in front of it thats a little darker, itll help strengthen that illusion. Alright. Sometimes we can even take the brush and just push sideways like that"
Bob Ross,Itll make it look like a little tree thats far back in there. There we go. Little bit more of the color. Put a little darker one right here in the foreground. Whatever you want
Bob Ross,"Just let your imagination go when youre doing these. Okay. Now sometimes, Ill show you a little trick. Let me show you something thats a great deal of fun. Okay, let me get a clean brush"
Bob Ross,"Sometimes its fun to just dip just the corner of the brush, just the corner, into a little paint thinner"
