person,text
Bob Ross,"Weve been using the old fan brush here. We can come right up in here in this dark, and just by rubbing with a little color, it doesnt take much color"
Bob Ross,"You can begin putting in all your little land areas. Leave some of that dark, especially along this edge. Itll make it look like a bank. And you wont have to do anything"
Bob Ross,"Im lazy, if I can find an easy way to make paintings work, thats what Im looking for. See there. Already, it looks like theres a bank there. And you havent done anything"
Bob Ross,"Really havent done anything. Thats sneaky, huh. I like that. Lets go back into some of the Yellow Ochre, a little Dark Sienna, Cad Yellow, Indian Yellow, all those pretty colors. Tap a little"
Bob Ross,"Right on the corner of the brush again. But see that pushing, thats so important. Get that ridge of paint, being pushed up there. Okay, lets go right up here"
Bob Ross,"Maybe in our world, there lives some bushes and stuff over in here. There he is, there is a nice little bush. Beautiful little bush. Think about shape though. And hes got a friend, right there"
Bob Ross,"See there, maybe theres a bigger one, lives right here. They come in all sizes and shapes. All kinds of personalities, just like people"
Bob Ross,"But no matter, who you are, or what your size or shape, or anything else is, you still need a friend. Everybody needs a friend. Oh, isnt theres a nice bright red one"
Bob Ross,"That rascal jump out and grab you. I like that so much, maybe well just do another one. Reds pretty in there. Little more of the yellows"
Bob Ross,"Now well begin layering, and heres another bush in front of those"
Bob Ross,"This layering effect will, once again, I know you get tired of hearing it, but this layering effect causes the distance and depth in your painting"
Bob Ross,"Now, you can begin thinking about maybe little grassy areas are growing over here. Just by tapping downward, we can create that illusion. Maybe they come right on out like that. I dont know"
Bob Ross,"brush tapping canvas Let your imagination go. Let it go. There. See there, that sorta begins giving you the lay of the land. This side has much more of an angle on it than the other side"
Bob Ross,"That keeps em from both being the same. Maybe it helps it from being boring. All right, going back to my fan brush"
Bob Ross,"Well take a little dark color, and lets just go in here and scrub in the indication of a little land underneath this. There, we just scrub it in with a fan brush"
Bob Ross,"You could do it with a knife, if you wanted to. Doesnt much matter. Maybe theres a sandbar here. Seems like we had a nice sandbar. Put in a little dark color first"
Bob Ross,"brush sweeping across canvas Then we can go back with a little white and brown. Very gently, grab it, and go back. Thats all you need to create that illusion"
Bob Ross,"There, but dont kill all that dark area. Leave some of those nice dark areas. Maybe the sands wet there, or somethin. We dont know"
Bob Ross,"Look at there though, thats just such a super way of making a very effective little painting. Now then, lets go on with our little bushy things. Maybe theres a little touch of green here and there"
Bob Ross,"Little Sap Green, not much, but a little. This comes down, now think about this. This is laying flat and this is coming down at quite an angle. So we want to show that"
Bob Ross,"So begin creating that very angle. Maybe, tell you what, maybe were standing up here in the hills, sorta overlooking this and it comes right on around. Right on around like that"
Bob Ross,"brush tapping canvas There we go. But the angles here are most important. Watch here, watch here, watch. See. Just think of the lay of the land and have your brush going that basic direction"
Bob Ross,Thats really all you have to do. Thats all you have to do. The Black Gesso works for you. It puts all the dark in here for you
Bob Ross,"In that under color, the transparent color we put on top, mixes with all this and it keeps your colors beautiful. Just nice things happen"
Bob Ross,"Let me find another fan brush here, I have several of em going. We had a couple of trees in that. So lets take Van Dyke Brown on the fan brush. Just back and forth quite a bit. Maybe touch"
Bob Ross,makes swooshing sound Be brave. This is your bravery test. Lets give him a friend too. makes cascading sound Well do a couple of happy little trees here. Maybe this ones a little stronger
Bob Ross,That way one looks bigger than the other one. Maybe he takes care of this little one. Doesnt allow anybody to hurt him. Everybody needs a big friend
Bob Ross,"Tell you what, maybe this is one tree and maybe its dead. Maybe its dead. In nature, you have a lot of dead trees out in the woods"
Bob Ross,"Sometimes, we avoid painting them, but dead trees are also part of nature. There we go, little bit of paint thinner on the liner brush. Lets go right up in here"
Bob Ross,"Lets just begin putting in all kinds of little limbs that are still hanging on here, even though the tree is dead. There are still a few of em here that are hanging on for dear life"
Bob Ross,"Think thats not right, theyre hangin on for dear life, theyre not dead. But anyway, you know what I mean. Theyre hangin in there. And you put as many or as few"
Bob Ross,"You have to determine how dead your tree is. Maybe it doesnt have hardly any limbs left on it. Its also fun, try this, maybe, and put one of them thats fell down right across the stream there"
Bob Ross,"Make a little natural bridge. That way the little raccoon has a place to sneak across there. There we go. And, whatever you want. Now then, maybe a little highlight on those trees"
Bob Ross,"In my mind, lights gonna be zingin through here. Take a little bit of that light brown and white. Im just gonna take and touch"
Bob Ross,"Just touch, just touch, the canvas will pull off what it wants, and as you work back, because youre pickin up that dirt, dark color. Itll get darker and darker automatically"
Bob Ross,"There, just enough to give it a little highlight. Thats all were looking for. There we go, see. Sometimes, its fun if were gonna have light coming through here, sometimes its fun to take"
Bob Ross,"Ive got the same ol brush here that I had all the yellows on, etc. That I was makin the grass with, and I went right into a little bit of the Titanium White. Wanna lighten. Push it, same way"
Bob Ross,"Lets go up here. Now, think where the lights gonna come"
Bob Ross,"If its coming right through here, you can just take this and tap a little bit of highlight, right in the areas where you think light would strike the strongest. Right in here, okay"
Bob Ross,But dont overdo it. If you overdo it loses its effectiveness. There. Something like so. I think we about have a finished painting with that
Bob Ross,"Im gonna take the liner brush, little bit of paint thinner, little of the Bright Red. Im gonna sign this one. I really hope youve enjoyed it. Its a lot of fun"
Bob Ross,"Allows you to show how our opening was made. It only takes a couple of minutes to paint it, but it takes a lot of fantastic people a great deal of time to stick it in that little square that you see"
Bob Ross,"I sincerely appreciate everything they do. So from all of us here, Id like to wish you happy painting. God bless, and Ill see you next time"
Bob Ross,"- Hi, Im glad you could join me today, because today I think well do a fantastic little winter scene and I think youll really like this one"
Bob Ross,"So I tell you what, lets start out, have them run all the colors across the screen that you need to paint along with us"
Bob Ross,"Okay, I have my standard old 18 X 24 inch canvas up here and today weve taken a piece of contact paper and weve just cut a design out, sort of a little half circle type thing in whatever kind of"
Bob Ross,"design you like. Then Ive covered this with liquid white. So its all wet and slick and its ready to go. So, lets have some fun"
Bob Ross,"Sometimes when we do winter scenes, we use so many blues and cold colors that theyre almost uncomfortable, so I sort of like to make very warm winter scenes"
Bob Ross,"Well start with a little Alizarin Crimson today on a 2-inch brush, and just tap a little color right into the bristles,like so"
Bob Ross,"Lets go right up here and maybe right in here well just use our little criss-cross strokes, put in a happy little sky, just making little Xs"
Bob Ross,"It takes very very little color, because if youre not careful, you could set the sky on fire, and we dont want to do that. We dont want to set it on fire. All we want to do is warm it up a little"
Bob Ross,"There we go. Okay, maybe well have a little of that same color down here"
Bob Ross,"If its going to be a winter scene, well have some snow in here, and this will come through and make some very nice highlights and shadows in the snow"
Bob Ross,Its also a good way to clean all the excess paint off your brush. Now then
Bob Ross,"Lets take-- we just mix it on the brush here, well take little more of the Alizarin Crimson, get a little touch of the Phthalo Blue"
Bob Ross,"Proportionately much more crimson than blue and you can just mix these on the brush, see. Like so. You dont have to worry about it"
Bob Ross,"Try and make sort of a nice lavender color, and you can take it to the blue side or the red side, depending on what kind of mood youre in"
Bob Ross,"Today is such a beautiful day, lets just make a very nice, very nice lavender, sort of to the reddish side. And lets just go right up in here and just drop that in, like that"
Bob Ross,Still using the criss-cross strokes. There. And maybe well use a nice little cloud that comes right out here. We just take the brush and tap. Just tap it wherever you want. Its up to you
Bob Ross,Its up to you. Its very individual
Bob Ross,"And maybe down in here, we know, we can just scrub in a basic little cloud shape were really not looking for a lot of detail at this point, all were doing is just building us a happy little sky"
Bob Ross,"There. And we can take a little bit of that same color and once again, just lay some of it down here, where we know theres going to be snow. At this point we really dont care where its going to be"
Bob Ross,"Anything we dont like we just cover up. Were not committed at all. Okay, lets do the fun part here, lets wash the old brush"
Bob Ross,"As you know, we wash our brush with odorless thinner, and we shake off the excess, and just beat the devil out of it"
Bob Ross,"I really recommend if youre going to do this at home, dont do this in your living room, or your popularity is going to go down about 38 points in one brush cleaning"
Bob Ross,"They make a thing called a brush beater where you put it down in the bottom of a trash can, you shake the brush inside of the can, then beat it on this rack"
Bob Ross,All of its done inside the can and it contains every bit of this
Bob Ross,"And just to stay in good around the homefront, I really recommend you get some kind of procedure not to do this in the living room, or wherever you paint"
Bob Ross,"Take a little bit of the Titanium White on the fan brush just a little, both sides full of color. Okay, lets go up here"
Bob Ross,"Now then, maybe there lives in our world a beautiful little cloud and it just floats around up here in the sky, it just enjoys looking over the scene"
Bob Ross,"Just use the corner of the brush, thats all were using, just the corner, making tight little circles. There. Very, very tight little circles"
Bob Ross,"And we dont know where this goes, maybe just sort of disappears up here. Well just sort of leave it to your imagination. There"
Bob Ross,"A little more white down here, maybe theres a big old floater that just floats around down here close to the horizon. Alright, now then"
Bob Ross,"With a clean, dry, and it really needs to be clean and dry, 2-inch brush, we want to blend just the base. Were not touching the top at all. Just the base"
Bob Ross,"Very gently, and you just sort of wind it up, blend it together on the base. On the bottom. There. Very gently. And were only using the very top corner of the brush"
Bob Ross,"Thats all thats touching the canvas. There, see there. Just a little. Mix it up, wind it. Now, very gently, big circular strokes will lift that. This fluffs your cloud up. There"
Bob Ross,"Just fluff it up, very lightly. mumbling Just blend it a little, and that whole thing will come together just as neat. And then you go back in here"
Bob Ross,"Maybe in our world there lives another little cloud right here. Work in layers, though. Do the cloud that in your mind is the farthest away. And then work forward"
Bob Ross,"Maybe hes got a little arm sticks right out like that. There. Okay, back to our cleaning. Dry, 2-inch brush, and I do the same thing over again. Thats all there is to it. Okay, fluff it"
Bob Ross,"And very gently, just blend it. Isnt that a beautiful way to make a very effective little sky. And you can do that. You really can do it. Its quite simple. Okay, tell you what"
Bob Ross,"Lets take the old round brush today and Ill make some little background trees back here, just some beautiful little things, maybe well even put some snow on them, who knows"
Bob Ross,"Lets go right up in here, well take-- let me mix up some color. Lets mix up some Phthalo Blue and some Alizarin Crimson Well just make a nice lavender color today"
Bob Ross,"And this mixture proportionately, much much more crimson than blue. Because the blue is 100 times stronger than the crimson. There we are"
Bob Ross,"And if you want to tell what color that is, you need to take a little bit of white and mix it up. Its hard to tell, that just looks black"
Bob Ross,"Thats a little bluer than I really want, so Ill add a little more of the crimson to it. See. You can change your mind, you can change the taste, the flavor, whatever"
Bob Ross,"Maybe you want it into the bluish side. Its very individual. Its up to you. Now then, lets use the old round brush today, its a fantastic brush, make some nice little trees and stuff"
Bob Ross,"And well just tap a little color right into the bristles. Tap firmly. See there. Its hard to see, the old brush is so dark. There we go, just tap it. Now, then"
Bob Ross,"You know, its interesting, in one of the earlier shows I showed my little pet squirrel and we got so many cards and letters Im going to put that little rascal up there again and let you see, because"
Bob Ross,"he was the cutest little thing. This is how it looked when we first got him, and thatll give you an idea, hes sitting on Annettes hand. Now theres what he looks like today"
Bob Ross,"Hes just the cutest little devil, we call her Bobette. And she is a mess. But she lives with me, has a great big cage, we call Squirrel Hilton. Oh. Got me on the nose there. Son of a gun"
Bob Ross,Squirrels are something else. But shes about to the age where shes not going to be friendly anymore. About ready to go back to the wild. So well turn her loose here very soon
Bob Ross,But she is something else. I thought you might enjoy just seeing that little rascal. All Im doing is just tapping in some basic little tree shapes. I have a tremendous love for these little creatures
Bob Ross,And devote a lot of my free time into helping them and taking care of them. Whatever I can do to make their life a little easier
Bob Ross,"And if were going to have animals around, we all have to be concerned about them. Help us out"
Bob Ross,"Shoot, if youve got a little creature that lives in your yard or around where youre at, help him out a little if you can"
Bob Ross,"We have our basic shapes in and we can take a liner brush and put a lot of trunks in there if you want to or we can just take the point of the knife and scrape in all kinds of little tree shapes,"
Bob Ross,"little trunks, little stems, little sticks. Whatever. Now, when this dries, people look at your work and theyll think that you spent hours with your little one-haired brush doing all these"
Bob Ross,"And you wont tell them any different. All you do is up the price a little if youre selling your work. There. Okay. I have several of these old round brushes going, let me grab another one here"
Bob Ross,"Im going to dip it into a little bit of the liquid white. And the liquid white is only to thin the firm white, because remember our golden rule"
Bob Ross,"Remember our golden rule, a thin paint will stick to a thick paint. And go right back and get a little of that Bright Red here. I want to put a little pinkish glow into this. There. Now just tap, see"
Bob Ross,"Thats how you load this brush. All you have to do is tap it. Just go up here. Now then, go slightly above the dark and just begin tapping it. All kinds of little snow-covered leaves"
Bob Ross,"In Alaska where I lived for so many years we have ice fog and it would cover everything and just make everything look like this, it was absolutely spectacular"
Bob Ross,"You never think about Alaska, and cold countries like that being beautiful in the winter. But some of the most beautiful, beautiful scenery happens in the winter. There"
Bob Ross,"And I loved to sit inside my warm house and look out at it. Theres a reason I moved back to Florida. In my old age, the cold winters just sort of got me. There we go"
Bob Ross,"And maybe right in here theres another one. Now, you dont have to kill all the dark. Leave some of that dark in there. It makes it look like things are hid back there in the shadows. There"
Bob Ross,"Tell you what, this big one back here, Im going to take a little paint thinner, a little of Dark Sienna, and well just thin it down to this like ink and lets just put the indication of a little"
Bob Ross,"tree trunk back here. Its big enough, maybe we can really see a tree trunk in here. There. And you can put as many or as few limbs on your tree trunk as you want"
Bob Ross,"Now, that little touch of the liquid white, a little bit more of the Bright Red, Titanium White, just mix them together on the brush, give it a good tap, tap"
Bob Ross,"And lets go up in here and look at the basic shape of your tree, think about where the light would play through here and hit it. Worry about form and shape. See"
Bob Ross,Theres another little thing right there. These are really fantastic little paintings
Bob Ross,"And, as Ive mentioned every so often, if youre interested in selling paintings, these paintings will sell like hotcakes. Probably more for color than for content"
Bob Ross,And a lot of people buy paintings more for color than for content. Because theyre looking for something to fit a specific need. There we go
Bob Ross,"Lets go all the way over here on the right and put a little bit on this nice tree over here. We dont want him left out, he thought I was about to forget him. Hed have been angry with me"
Bob Ross,"Nobody wants to be left out. Okay, and other one right there. Or wherever. But notice the dark areas in between. See those dark areas. Thats what gives dimension and shape"
Bob Ross,"Dont kill all those dark areas, theyre your very good friend. And we can go back in here, just scrape in a few little sticks and twigs, but mainly in the dark areas. Put them mainly in the dark"
Bob Ross,"And this is just a clean knife. However many you want. Now, time to really have some fun. Lets take the old big brush, well go right into Titanium White. Just load a lot of white paint in there"
Bob Ross,"And its time to make some very big decisions in our painting. Okay, now then, lets go up here and make a decision"
Bob Ross,"If were going to have snow in here, we have to start deciding where our snows going to live. So, make a decision, just put your brush down here, and this big brush will do this very rapidly"
Bob Ross,"And just pull. See there. Thats all there is to it. Just pull it. And begin deciding where all these things are. Be concerned with the lay of the land, now. Begin worrying about angles. There"
Bob Ross,"And just let it flow right out there. Very nice, easy way of laying in a great deal of snow very rapidly. And sometimes you can touch a little touch of the Phthalo Blue"
Bob Ross,"And just blend that in, and itll create the illusion of shadows here and there. And it also makes cool areas in your snow so its not all too warm, that way you have some cool areas"
Bob Ross,"Alright, and well just take out all the brush strokes. It becomes very smooth"
Bob Ross,"Now, well take a fan brush, a little bit of liquid white, a little Titanium White, a little touch of that Bright Red again. And well just mix them together right on the brush. Lets go up here"
Bob Ross,"And then, by pushing upward we can make the indication of some little bushes and stuff that grow right down these snowbanks. Its a nice way of covering up these edges, it brings it all together"
Bob Ross,"There. Just wherever you think they should be. Just push upward. And allow the bristles to bend. Then we take the bottom of it, and blend it right in"
Bob Ross,"Super easy way of making some very effective little areas in your painting. And it pushes all--look how those bushes there now are all pushed back in there, only because of these little things"
Bob Ross,"And youre working with planes. And those planes cause dimension and depth in your painting. Okay, shoot. Were having so much fun. Lets get crazy. Im going to go right into some Phthalo Blue here"
Bob Ross,"Not much. Not much. In fact, there was still some white left on the bristles from the snow. A little Phthalo Blue"
Bob Ross,"Im going to put a little water in here, you know me and my water, I like to have water in all my paintings, nearly. Touch, and pull straight down"
Bob Ross,"You just have to make a decision where your water lives. Touch and pull down. Now, once again, this blue is a very cool color"
Bob Ross,Itll really do nice things against all these pinks and stuff that we have in here. A very cool color. Maybe theres just a happy little pond here that comes right around in there
Bob Ross,I dont know exactly. Well decide that later. Pull straight down. Most important to pull straight down. Now get a clean brush
Bob Ross,"I have several brushes going here so I dont have to spend all my time washing brushes, as much fun as it is, and as much as the camera people hate it, we wont do all that. There. Now, that quick"
Bob Ross,"That gives us a nice little watery area. Now, take a touch of the liquid white on the knife, a little Titanium White, and well mix them together. Liquid white and Titanium White"
Bob Ross,"The liquid white is in there only to thin the Titanium White a little bit. And Ive put at least a little touch of the Bright Red in there. Now, cut me off a little roll of paint, and lets go up here"
Bob Ross,"Now Im going to put a little snow lane right along in here, so we touch and just sort of let it work its way right off the blade there. Get a little more paint. There. See how well that works"
Bob Ross,"Maybe comes right around the corner here. We dont know. Just put it right around. That easy. Now, then. Clean off my old knife. Lets go back to our round brush and our lavender color"
Bob Ross,"Well tap a little color into the bristles. Just like so, just tap it. Maybe over in here. Maybe. Yep. Yep, there is now. Well put a happy little bush or two that lives right here"
Bob Ross,"Now, I want to leave this little bit of water showing through so you can see that theres water behind there, I think itll make that look nice. Okay"
Bob Ross,"Underneath that, well pull a little bit of that color down. There. Now, then. Now, well take the other round brush, a little liquid white, a little bit of the Bright Red, not much"
Bob Ross,Be very careful of the Bright Red. Itll set your whole world on fire in one heartbeat
Bob Ross,"Okay, lets go right up here, got the brush loaded up and lets put in some nice little frosted areas right on these bushes. Once again, work on one bush at a time"
Bob Ross,"Dont get too carried away, we have plenty of time. Dont worry about it. One little bush at a time. There. See there. And if you do one at a time, then you have depth"
Bob Ross,"I know you get tired of hearing that, I really think its important though. There we go. Now, go back to our"
Bob Ross,"This is liquid white, mixed with a little bit of Titanium White, then go right in here and put all of our little snow-covered ground areas. There"
Bob Ross,"Alright, and this reflection, we pull it straight down then we go gently across. Then we go back in here with our clean knife and just scratch out a few little sticks and twigs, wherever you want"
Bob Ross,"There we are. Now, tell you what. Shoot, maybe lets take some Van Dyke Brown, get us a little roll of paint maybe right up here, lives a happy little tree. There it goes. Just like so"
Bob Ross,"Just straight Van Dyke Brown. Then we do the other side. Now, lets give him a friend. Shoot, we dont need him to be alone. Lifes too short to be alone. Too precious. Share it with a friend. There"
Bob Ross,"Now, lets take a little Titanium White, a little roll of paint on the knife, and lets have--maybe this is a birch tree. What the heck. Touch, give it a little pull around. Give it a little pull"
Bob Ross,"Birch trees may be one of the easiest kind of trees there are to make. And if theres not birch trees in your area, shoot, you can paint any kind of little tree that you want"
Bob Ross,"Maybe you want to paint a big maple tree in yours, or oak tree, or whatever. Its okay. A little paint thinner, a little bit of the Van Dyke Brown. Turn the bristles"
Bob Ross,"Turn it, it brings it to a nice sharp point. Lets go right up in here, well put the indication here and there of some little trunks, or little limbs. Off the trunk"
Bob Ross,"Ill get it straight here in a second, bear with me. There we go. Wherever you think they should live. There. Okay, theres another one. Theres one"
