person,text
Bob Ross,"And if this is your first time with us, allow me to extend a personal invitation for you to drag out your big brushes and a few colors and paint along with us each week as we put some of natures"
Bob Ross,"masterpieces on canvas. Tell you what, Im gonna start out today and have em run all the color across the screen that you need to paint along with me"
Bob Ross,"And while theyre doing that, let me tell you what Ive already done up here"
Bob Ross,"Today I have my standard old 18 by 24 inch double-primed canvas, and onto that, Ive taken a piece of contact paper and sort of cut like a half an oval shape, and I just stuck it on"
Bob Ross,"And weve covered the entire canvas with a thin, even coat of liquid white"
Bob Ross,"This is a wet-on-wet painting technique, so then what normally the first thing that well do is we cover the canvas with something to make it wet and slick"
Bob Ross,"Today weve used liquid white, and all that does is allow us to actually blend color right on the canvas rather than working ourselves to death on the palette"
Bob Ross,"Today lets start off with the old two-inch brush, and lets go right up here and get this least little amount of phthalo blue, its a very strong color, you need very little, just pull it out, and"
Bob Ross,"then tap the bristles into the color. That assures that we get a nice, even distribution of color all the way through the bristles. And thats exactly what were looking for"
Bob Ross,"Okay, lets go right up here. Thought today wed do just a happy little scene. I wanna show you a very simple little scene that you can do even if youve never painted before"
Bob Ross,"This is a very easy, very nice little scene, and I think youll find it very enjoyable and rewarding. There we go, all were doing here is just using little crisscross strokes, little xs"
Bob Ross,"Thats really all it amounts to, little tiny xs. And the color, the blue color, is always blending with the liquid white thats on the canvas"
Bob Ross,"And automatically, automatically the sky gets lighter and lighter toward the horizon. And thats what were looking for in a landscape. We just blend it together here a little"
Bob Ross,"Okay, then very lightly we can just go across. All this does is just removes all the brush strokes and sorta pulls everything together just like so. There"
Bob Ross,"Maybe well have a little bit of water in this painting. If youve painted with me before, you know Im an absolute nut for water"
Bob Ross,"I think its so beautiful, and in this technique, its one of the nicest, easiest things to paint. So youll find water very enjoyable to do"
Bob Ross,"So well just take a small amount of that phthalo blue again back on the same old brush. Lets go right up here, and you have to make a decision here, where does your water live. Maybe"
Bob Ross,"maybe its right in here, just take and pull from the outside in. Thats all there is to it. Very lightly. Now then, well take it up to, oh, about there"
Bob Ross,"Doesnt matter, doesnt matter, wherever you want it. On this piece of canvas, you have absolute and total power. You can do anything that you wanna do here. You have unbelievable power"
Bob Ross,"You can move mighty rivers, push trees around, and mountains. Anything that you want to do on this piece of canvas. There, okay, and thatll end up being our water. Lets wash our old brush"
Bob Ross,"We wash our brush with odorless thinner. Let me say that again, odorless thinner"
Bob Ross,"If you dont use odorless thinner, youre gonna find yourself, banging chuckling youre gonna find yourself working alone very, very quickly. Really recommend you use odorless thinner"
Bob Ross,"Tell you what, lets take a fan brush today, and lets build us a happy little cloud. And for that, well go right into titanium white"
Bob Ross,"Be right back, gonna get the least little touch of the bright red, least, least little touch, though. It goes a long way. Load a lot of color into the bristles. See, both sides are full of color"
Bob Ross,"Very good, now then, we have to make some big decision"
Bob Ross,"Maybe theres some happy little clouds that live in our world, so take the corner of the brush and very gently begin making all these tiny little circles. Tiny little circles, add a little more paint"
Bob Ross,"There we go. And just begin forming your basic cloud shapes. Thats all were looking for at this point are very basic little shapes. Its all were looking for. Okay, just apply a little color"
Bob Ross,"Now then, Im gonna take a two-inch brush thats nice and clean and dry, and I have several of each brush going here. And very gently, very gently, just blend the base of this mountain, or cloud"
Bob Ross,"Son of a gun, I done called this a mountain. There we are, now, very lightly, lift upward. See, that just sort of fluffs it"
Bob Ross,"Then gently, gently, two hairs and some air, just blend it a little bit, and we have a cloud. Now when youre painting clouds, work in layers doing the cloud that you thinks the farthest away first"
Bob Ross,"And then well come back and reload the brush, and we can go back in here and make another one. Now sometimes we use a very firm paint. Sometimes youll find the paint maybe is a little too thick"
Bob Ross,"If that ever happens, add the least little touch of liquid white along with the titanium white. Least little amount because when you add liquid white here, your blending ability drops drastically"
Bob Ross,So dont add any more than you have to to get the paint to come off your brush onto the canvas. And we can put another happy little cloud that lives right here
Bob Ross,"And in your world, you have to make these decisions. You have to decide how many clouds live in your painting. There, see, I think theres one lives right there"
Bob Ross,"Right there, maybe up in here theres a little stringy one. It just sorta floats along, he just lays up here and has a good time, watches everything happen"
Bob Ross,"Now then, back to our clean, dry two-inch brush, and be sure its dry. It really needs to be dry. Blend the base of it, fluff it just like we did before"
Bob Ross,"And that easy, you have another happy little cloud. And you can put as many or as few as you want in your world. Maybe well do one more, its good practice"
Bob Ross,"Good practice, and the more you practice, the better you get, no matter what youre doing, whether its painting or anything else"
Bob Ross,"But if theres a secret to this or any other style of painting, its simply practice. There we go, now very gently, once again, we just wanna blend the base of this, just the base"
Bob Ross,"Lift it, fluff it, there. Very lightly, very lightly, just go across. And so now see, we have all these layers of clouds now"
Bob Ross,"And you can come along in here and, you know, maybe once again, maybe you wanna put some little stringy clouds in here, little floaters"
Bob Ross,"And those are very easy, all you have to do is just sorta lay em in. Blend em the least little amount. And then very lightly just go over em. Isnt that something"
Bob Ross,"Okay, maybe well have a little mountain that lives way, way back in the distance here. Very simple little mountain, one thats very quiet, very subdued"
Bob Ross,"Well take some black, a little van dyke brown, little touch of alizarin crimson in there. Like so. Maybe the least little touch of prussian blue, there"
Bob Ross,"Okay, now then pull the paint out as flat as you can get it. Really get tough with it"
Bob Ross,"Go down with the knife, touch, and just cut across, that way you get a small roll of paint, lives right on the edge of the knife. Okay, lets go up here. Now then, we have to make a big decision"
Bob Ross,"Where does our little mountain live. And we want this to be a far away, very distant little mountain. So we dont want it to get too big on us. These rascals will grow on you very quickly"
Bob Ross,"Theyll take over your whole world. And you have to make some decisions, where you want little bumps, little tops. All you have to do is just put em on just like so"
Bob Ross,Now the only thing that were worried about at this point is a nice top edge up here. We could care less whats happening in here. Doesnt make any difference to us at this point
Bob Ross,"Now then, once again, take a two-inch brush, grab this, and pull it. Because the liquid whites on the canvas, you can move this color. Its wet, and itll slip and slide"
Bob Ross,"Now then, just by using brush strokes, if you wanna make a little mountain thats far away, just by using the little brush strokes here, you can make the indication of highlights and shadows, all"
Bob Ross,"If you cant, when youre painting, I guarantee, youll understand what Im saying there because theyll show up, itll look like all kinds of beautiful little things that are just happening out there"
Bob Ross,"automatically, and you dont have to work at all. And this is a lazy mans way of painting"
Bob Ross,"Shoot, Ill tell you what, lets take some white, little bit of phthalo blue, a little of that mountain color just to gray it down some"
Bob Ross,"There, maybe in our world, way back in the distance there, there lives a little foothill. Now push, see, hit it and give it a little push"
Bob Ross,"Make it slide a little, that loads paint right out at the end of the bristles. Lets go ahead up here. Okay, now we have a little foothill, maybe it lives, yep, youre right, youre right, there it is"
Bob Ross,"Little foothill lives right out there, see. Well just let it disappear into nothing. Very soft, quiet, gentle little thing"
Bob Ross,"It lives down here at the base of this big mountain, and he just watches everything that goes on. There we are"
Bob Ross,"Okay, now then, while we have that color on the brush, maybe we wanna make the indication of a little reflection down here"
Bob Ross,"To do that, just pull straight down with a little bit of the color, but straight down, thats important. And gently across. Now thatll give us an indication of a little reflection"
Bob Ross,"Other thing we can do, lift upward, very short little strokes. Thatll make it look like little distant trees that live way back there, far, far away. Very subdued, though"
Bob Ross,"All right, now one thing that gives a painting a lot of depth and distance is different planes or layers in it. So lets make several different layers in here"
Bob Ross,Well just use that old mountain color here
Bob Ross,"I think that was just black, a little prussian blue, little van dyke brown, alizarin crimson, and to that, Im gonna add the least little touch of sap green. Not much, just a little"
Bob Ross,"Once again, tap the brush just to load it. Now then. Lets begin putting in all different layers or planes. Maybe theres one that lives right here, and it comes right down like that"
Bob Ross,Let your imagination go and decide where you want all these little things to live
Bob Ross,"There, okay, now then, each time you put one of these little peninsulas out here though, we need a reflection under it, its very important. Pull straight down, go gently across"
Bob Ross,And then you can make a decision where the next one lives. Maybe the next one is right here
Bob Ross,"Now see, you may, its almost a natural tendency to want to put all of these in and then put the reflections, but when you pull these down, it would destroy the top of that one"
Bob Ross,"Hope all that makes sense, so do em one at a time. Dont be in too big a hurry. Speed will come automatically with practice. There. Right now, were just trying to learn the basic technique"
Bob Ross,"Maybe, shoot, maybe theres another one right here. I dont know. Just let it go, thats the beauty of this, you really dont have to set and plan every little detail out"
Bob Ross,"Have a general idea in your mind of where you wanna go with this painting and what you want it to look like. So basically, all you have to do is figure out the time of year and the time of day"
Bob Ross,"And other than that, youre free. You can do anything here that you want. Lets take a little cad yellow, be right back, grab a little of the sap green"
Bob Ross,"Well just use a fan brush today, doesnt matter. Little touch of yellow ochre. There, maybe a little more of the green here. There, thats a beautiful green"
Bob Ross,"But by mixing color on the fan brush like this, you have a multitude of color happening in the bristles. Look at all the different values and colors"
Bob Ross,"My gosh, youd work forever to do that if you were trying to mix each one of those separate colors. This way, it happens automatically"
Bob Ross,"Then we can go back up in here and we can just begin pushing in some highlights. We need that dark underneath, though, so this nice green color will show. There. You know what"
Bob Ross,"Let me grab another fan brush. I see something here Id like to do. Lets take another fan brush. Well go right into some black, brown, same old colors again. Crimson, sap green"
Bob Ross,"Little bit of the prussian blue. Very dark color. In my mind, see how you can change your mind. I see little trees, maybe theres little evergreens that live way back here"
Bob Ross,"Just take the top corner of this fan brush, and well put in the indication of little trees that are far away, we dont want too much detail there"
Bob Ross,"If you put too much detail in trees this far away, youll lose that illusion of distance. So just a little, there. There we go, let em just come right on down and disappear into nothing. There we are"
Bob Ross,"Now then. Back to our fan brush. And we can put in all those beautiful little green areas. There we are, isnt that fantastic. Now work in layers, though, watch here, watch here"
Bob Ross,"See, here comes another one out here on this little peninsula that sticks out into the water. That easy. That easy, and you can just put layer after layer after layer"
Bob Ross,"Now then, lets take a little touch of the liquid white. A little liquid white. Ill put the least little touch of the bright red into the color"
Bob Ross,"Now even though this water line is dropping down, down, down, you want to keep these lines basically straight, otherwise itll look like, itll look like the waters gonna run right out of your"
Bob Ross,"painting and get your floor all wet. So you can go anywhere you wanna go with these, but try to keep em as straight as possible. There"
Bob Ross,"And maybe here and there, maybe you want to put the indication of a little ripple here and there. Those too need to be as straight as possible. Try to keep those straight"
Bob Ross,"Tell you what, lets get crazy. Well go right back to the old fan brush that I had that had the black and the prussian blue and the brown and green, crimson. Load a lot of color into the bristles"
Bob Ross,"And maybe in our world there lives. Maybe theres a nice evergreen tree that lives right here, just touch. Give yourself sort of a little center line"
Bob Ross,"Now were gonna use just the corner of the brush, just the corner. See there, and these little evergreens live right here in these fan brushes. All you have to do is sorta scare em out"
Bob Ross,"And as you work down the tree, add more and more pressure. Were still using the corner of the brush, but were just pushing harder and harder"
Bob Ross,"And automatically your tree will get larger and larger as it works downward, and normally, trees look better if thats the case"
Bob Ross,"There we go, now then, you know me, I think everybody should have a friend. So lets go right here and give this little tree a friend"
Bob Ross,"Same thing, see just use a corner of the brush and work back and forth. Like so. There. And that easy, we got a couple of beautiful little evergreen trees"
Bob Ross,"Now then, we can take the knife, take a little titanium white, little dark sienna, mix it together. Pull it out very flat, and we cut across. Once again, we get our little roll of paint"
Bob Ross,"Normally, normally, we always load the knife with that little roll of paint, so spend a little time practicing so you can do that without even thinking about it. Okay, little bit right there"
Bob Ross,"There we go, and that just gives the indication of some little tree trunks on our trees. We dont want em to be weak and fall over and drop into the water"
Bob Ross,"Well take a little bit of black, a little yellow, and make a very dark green. Well put that on the fan brush. A lot of color, just load both sides full of color. Lets go right up here"
Bob Ross,"Now then, in my world, maybe the lights coming from the right, so we wanna put more emphasis on the right side of the tree than we do on the left"
Bob Ross,"There we go, and well put some highlights on this tree. But evergreen trees are normally quite dark, so dont let em get too bright on you cause them rascals will"
Bob Ross,"It get to be fun, and next thing you know, youve covered up all your dark areas. And you need that contrast to make your tree beautiful, make it stand out"
Bob Ross,"There, darker, darker, darker down here toward the base cause trees are darker, theres more shadows down here. All right, shoot, lets get crazy, get the big brush"
Bob Ross,"Lets go right into that dark color. Same old thing, black, blue, van dyke, a little crimson, a little sap green. Well use the old two-inch brush"
Bob Ross,"Pull it in one direction here, load a lot of color into it. There we go, lets go right up here. Now then, lets just put something right here, watch here"
Bob Ross,"Lets just begin, and you have to make some decisions here. Where do you want all these little bushes and stuff to live. Here they are, wherever you want em, thats exactly where they oughta be"
Bob Ross,"And well just let em sort of fade out down here. But that easy, that easy. When you use this big old brush, you can cover a lot of space quickly. There, and this is a two-inch brush"
Bob Ross,"There, okay, and all were doing, once again, is just laying in some dark color so when we apply our highlights or our light colors, that theyll stand out and show"
Bob Ross,"Its really the only reason we put this in here. Now then, another thing you can do, you can take just a clean knife and sneak up in here and just scrape in all kinds of little sticks and twig areas"
Bob Ross,"Now when this is done, itll look like you spent days and days with your little one-haired brush just going in here and drawing all these"
Bob Ross,"Were gonna cover up a lot of em, but some of em will show, and people will think you worked for long periods of time to create all these little things. And thats our secret, shh, dont tell nobody"
Bob Ross,"Okay, so I say most of those will disappear, but some of em will still be there, and theyll create some very nice effects. Im gonna dip the one-inch brush into a little bit of the liquid white"
Bob Ross,"I do that only to thin the paint, one of our golden rules, a thin paint will stick to a thick paint. Let me get a little black on there, Ill make a nice green. Black and yellow make a beautiful green"
Bob Ross,"Now look right there, see, when it starts making those little things, Steve, my son who teaches this, he tells his students when little bushes start appearing right here in this pile of paint when you"
Bob Ross,"pull it, then the brush is loaded correctly. And thats an excellent way of checking it. But you can see how it begins appearing right there. When your brush begins doing that. Then lets go up here"
Bob Ross,"Then make some big decisions in here. Maybe theres a happy bush that lives right here. Touch, give a gentle push. You dont have to push hard"
Bob Ross,"If you have a thinner paint than whats on the canvas and youve loaded a lot of color into the bristles, see there, and make one little bush at a time"
Bob Ross,"I know sometimes it gets feeling good and you want to make a bunch at once. Try to make only one bush at a time. Think about em as individuals, give em names if necessary"
Bob Ross,"And thats what makes em stand out. Do the bush that in your mind is the farthest away first, and then work forward, always working forward, and that way therell be depth and distance in your work"
Bob Ross,"Little more color, and Im going through the indian yellow, the yellow ochre, cad yellow. Here and there, least little touch of the bright red. Not much, its very strong, very strong"
Bob Ross,"Itll take over your whole world in a heartbeat. But it does make some nice little color changes here and there. There. Okay, maybe another little bush right there. I tell you what, tell you what"
Bob Ross,"This looks just like a natural place to have a little path, so lets take some, well take some van dyke brown, a little dark sienna"
Bob Ross,"Pull it out very flat, once again, we cut off our little roll of paint. Now then, where does our path go. Maybe it goes right up in here"
Bob Ross,"And all were doing, once again, is putting some dark color on so our light color will show. This is just our undercolor, our base color"
Bob Ross,"And in just a few minutes, well come back and well highlight that. Well just sort let that just sorta dribble out here to nothing, just sorta let it go, we dont know. Like that"
Bob Ross,"Now then, we can take some with, a little dark sienna, maybe the least little touch of bright red in it, not much. Pull it out flat, dont over mix your color. Get our little roll of paint"
Bob Ross,"Now barely, barely grazing the canvas, just let the knife just barely, barely caress it"
Bob Ross,"Just so it hits the high points, and itll make it look like all those little bumps and rocks and beautiful little things happening automatically. Automatically, there we go"
Bob Ross,"Now then, we can come back with our one-inch brush, and well just pop in a little bush here and there. Bring it all together. Can add a little paint thinner to your brush sometime to thin the paint"
Bob Ross,"And lets go right over here. See, well have a little bush that lives right here and hangs over the path, that way we dont have to decide where it goes"
Bob Ross,"We just know it goes somewhere back into the background. We dont know. Dont care at this point. See, just sorta let that go. Now then, tell you what I wanna do"
Bob Ross,"I wanna take the little piece of contact paper I have off and lets see what we have here. Well just grab that, pull it off, zoop, and there it goes. Now then, see, we need to get rid of these edges"
Bob Ross,"So all well do is take a little of the dark color, tap a little of that in so it just sorta flows with it. Just let it flow right on out like that"
Bob Ross,"But I wanna keep this contoured roundish idea going here, sorta makes it look a little bit better. Put some dark in, then we can come back and put all kinds of just little bushes and things in here"
Bob Ross,"See, use the side of the brush, push upward. But work in layers, always working in layers. Think about individuals. There"
Bob Ross,"Okay, now lets go back to our fan brush that has the white on it for the clouds, and lets go up in here, Im gonna find a clean two-inch brush, I wanna blend this blue here"
Bob Ross,"See this little line here, I wanna kill that, so well just blend that out and just sorta let it go backwards here. Now. Thats all you have to do, just blend it back"
Bob Ross,"And well take our cloud and allow it to come right down there. There it goes, and just let it blend right on back, see. Its right on into nothing, we dont know where it goes, we dont care"
Bob Ross,"And this one. Okay, then a nice clean brush, give it a little blend. Like so. Lift it, fluff it, and that brings that whole top section together. I tell you what, think this old painting is about done"
Bob Ross,"Lets take a little of the bright red on the liner brush, a little paint thinner, and well sign this one right about here. I hope youve enjoyed this, itll certainly give you a lot of practice"
Bob Ross,"Its a beautiful little painting to do if its your first project. Think youll enjoy it. And from all of us here, happy painting and God bless, my friend. light music"
Bob Ross,"- Hi, welcome back. Certainly glad you could join me today. You ready to do a fantastic little painting"
Bob Ross,"Tell you what, lets start out today and have them run all the colors across the screen that you need to paint along with us. While theyre doing that, let me tell you what Ive already done up here"
Bob Ross,"I have my standard ol pre-stretched double primed canvas up here, and Ive put just a thin, even coat of the liquid white over the entire surface. So its all slick and wet and its ready to go"
Bob Ross,"So, lets have some fun. I thought today is such a fantastic day here. Well just do a happy little painting. Ive had a lot of request, people asking about how to do these great big fluffy clouds"
Bob Ross,"So I thought wed work on something like that today. So lets start out, well use the ol two-inch brush, with a little touch of the phthalo bru, blue"
Bob Ross,"Blue, sometimes my tongue gets over my teeth and I cant see what Im saying. There we are. Little bit of the blue. We dont want much. Lets go right up here"
Bob Ross,"Now maybe, right in here, well have just a little bit of, little bit of blue right in there like so. Well just let that float right on off into nothing. A very small amount"
Bob Ross,"Well put a little color in the sky so the clouds will show up. Something like so. This is just phthalo blue, and its mixing with the liquid white thats on the canvas"
Bob Ross,"And automatically, you get a beautiful, smooth, even color in here. If this was a dry canvas, youd be in agony city about now. Now then. Without cleaning the brush, Im go into the midnight black"
Bob Ross,"Just looking for a small amount of color. Just a small amount, like so. Now then, with the black on there and the little bit of blue that was left, well have a very nice gray color"
