person,text
Bob Ross,"Shoot, maybe we can see the indication of something that, mm, there it is, big old thing that lives right there. Let your brush wiggle and jiggle and have fun"
Bob Ross,"Tree trunks, sometimes, oh, theyre all gnarly. I hope thats a word, but you know what I mean. They have wiggles and bends in em. Theyve had rough lives"
Bob Ross,"Shoot, maybe they got stepped on, all kinds of things. Now who knows. But dont just make em all straight. It gets very boring very rapidly"
Bob Ross,"There, now we can see the indication here and there of just little things that are protruding out from between the little limbs, all these little things"
Bob Ross,"You know, I get letters from so many people, and they tell me banging of their successes and how well this is working for em and the fact that people actually wanna buy their paintings, and theyre"
Bob Ross,"very, very shocked over that. They say, Gosh, you know, I never dreamed anybodyd wanna buy something that I painted"
Bob Ross,Dont be surprised when that happens because people will like what youre doing and they wont believe that youre doing em
Bob Ross,"I get letters from people say, My family does not believe I done this myself.  They will not believe, and money is not important"
Bob Ross,"Money only is a way, if you sell your painting, its a way of, its your report card"
Bob Ross,"its people telling you that I enjoy your work so much that Im willing to give you my hard-earned happy buck for it. Thats really a supreme compliment, even if you dont sell your work"
Bob Ross,"Its a big, big compliment. Im taking a little titanium white, a little bit of that same lavender color. Let me get a little more white here. There we go, lighten that up a little"
Bob Ross,"Now tap the bristles, tap em, there we go. See how that pushes, but theres a little bit of paint"
Bob Ross,"You can see that little ridge thats left on the palette there, theres also one that corresponds to that on the end of your bristles. Thats what were looking for"
Bob Ross,"Lets go up here, now with that, we can come in here and very lightly put in a few indications of just little highlights, see em. We dont wanna get too much"
Bob Ross,"Just enough to show some little sparklies on these trees. Not too much, there we go. Over here. Since our light source is right in the middle, well highlight the other side. There we go. All right"
Bob Ross,"You never believed you could do that with a big old brush I bet, and you can. You really and truly can. Im gonna add a little touch of the phthalo blue to that just to blue it down a little"
Bob Ross,"And lets go right up in here. Cause were getting away from the light source, I want it to get a little darker, a little more into the bluer cool tones"
Bob Ross,"Blue is a very cool color, where your reds and yellows and stuff are very warm. So play not only light against dark, but warm against cool. There, makes beautiful, beautiful effects in your painting"
Bob Ross,"And this big old tree up here, there we go. Well just put some happy little things hanging out here on him, too, or her, whatever the case may be. There"
Bob Ross,"This is one of the neatest, nicest ways of painting trees. And even if youve never painted before, thisll work for you, this is a very simple painting. Very simple. Guaranteed success"
Bob Ross,"But like anything else, the more you do it, the better youre gonna get at it"
Bob Ross,"Cause with practice comes confidence, youre familiar with your tools and what they will do, youre familiar with the colors and how theyll behave, how they mix"
Bob Ross,And one of the things we try to do is keep the number of colors that you need to do this very limited so you learn what each color will do and the characteristics of that color
Bob Ross,"And it makes life easier for you. Im just gonna go in here and begin putting in layers, a few little layers of things, work in layers, always"
Bob Ross,"Just like so, do the thing that you believe is farthest away first, and then work forward, forward, forward. Always working forward. There we go"
Bob Ross,"There, see, but you just put layer after layer after layer. All right, and things begin happening, see, theres a little thing left in here. Im beginning to see all kinds of happy little things"
Bob Ross,"You can take the books that we have that go with the series and like take a tree out of one painting and maybe a lake out of another one or a building, and put em together and make all kinds of new"
Bob Ross,"compositions. Theyre only intended as guides to help you learn the technique and to have an idea. Shoot, mix em up. Lets have some fun, maybe theres some little grassy areas that live in here"
Bob Ross,"Lets go, well go right into a little bit of yellow, Ill grab a little black, when you touch that there, it makes a beautiful green color"
Bob Ross,"A little yellow ochre, indian yellow, little bright red here and there. Once again, tap that brush, get that little bit of paint right out on the end, lets go back up here"
Bob Ross,"Now you gotta make some big decisions here. Maybe theres some grassy areas that live up here. Where they live, make a decision, and begin dropping em in"
Bob Ross,"Begin dropping em in, see there, work in layers, though. I know you get tired of hearing that, but its so important. Start with the area thats farthest away and work forward"
Bob Ross,"And you know what Im beginning to see here. I bet youve seen it already, too. Wouldnt this be a perfect place to have a happy little stream that lives. Maybe well do that"
Bob Ross,"Just looks like a natural place to have one. Tell you what, tell you what, lets do that. Lets take, see, you get crazy sometimes when you do this, but thats all right"
Bob Ross,"You know, if youre a painter, youre allowed to be a little different, people expect that. So take advantage of that"
Bob Ross,"Cut off a little roll of paint right on the edge of the knife, there it is, lets go up here. Decide where your stream beds gonna be. Maybe its gonna live right in here"
Bob Ross,"Im just putting some dark on so our waterll have some place to run. Just van dyke brown, a little dark sienna. Thisll be our ground area now"
Bob Ross,"Maybe, maybe, maybe itll fall, lets have it fall right here, what the heck. Shoot, you can do anything, you can do anything. Anything that your heart can imagine, you can do. At least on this canvas"
Bob Ross,"There, a little brown and white. Tiny little roll of paint. And Im just gonna let that barely graze here and there"
Bob Ross,"Just want an indication here and there of a little highlight, not much, just a little"
Bob Ross,"Just a little, make it look like all kind of little land areas in there, but look how color comes out against this dark canvas, it sparkles. Just absolutely sparkles"
Bob Ross,"You can just put it on little things like that, and who knows, and then go back with your dark color, your browns and stuff, and change that into rocks just by pulling down a little bit"
Bob Ross,Allow a little bit of that white to touch it. I hope you can see that. But you can create all kinds of illusions of stones and rocks and little shelves of stone there just by changing the angles
Bob Ross,"Just change the angles. There we go, little right there. Thatll turn out to be a big stone when were done. Now then, shoot, lets get crazy here"
Bob Ross,"Lets take a fan brush, gonna dip it into the liquid white, and well go here, go into titanium white. I put the liquid white on there only to thin the color"
Bob Ross,"Only to thin it, thats all, cause a thin paint will stick to a thick paint, but you cant reverse that easily, its a lot of trouble if you reverse it"
Bob Ross,"Maybe well put the least little touch of phthalo blue, and I mean least little touch, just enough to give it a hint of blue, all right. A lot of color in the brush. Lets go right up here"
Bob Ross,"Gotta make some big decisions. Maybe our water starts back here somewhere. We dont know where it comes from, phew, falls over. Then every time it falls, when it hits, theres gonna be a little splash"
Bob Ross,"There it goes. Now if you have trouble making this go over without it mixing with all your color, add a little more of the liquid white. Once again, that thin color will slide right over there"
Bob Ross,"Where do we want it to go. How many little waterfalls do you want in your world. And maybe, shoot, maybe some of em disappear there, come out around here, and drop over. Doesnt matter"
Bob Ross,You can create any illusion that you want on your canvas. Maybe they come way out here and drop. This water just bubbles through here. You can almost hear it
Bob Ross,Theres very few sounds in nature that are prettier than listening to water trickle over rocks and fall
Bob Ross,"I dream one day of having a home right beside a little bubbling steam like this where you can just set and listen to it all day or all night, whatever"
Bob Ross,"Now then, lets go back, take our brush with our green on it, a little green, yellow, grab some of that ochre. Tap a little color into the bristle"
Bob Ross,"Now then, lets take a little of that green and push that right back. We want this to be higher than the water so it looks like its coming from behind it. There, see there. Isnt that something"
Bob Ross,"And the beauty of this, you could still turn this back into a happy little meadow, for example, if you wanted to. Its not too late. Its not too late"
Bob Ross,"You can just create all kinds of things yet with it. There we go. See, just layer after layer. Lets go on the other side and do a few little things over there, same basic idea, though"
Bob Ross,"See, just tap in all your little grassy areas wherever you want em. Maybe well make this one a little higher back here, there"
Bob Ross,"So it contains the water, we dont want the water slipping over the edges there and get the whole field wet out here. We dont want that. But maybe in your world you do want that"
Bob Ross,"If you do, its okay, you can do that. Lets put some. Lets put some happy little things here. Well just take some titanium white and just color on the canvas. Grab it and pull down"
Bob Ross,"Pull straight down and allow that color thats on the canvas to mix with your white. That creates all kinds of nice little effects, very nice"
Bob Ross,"And people who look at your painting, even if they dont understand, if they dont understand exactly whats wrong with it, their mind will tell em somethings not right in here, and it will disturb"
Bob Ross,"them. So try to keep these lines coming straight down. There we go, now then, we can have some little splashy, happy things that come out through here"
Bob Ross,"And some little shimmers across the water just by taking the brush. Shoot, whatever you want on there. Just drop em in, a few little splashes and foamy areas that are floating out through here"
Bob Ross,"Theres no limit to this, wherever you want it to go. Okay, tell you what, well take a little dark color here"
Bob Ross,"Let me take a little of that lavender that we mixed up, hows crimson, a little phthalo blue, tap a little into the brush. Now then, maybe theres a little peninsula that comes right out through here"
Bob Ross,"You know me, I like them old big trees, so maybe well put a big tree in here. We have to have a place for him to set, so were just putting some dark color in here so our light will show. Thats all"
Bob Ross,"And we can go back to our brush thats got the green on it and the yellow ochre, little touch of the bright red. Little indian yellow, all the reds, just tap it"
Bob Ross,"Now then, just come right on down here, but angles are very important, follow these angles that you put in here, see. Just let that work its way right on down. Right on down. There"
Bob Ross,"Now maybe, yeah, thats nice, I like that. Tell you what, maybe in our world there lives. We can have anything we want in our world. But maybe there lives a nice little bush right here"
Bob Ross,"We just take a one-inch brush, push in. Indication of a couple little bushes that live right in here, wherever you want em. Wherever you want em, doesnt matter"
Bob Ross,"And Ill just take that and go right through some yellow. Because it has a little blue on it, well get a nice green color"
Bob Ross,"Little yellow ochre on it, okay, now, maybe well just put a beautiful little bush in right there. Leave some of these dark areas though, dont kill em all"
Bob Ross,"Thats what separates all your little bushes. Those little dark areas are your good friend. Ooh, theres a nice one, got a lot of yellow ochre in it. See, thats a happy accident"
Bob Ross,"Now then, tell you what, tell you what, we can take just our clean knife, and here and there, just scrape in an indication of a few sticks and twigs wherever you want em, let some of the black canvas"
Bob Ross,"show through, thats all were doing. But it helps create that illusion of distance and depth in your painting. Okay, lets have some fun. This is the moment of truth"
Bob Ross,"Lets bring a camera right up here, and lets pull the contact paper off. And well just zip that right off. like so, isnt that something. That is pretty, I like these kind of painting"
Bob Ross,"And you know me, shoot, theres a minute or two left here. Lets have us a happy tree. Well just take the knife, maybe, maybe well have an old birch tree that lives right here"
Bob Ross,"Lets just let it run all the way up here. Now you couldve left the birch tree inside of the oval, but I sorta like it when it sneaks out a little bit"
Bob Ross,"But when you do your painting, you make that decision. If you want him to live inside that oval, you put that rascal in there and keep him in there. There, this is just straight van dyke brown"
Bob Ross,"Just making a basic tree trunk. Now you could also do this just by taking the fan brush and making one stroke, and you can create a trunk in one stroke"
Bob Ross,"Just thought wed do it with a knife today, just a little different. There. Okay, that gives us a basic trunk"
Bob Ross,"Now then, lets take some titanium white, a little titanium white, pull it out as flat as you can get it, cut across, and we have our small roll of paint, see, right on the edge"
Bob Ross,"Heres our light, so maybe its gonna hit right here, and just sorta pull around a little. But when you do this, let me exaggerate, grab it and pull around, hope you can see that"
Bob Ross,"See there, and that gives a roundness to your tree. There we go. Wherever you want him to go, here he goes, bloop, bloop. Helps to make those little noises"
Bob Ross,"Of course people look at you a little strange, but thats all right, thats all right. Now then, well take some paint thinner, some paint thinner. A little bit of brown"
Bob Ross,"We want this to be very thin, though, ink consistency. Okay, lets go up here"
Bob Ross,"Now then, maybe theres a big old elm that lives right here, and you can let it come right on out of the oval if you want to, its okay. Its yours, you can do with it anything that you please"
Bob Ross,"Heres one, comes right up in the sky, maybe it comes right on in front. Maybe theres just a little shorty there, gotta have some of those, too. Wherever, wherever. See, there they go"
Bob Ross,"And right on up here. There, but just make all kinds of happy little tree limbs and things that make you happy. Now a few on this other one right over here. Like that"
Bob Ross,"Shoot, this little old trees coming right along here. This is a beautiful painting. I really hope you try it, you will find it works very well, its an easy little painting"
Bob Ross,"You can do it without any problem. Tell you what, lets sign that. Well take a little bit of red, come right in here, and well sign her, and with that, well call this one finished"
Bob Ross,"I hope youve enjoyed this. From all of us, Id like to wish you happy painting and God bless"
Bob Ross,"light music - Voiceover This program is brought to you by North Light Books, publisher of over 200 how-to books and videos for fine artists and graphic designers"
Bob Ross,"And by Langnickel, manufacturers of selected artist brushes"
Bob Ross,"- Welcome back. Certainly glad you could join me today. Its a fantastic day here, and I hope it is wherever you are"
Bob Ross,"So Ill tell you what, lets start out today and have them run all the colors across the screen that you need to paint along with me at home"
Bob Ross,"While theyre doing that, let me tell you what Ive already done here"
Bob Ross,"I have my standard ol 18 by 24-inch canvas, double primed, pre-stretched canvas, and Ive covered it with a thin, even coat of the liquid white, so its all wet and slick and ready to go so lets go"
Bob Ross,"I thought today wed just do a beautiful little painting, maybe well do something with fall colors. Its a good day so lets just, lets start out and do a very simple little sky"
Bob Ross,"Very simple, nondescript-type little sky. Well take a little bit of the yellow ochre on the 2-inch brush, very small amount"
Bob Ross,"Maybe just go up in here, and lets just begin blending in some nice warm little colors here"
Bob Ross,"This is just yellow ochre, but its mixing with the liquid white, and itll be very pale and very, very soft. There, maybe a touch more color right about in here, wherever, wherever. There we go"
Bob Ross,"Now then, tell you what, tell you what lets take a little touch of the alizarin crimson on the 2-inch brush and some very small amount"
Bob Ross,Just pull a little bit out and tap the bristles firmly into the paint. That assures a nice even distribution of color all the way through the bristles
Bob Ross,"Okay, now then, maybe right in here well put a nice little warm spot, little pink spot just like that"
Bob Ross,"And were using little criss-cross strokes or little Xs like that and just blend that color right in. Once again, this is gonna be a very nondescript little sky very, very soft"
Bob Ross,You wont hardly even notice it when the paintings done. There. Now we just blend that crimson and ochre together. Lets have some fun
Bob Ross,"Tell you what, Ill take the knife and well mix up some lavender or purple color. Well take some alizarin crimson, a little bit of phthalo blue"
Bob Ross,"Now, proportionately much, much more crimson than blue. The blue is many, many times stronger. Pick it up and turn it all the way over if you really wanna mix it well"
Bob Ross,"Sometimes its very difficult to tell what color that is without putting a little white there because its gonna look just basically black, so put a little bit of white, and then you can test your"
Bob Ross,"color. Well put the small amount of that lavendar right here on the 2-inch brush, and maybe theres a little cloud that floats right in here. There, just tap. Its all we have to do"
Bob Ross,"Put in a very basic little idea of a cloud. Maybe right in here well put in a little little color like so, very soft and very gentle. There"
Bob Ross,"Now then, with a clean brush were just gonna brush this, so I have several brushes going so I dont have to wash them between each procedure"
Bob Ross,"There we go and that easy we have a very nice, very effective, soft, little sky. Now then, Im gonna continue to use this 2-inch brush. Ill go right into that lavender color"
Bob Ross,"Maybe well make some little background trees. Im just tapping the corner into the paint. I dont want a lot of paint on the bristles, just a little. Okay, lets go right up here"
Bob Ross,"Now then, begin thinking about some very basic little tree shapes, and were not looking for a lot of detail here. This is too far away"
Bob Ross,"If you put too much detail, youll lose that illusion of distance, so be very careful, very careful. It starts working and it feels good and you wanna just, oh you get carried away, there"
Bob Ross,But we want this to be very soft and very distant. There we go
Bob Ross,"And think about little individual trees and bushes and all kinds of little shapes here and just sorta let your imagination take you wherever you wanna go. There, hmm"
Bob Ross,"That looks soft and far away already, and we havent hardly done a thing to it"
Bob Ross,"Now if you wanna create more mist at the base of this, well take a clean, dry brush and tap the bottom of these little bushes and trees but just the bottom, just the bottom"
Bob Ross,"And very lightly, two hairs and some air. Touch and lift upward. There we go. Now then, maybe we want to put several layers in there. Thats pretty easy to do also"
Bob Ross,"Well take a little bit more of the color on the 2-inch brush and tap firmly, tap firmly. There we are. Now then, we can begin putting in the next layer. Now this is a little bit darker"
Bob Ross,"Each layer, as it gets closer to you in a landscape, should get a little darker. There we go, maybe right here. Wherever you want, just drop them in. Okay, its fantastic already, I like that"
Bob Ross,"Now maybe back in here were beginning to see the first indication of a little bit of color but very small amount so Im going to do a little touch of the yellow ochre, maybe even pick up a little bit"
Bob Ross,"of bright red. Well have a fall scene today. That sounds good. Okay, now then, lets just begin. Youre still using just the top corner just tapping in the indication of a little bit of color"
Bob Ross,"Not too much or, once again, youll lose that illusion of distance and depth. There, just a few little indications. Maybe theres one right here or wherever. And I think today thats about all we need"
Bob Ross,"Now under here I must have a little grassy area, a little grassy area. So Ill just take a little bit more of that same lavender color"
Bob Ross,"Decide basically where your little grassy area is gonna live, and lets come right up in here, and all you have to do is just tap it in. And this is just the dark so our light color will show"
Bob Ross,"Its all were putting in right now. Doesnt matter how you put this in. You could put this in with a paint roller, doesnt matter. Any ol way you wanna do it. There"
Bob Ross,"Tell you what, maybe down in here theres a little bit of water. You know me, I love water. And its so much fun to paint with this particular technique. Well take a little bit of the phthalo blue"
Bob Ross,Im still using the same ol dirty brush. There we go. And lets just come right across here. I dont want much water in this. Maybe just a happy little pond way back in the distance somewhere
Bob Ross,So Ill just take a little of the phthalo blue and come right across here like so
Bob Ross,"Okay, now we wanna reflect a little bit of that in there, so Ill take a little bit of the lavender color, same color, touch and just pull it down. Same lavender color, not a great deal"
Bob Ross,"Just enough to indicate a little reflection. Straight down, though. Its most important that these lines come straight down. If they go at an angle, its gonna bother the eye"
Bob Ross,"Itll drive you crazy and maybe you wont even know why. There. Now then, same ol brush. Still havent washed this ol brush. Well take a little yellow ochre, a little Indian yellow, cad yellow"
Bob Ross,Just mix them together. This is gonna be a fall picture. We want a lot of the nice pretty colors. Maybe even a little touch of the bright red here and there
Bob Ross,"But mix these colors on your brush, and that way you get a multitude of things happening on your brush rather than one ol dead color. Okay, lets try that. See what we have here"
Bob Ross,"Lets go right up here slightly above the dark area, and think about the lay of the land here, the way the land flows, and well just begin dropping in some happy little things"
Bob Ross,"There, all kinds of little happenings here. And this is far away, so were still not looking for a lot of detail. All were looking for is basic shape and color"
Bob Ross,"Alright, maybe theres a little land back here. Lets take a little bit of the Van Dyke brown, a little dark sienna mixed together with a knife. Pull it out as flat as we can get it"
Bob Ross,"Just really pull it out flat then cut across and get our little roll of paint. There, you can see it right on the edge of the knife"
Bob Ross,"Now then, up in here, up in here lets just scrub in a little bit of land area. Dont want a lot. Dont want a lot, just enough to give the indication of a little bank there or something. There"
Bob Ross,"Now then, go into a little touch of the liquid white. Maybe add the least little touch of phthalo blue to it just to cool it down a little bit. There. Pull it out like that then cut across"
Bob Ross,Thats all there is to it. Now we go up here and act like youre trying to cut a hole right through the canvas. And well just cut in a little water line
Bob Ross,"There, its just a light area between these darks, and it sort of separates and makes things, just makes things look better. There. There might even be a little ripple or two out here. We dont know"
Bob Ross,"In your world, you make these decisions. You decide where all these things are. Okay, now its time to really get crazy. Lets take the ol big brush"
Bob Ross,"Well go right into that lavender color we made, and Ill add some Van Dyke brown to it. Shoot, maybe even some black. Make a good, strong, dark color. A lot of paint in the bristles"
Bob Ross,"Now then, lets start deciding how our land is gonna flow here. Maybe its gonna come right about here. And all were doing here is just tapping in some color"
Bob Ross,"Maybe theres some bushes that live right there. Just push upward with the brush, and it makes all those little bushy effects. Let the brush work for you, shoot"
Bob Ross,"Maybe the land comes, maybe it comes right on up here. I dont know. Just make a decision in your world, and put it wherever you want it. There, maybe thats the way our land will be today"
Bob Ross,"Now we can just really just paint this in just like were painting a barn, shoot. Just wanna cover this with nice dark color. There. Okay"
