person,text
Bob Ross,"Im gonna leave this side over here very dark, just a little on it. Dont want it, dont want it to be too light. Dont want it too light"
Bob Ross,Cause in my mind the lights striking right across from there and so. Take a little touch of brown make a little door. Gotta have a little door for him to get in and out. There
Bob Ross,"Now we can go back to our yellows and greens and lets put a little grass around this, around this little house here. Weeds about to eat him up"
Bob Ross,"Tell you what, maybe, lets take a little Van Dyke Brown, a little touch of white and just mix it together on the ol fan brush. Maybe theres a, yeah theres a little path that lives right here"
Bob Ross,Goes right on back here in the distance somewhere. And it just plays and meanders or whatever you want to call it right then. Like that. Right on off. There we are
Bob Ross,Take another fan brush and take a little white and just very lightly graze that and put a little bit highlight on it. There. Idnt that sneaky. Now we got a little way to get up to the cabin
Bob Ross,"Tell you what, bring the camera right up here and lets take off the ol contact paper. The moment of truth. This is what weve all been waiting for. Idnt that fantastic, though"
Bob Ross,"I like that contact paper. And lets have some fun, we have a second left. I like to let things project right out of the painting, when we do these little ovals. To me, its just so neat"
Bob Ross,"And when you frame this, its unreal whatll happen. Youll love it. Guarantee. Little bit of a highlight color. Only because we need a touch of tree trunk in there, too. What the heck"
Bob Ross,"We dont want that left out. A little highlight color, well drop that on. Shoot, weve about have a finished painting. Hope you like this one"
Bob Ross,"I think youll find it to be one of the most enjoyable little paintings that you can do. From all of us here Id like to wish you a happy painting and God bless, my friend. smooth jazzy music"
Bob Ross,"- Hi, welcome back. Certainly glad you could join us today. You got your paints and brushes out and ready to do a fantastic little painting. Super. Tell you what"
Bob Ross,"Lets start out, have them run all the colors across the screen that you need to paint along with us. While theyre doing that, let me show you what Ive got done here"
Bob Ross,"Ive got my normal old pre-stretched canvas up here, and Ive applied a thin, even coat of the liquid white. So its all wet and ready to go. So, lets just do a fantastic little painting today"
Bob Ross,"I thought today, maybe wed do a nice little winter scene. Something thats very cold. Normally when I do winter scenes, I put a lot of warm colors in them"
Bob Ross,"And weve had some requests for a winter scene thats good and cold. So lets do one of those. Lets try out today, well use the old two inch brush here"
Bob Ross,"We want a small, small amount of the phthalo blue. Just a small amount. Pull it out, and then just tap the bristles right into the color. That sure is a nice, even distribution of color"
Bob Ross,"Work all the way across the top, and its continually blending with the liquid white thats on the canvas, and automatically, it gets lighter and lighter toward the horizon, if you just start at the"
Bob Ross,"top and work down. And thats exactly what were looking for. As you know, in the landscape, things should get lighter toward the horizon"
Bob Ross,"And thats what creates that illusion of distance in your painting. All right. Maybe, take that blue. Maybe Ill add just a little bit more of the blue. This is a winter scene"
Bob Ross,I want color to be very strong and very cold today. This is going to be a very cold painting. You may have to get out your big winter coat just to do this one. There we go. All right
Bob Ross,"Something about like so. And very lightly, well go across just to take out the little brush strokes. And maybe, maybe well have a little water"
Bob Ross,"For that, Im going to use the same old phthalo blue, and the least little bit of the midnight black. So we have blue and black, or black and blue. Whichever your preference. Okay, lets go up in here"
Bob Ross,"Now then. I dont know exactly where the waters going to be, so well just put in a lot of water, and whatever we dont want, well just paint over, cause we can do anything on this piece of canvas"
Bob Ross,"Anything. There we go. Little more color on the brush. Go on the other side, and do basically the same thing. There we are. And still water should always be flat. Level. Waters very lazy"
Bob Ross,"Its always flat level if its still. The only time its not, mostly when its excited and starts moving. There. Okay. Now, the fun part. Lets wash the old brush"
Bob Ross,"And we wash our brush with odorless thinner, shake off the excess, chuckles and just beat the devil out of it. Thats the most fun part of this whole technique"
Bob Ross,"And very lightly, Ill just go over the entire canvas just to take out brush strokes and bring it all together. There. Now then. Tell you what, lets do"
Bob Ross,"Today, lets just have some fun and make some little clouds that float around in the sky. And for that, Im going to use just titanium white with the old fan brush"
Bob Ross,"And you can do this with a one inch brush or two inch brush, it doesnt matter. Thought today wed just do one with the old fan brush, though"
Bob Ross,"Go right up in here and decide where your little clouds going to live, and maybe, in our world, its going to live right here"
Bob Ross,"And using just the corner of the brush, just the corner, make all kinds of little fluffy things that live out in here. Wherever you think they should be. Wherever"
Bob Ross,"Okay, a little more of the titanium white. There. Now you could also do this with a grey color if you want to really make it look like a dreary, dreary winter day"
Bob Ross,"Okay, then well take the large two inch brush and very gently, just tickle the bottom of it. Just barely blend it in. Little tiny circular strokes, using only the top corner of the two inch brush"
Bob Ross,"And then well fluff it, lift it. There. And very lightly, just go right over. And that easy. Weve got a happy little cloud. Okay maybe, maybe this little cloud has a friend. Shoot. Why not"
Bob Ross,"But work in layers. Do one cloud at a time. Do the one that, in your mind, is the farthest away and then put the rest of them in front of him. But just do it one at a time"
Bob Ross,"Dont get in a hurry, and dont get greedy. There we are. Good clean, dry two inch brush. And were going to do the same thing again. But work in layers. Just like when youre painting bushes"
Bob Ross,"Work in layers. There. Those layers are what create distance between each cloud. There we go. Okay, and that easy. We got a couple of happy little clouds"
Bob Ross,"Now sometimes, its fun just to take your brush and, well actually, heres another way. I like to show you as many ways as I know to make things"
Bob Ross,"Just take your brush and spin in little, little floater clouds. You can literally just spin them right into the canvas. Try to keep the brush moving at all times, though"
Bob Ross,"These are the little wispy clouds that live way off in the distance. They just sort of float around and just make little things in the sky. There we are. Wherever, wherever may be"
Bob Ross,"Little indications right over there. Back to old big brush. And we just gently sort of blend those right in. And as blending, you can blend them to any degree of lightness or darkness that you want"
Bob Ross,"The more you blend them, of course, the darker theyre going to get. Theyll pick up the blue thats underneath, so you have to make big decisions here. How bright do you want them to be"
Bob Ross,"Cause if you continue to blend, theyll just go away and leave you. Go away and leave you. There. Okay. And I think something about like its fine for what were trying to do today"
Bob Ross,I just want some little wispy things that are floating around. So theyre good
Bob Ross,"All right, maybe, in our world today, lets take a little bit of phthalo blue and alizarin crimson, and I want to make a lavender color, but I want it to the blue side"
Bob Ross,"I want to keep everything in the blue tones in this painting to keep it cold. Blue is a very, its a cold color. Very cold color. Its hard to tell what that is"
Bob Ross,"So well take a little white, lay it right there. And then mix some color into it, to see if thats what we want. And thats pretty good. I sort of like that one. There. Something like so"
Bob Ross,"Thats not bad. Okay, cut off our little roll of paint, as usual. Lets go right up in here. Lets have, in our world maybe, right here. Just a happy little mountain"
Bob Ross,"Show you the easy way to make some mountains today. Why not. Watch here, watch here. There. You have to decide how many little bumps there are in your mountain, and how many peaks. Just put that on"
Bob Ross,"Scrape off the excess paint. There. It has some, its got a lot of little bumps today. Just wherever, wherever. And let your imagination take you to anywhere that you want to be"
Bob Ross,"This really is your world here. Okay, see there. And the only thing that we have any concern about at this point, is just the top edge. We could care less whats happening in here"
Bob Ross,Have absolutely no concerns about that area at this point. All right. Scrape off all the excess. You can probably hear how hard Im scraping with a knife. There we go
Bob Ross,"Now back to our old two inch brush. And I want to grab this, and pull it. Now just with brush strokes here, we can create the illusion of beautiful mountains that are far back in the distance"
Bob Ross,There we are. And the brush strokes will make your highlights and your shadows all at one time. That easy. This is one of the easiest ways of making very effective little mountains. Very effective
Bob Ross,"Now, you may have to sort of step back and take a look at them. When youre really close to the canvas, its more difficult to see than if you step back"
Bob Ross,"So at home, just step back and get the old iced tea glass out, and take a looksie at your painting. There. See how those, all those brush strokes will create that illusion. There. Okay"
Bob Ross,"And today, thats all Im going to do for that range of mountains. And lets have some fun, put some prussian blue. Its much stronger. Prussian blue is much stronger"
Bob Ross,"Well put it right in that same color. So we get prussian blue, Ill add a little more alizarin crimson to it. But this is a very dark lavender now. Very dark. There"
Bob Ross,"Cut off our little row of paint, once again. Lives right on the edge of the knife. Now, lets come right up in here. Maybe theres another big mountain. There is now. Lives right there"
Bob Ross,"Wherever you want. And maybe he comes down in front, and we can do the same thing again. Put some little bumps in here, and all kinds of little things"
Bob Ross,"Sometimes its nice to have little valleys like it. And you leave them right in there. Right in there, wherever you want them. And well just let that one taper right on off into nothing here"
Bob Ross,"But notice that this mountain, this range of mountains, are much darker than the ones behind it. That makes them stand out, makes it look closer to you. There we are"
Bob Ross,"The other thing thats very important about pulling that paint with the two inch brush on that first range of mountains, theres a misty area between these two"
Bob Ross,"That little bit of mist is your separator. It divides the two. Makes them stand apart from each other. All right, lets go back to our old two inch brush and do the same identical thing to this one"
Bob Ross,Just grab it and pull. But pay attention to angles here. Avoid pulling it straight down. Your mountains will look like huge cliffs. Just sheer cliffs. A billygoat couldnt live on them. There we are
Bob Ross,"So, pay attention to angles. See, by pulling that brush, the little thing that happened right there. Be careful when youre doing this, and watch. These little things will happen"
Bob Ross,"But sometimes, it gets working well and you rub them off before youve even looked at them. These things are, theyre right in your brush. All you have to do is sort of shake them out. There. Okay"
Bob Ross,"But once again, were trying to create that mist down at the base of these mountains. Maybe well have some little foothills down at the base. I like to do little foothills"
Bob Ross,"And that misty area, once again, just like here, will be your separator. So try to create mist here. Most, most important. There. Okay"
Bob Ross,"And with that, weve got a couple of ranges of very nice mountains there. Lets take, lets take, lets take. Put that over out of the way. Save it for later"
Bob Ross,"Im going to take some phthalo blue phthalo blue and some white, and some black. Mix them together. There we are"
Bob Ross,"I want to have nice blue grey color, but with the phthalo blue, so its a little more, its a little more bright than if you did it with the prussian blue. Wipe off the old knife here"
Bob Ross,"And lets take a fan brush. Load it full of this color. Just work it back and forth in the paint. Both sides, full of color. Now then"
Bob Ross,"Maybe now well, here we have some little footy hills that live right in here. Right in here somewhere. Just take the fan brush and tap downward"
Bob Ross,"Try to retain some of that little misty area in there, though. Its most, most important. There we go. Put a little paint out there. Now. There they go, wherever. Wherever"
Bob Ross,"You make the decision where they live. And just drop them in. This is one of the nicest ways weve ever come up with, just making little distant tree shapes. Very easy"
Bob Ross,"And Im going to add a little bit of the titanium white, here and there. See how that sparkles. That one makes him stand out. That easy. But dont overdo"
Bob Ross,"If they all look like that, then they lose the individuality that you see. Lets see here. Well put in some more. Just a few. Then well come back and highlight a few of those"
Bob Ross,"Just so they stand out better. All right. This is a very simple painting, and if youve never painted before, this is a nice one to try. This is a nice one. Cause itll work for you, very easy"
Bob Ross,"Okay, back to little of the titanium white right on the brush, so that we get variations of the same color. Different hues or values of the same color, whatever you want to call it. There"
Bob Ross,Just make all kinds of little things. Something like so. These trees are so pretty. Its one of the nicest places
Bob Ross,"My little squirrel, if youve watched some of the other shows, this would be one of the places my little squirrel would love to live, right in here"
Bob Ross,"And I want to show you a little piece of film that we made, and this is my little squirrel out on the big hunt. And hes out doing whatever squirrels do in the deep, deep woods. Look at this"
Bob Ross,Isnt he the cutest little devil. Hes fighting his way through the forest there. Uh oh. laughs Theres the forest
Bob Ross,"For some reason, I dont really understand it, those little squirrels seem to like hair. I think it reminds them of their nest"
Bob Ross,"But thats, if you havent seen him before, thats the little squirrel we call Peapod. The pocket squirrel, cause he likes to live in my pocket. Hes a character"
Bob Ross,Weve shown him several times in this series. I hope you enjoy him. Ive just taken a two inch brush and tapped the base of this little bit to just to soften. I want that misty area. Okay
Bob Ross,"Take a little more of the titanium white, and just sparkle up a few more of these little areas so they stand out. Just a few. I want to keep this very cold, though. Very cold. There"
Bob Ross,"And then very lightly, lift upward. Just enough to, to blend the base of that all in there. Okay"
Bob Ross,"And maybe under the little foothills back here, maybe, maybe in our world, theres a little bit of snow. So for that, well take the knife. Take a little white. Cut off a little roll of paint"
Bob Ross,"And begin thinking about how the snow would lay out here. There. Just pull it. Gently pull. Something like this. There. So see, this is a very, very simple little painting"
Bob Ross,"You shouldnt have any trouble doing this one. This is one that our instructors would teach probably, first or second day in class"
Bob Ross,"We have instructors that travel all over the country teaching people this. You cannot believe what, what people are doing"
Bob Ross,"In one of the earlier shows this series, I showed a, several boards of paintings that people have sent in. Thats just fantastic. Absolutely fantastic. Okay. Tell you what"
Bob Ross,"I want some reflections on the end. So Im going into that same old dark blue color that we had, two inch brush. Just going to grab right underneath the snow and pull straight down. Straight down, now"
Bob Ross,"Little more of the paint. Straight down. Straight down, there we go. That quick. We add some little reflections under our bank way back here. Very lightly, go across. All right"
Bob Ross,Take a little touch of the liquid white. We can go right back in here. And well just cut in a little water line. This sort of separates where the land and the water come together. Its your separator
Bob Ross,And it also cleans up the base here. Its a way of cleaning up the bottom of your snow and making it look really nice. There we are
Bob Ross,"Really hope you like seeing that little, little squirrel, little Peapod. He lives in my house with me. You wouldnt believe"
Bob Ross,"I have two squirrels that live in the house, and I have three that live outside. Theyre about ready to be turned loose now"
Bob Ross,"But the ones that live in the house, if youve never lived with a squirrel, you havent lived. Because they will get into absolutely everything. chuckles Every single thing in the house"
Bob Ross,"And I find, because they hide nuts all over the house too when they run around, and Ill find nuts in everything, from my pockets to my shoes. But its fun. Its fun"
Bob Ross,"Lets take some prussian blue, black, alizarin crimson, if youre willing, throw some Van Dyke brown there, too. Doesnt matter. Good, dark, dark color. Okay, and we clean off the old knife here"
Bob Ross,"Tell you what. Its time for your bravery test. Lets take the old two inch brush and go right into that pile of paint. But today, I want to bring this brush to a nice, chiseled edge"
Bob Ross,"So to do that, bring it through the paint, wiggle it. That pulls the paint down to the end of the bristles. Wiggle it. And then go through, and sharpen it, just like you would a fine knife"
Bob Ross,"Look how sharp that brush is. But you can bring it to a very sharp chiseled edge. Very sharp, okay. Now then, with that, maybe in our world, you know me, I like big trees in my paintings"
Bob Ross,"Take the corner, and we just push upward. And lets make the indication of a big evergreen that lives right here in the corner of the canvas. Great big evergreen. Strong, powerful"
Bob Ross,"He sits here, watches out for all the little things that live here. And what a view that he has. There we are. But use just the corner and push upward"
Bob Ross,"And thats whatll create all those little leafy, fluffy looking things. Very easy. Tell you what, while we have that old brush going, lets just do this"
Bob Ross,"Maybe we have some things, little peninsula that comes right down like it. Who knows. Who knows. Just push upward though. Bend the bristles. Try to avoid letting it slide like that"
Bob Ross,"See the difference when it slides. You dont have that nice, leafy appearance. Were going to have a bigger bush there now"
Bob Ross,"You see, if anything ever goes wrong, you can always make a bigger bush out of it. Dont worry about it. Dont worry about it. We dont make mistakes. We just have happy accidents. There we are"
Bob Ross,"Im going to load that little brush back up same way again. Yeah, lets go ahead. What the heck. Be brave. This really is your bravery test. Lets come in here and just put a huge tree"
Bob Ross,"Maybe, yeah, what the heck. What the heck. Nothing ventured, and all that. Lets just let this old tree just live right here. Just push him out. There"
Bob Ross,"Maybe, okay, lets go all the way down the bottom. Something like that. Okay. Now well take, I have several little brushes going here, well take another two inch. Put titanium white on it"
Bob Ross,"Little bit of the phthalo blue. Little phthalo blue. So I have a blue color in the bristles. Okay. Now you see, then well take one corner and go through white paint. All right"
Bob Ross,"So I have blue deep in the brush, and white on the tips. All right. Now then. With that, you can go up here and push upward, and lets put on some beautiful little highlights"
Bob Ross,"And every once in awhile, just drag at one corner through a little bit of the titanium white. And thats how well highlight this"
Bob Ross,"Think about shape and form, and all the little things that are happening out here. There we go. Wherever. Okay, theres another one. Something about like so"
Bob Ross,"And we dont want this other tree left out, so let me load it deep with the phthalo blue and white, and then just the corner, once again. Just the corner, see, into the white. Like that. All right"
Bob Ross,"Just touch it. Lift. Lets go right in here, and just pop those in. There. Now dont kill all the dark in your tree, cause it gets working good and you, you get sort of carried away sometimes"
Bob Ross,"I find that Ive covered up the whole canvas with highlights, and then Ive lost my dark and all the, all the deep shadow areas"
Bob Ross,"And the little squirrels have got to have a place to go in there and hide. Got to have a place to go and hide. All right, Im going to dip the brush into liquid white"
Bob Ross,Then well go right through titanium white. Pull the brush in one direction. See there. Load a lot of paint into it. A lot of paint. Biggest mistake made is not enough paint. There
Bob Ross,"I went through the liquid white first, only to thin the paint, because a thin paint, as you know, will stick to a thick paint. Thin to thick. There we are"
Bob Ross,"See, and we can just put all these little snow covered highlights on these things. And if this works just right, these little bushes will look just like lace. Just like lace"
Bob Ross,"When I lived in Alaska, this unbelievable Jack Frost would come through there and do his magic. And the trees would be covered with ice, fog had frozen. Its the most gorgeous thing you have ever seen"
Bob Ross,"Its cold in Alaska during the winter, but it may be as beautiful as the summer. Take a little titanium white. Maybe we can see a little snow, right in there. Right there somewhere"
Bob Ross,Wherever you want it. But no pressure. Allow that color to break. Just graze it when you come across. And make long strokes. Like that. But no pressure. Absolutely none
Bob Ross,"If you put a lot of pressure on it, its going to look like you, well this is my son Steve, says look like you mushed it in there and just iced a cake"
Bob Ross,"I dont know if thats really a word or not, but you certainly know what it, what it means. You really just mashed too hard. And well put some little grass areas around the edges here"
Bob Ross,"Okay, got to sort of bring it together, make it part of the painting. There. Now maybe, in our world, maybe theres a little twig or two"
Bob Ross,"So well take, well take a little dark sienna and paint thinner, and we want to make this paint thin. Very thin. Almost, almost a consistency of ink. Probably can see it running there. Its that thin"
Bob Ross,"Now, when you have it, you can pull the one side of that right through a little liquid white, and maybe in our world, theres a little stick that lives right here"
Bob Ross,"And by pulling it through the liquid white on one side, youll make the highlight and the shadow at one time. See there. Sort of sneaky. But it works well. There we go. Wherever. Okay"
Bob Ross,"And now weve got a little, little stick in there. Tell you what. All we need to do, take the knife, here and there, we can scratch in a few little sticks and twigs"
Bob Ross,"And we about have a finished painting. This is, as I mentioned earlier, this is a very simple little painting. If youve never painted before, its a good one to try"
Bob Ross,"Especially if you like very cold winter scenes. So I do hope you give it a try. From all of us, Id like to wish you a happy painting, and God bless, my friend. soft, cheerful music"
Bob Ross,"- Hi, welcome back. Certainly glad you could join us today. Thought today we could do a fantastic little seascape"
Bob Ross,"So Ill tell you what, lets start out have them run all the colors across the screen, that you need to paint along with us"
Bob Ross,"While theyre doing that, come on up here let me show you what Ive got done already. I got my standard ol 18 x 24 inch canvas, but you use whatever size is convenient for you"
Bob Ross,"and today, Ive cut a little oval out of some contact paper, and just stuck it on. And then we covered the whole area here with just a thin, even coat of liquid white"
Bob Ross,"So its all wet and ready to go, so. Lets just have some fun. Thought wed do a little seascape today that seemed very warm and make you feel good just to look at"
Bob Ross,"Im gonna start with the least little touch of the cadmium yellow. Least, little touch. Maybe reach over here and get a little touch of the Indian yellow, just mix those together. Ooh, thats nice"
Bob Ross,"Lets go up here. Now maybe well have a little sun up in here in the sky today. So well just start, and go around like this. Theres not a great deal of color on the canvas. Not much color"
