person,text
Bob Ross,"Then you can begin putting in little tree shapes or bushes, or whatever you want em. There. But you have to make these big decisions how many are there, where do they live, whats their names. There"
Bob Ross,"All these little things, they just sort of help if you make up little stories in your mind, then these things become personal to you, they become your friends and it just sort of makes painting a"
Bob Ross,"little easier and more than that, it makes it fun and painting should make you happy. Shoot, theres enough unhappy things in the world, painting should be one of those things that brightens your day"
Bob Ross,There. Something about like so. And then lets find our little liner brush
Bob Ross,"Well take a little paint thinner and go right into that little lavendar color that we made for the shadows of the mountain, it doesnt matter, its just a light color and itll work"
Bob Ross,"Thin like ink, bring that brush to a sharp point, we can go up here and here and there put in indication of a little stick and a twig. We need some trunks in these trees, we dont want to fall over"
Bob Ross,"There they are. Cause then wed have that old question if a tree falls in the wood, nobodys there to hear it, would there be any noise"
Bob Ross,"dinging Now, I have several of these old brushes going, so Im just gonna take another two inch brush here, take a little of the Sap Green, a little yellow, mix it together, a little Yellow Ochre,"
Bob Ross,"Indian Yellow, and here and there were gonna pick up some Bright Red and well just vary these colors back and forth. There, thats lookin pretty nice"
Bob Ross,"A little rigid paint, just like so, push till you get some color on both sides. There we are. Push, thats what loads that brush, though"
Bob Ross,"Then you can come up in here and start making big decisions here. What color is each little tree, whats it look like"
Bob Ross,"There we go, see I added just a touch of the Bright Red to that, change the flavor totally, completely"
Bob Ross,"And use just the corner of the brush and look at all the little mumbling you can make, that easy. Little rascals live right there on your brush, all you gotta do is just shake em out"
Bob Ross,"But think about form and shape, when you do this dont just throw em on at random because then youre gonna be upset with me"
Bob Ross,"Then youre gonna be upset and we dont want that, we want you to be happy, we want this to work for you. There, a little bit more of the Sap Green, oh thats nice. Okay"
Bob Ross,"Just still varying back and forth between different colors, all the yellows, a little bit of the Bright Red, and Sap Green. Thats a pretty little tree there. Maybe right here, theres another one"
Bob Ross,"And by doing one at a time, putting em in front of everyone that you have on there already coming forward, forward, that creates that illusion of distance, gotta leave some dark areas back there,"
Bob Ross,"though, for the shadows, otherwise it just wont look right. And well put a few right in here. Okay"
Bob Ross,"But look at all the layers in there already, already you can see deep in there and we can take the knife and scrape through, put a few sticks and twigs and just little things that live in there"
Bob Ross,"Were gonna come right here, put some land in there and thatll probably be hard to see against this liquid black, but in just a second Ill put a little highlight on there and itll jump right out,"
Bob Ross,jump right out. There
Bob Ross,"Okay, Ill mix up a little bit of brown and white, maybe even put the least little touch of the Bright Red in there, very little amount of that, just enough to change the taste a little"
Bob Ross,"See, barely touch, this is just like you were putting snow on the mountain, but barely, barely touch. Barely touch, caress it, gentle"
Bob Ross,"And then well take our fan brush and well just use some of those same colors, the yellows and little touch of the red here and there"
Bob Ross,I wanna pop in a few little grassy things that are living out here on the dirt and just let them work their way down
Bob Ross,Thatll break up that straight line and the edges on the dirt and bring it all together. There
Bob Ross,"It also gives my little friends a place to hide when they come down here, maybe well put some water down here and they can come get a drink then"
Bob Ross,"I get a lot of letters from my young friends all over the country and theyre watching those little rascals and theyre learning about how fantastic they can be and that does some good things, if"
Bob Ross,"people just understanded all these little creatures. Shoot, we gotta take care of em, if we dont, nobody will. Alright lets take, Im using that same brown color, same ol brown color"
Bob Ross,"Ill tell ya what, lets just have a big tree right here, you know me and my big trees. Here he comes"
Bob Ross,"All were doing now is just dropping in a basic shape, were not looking for any detail at this point whatsoever. mumbling there we go, well make that decision later"
Bob Ross,"Take a little white, Im going right back into that lavender color, its almost a gray, its more of a gray than a lavender"
Bob Ross,"But, see, let that ol brush twist and turn and all these little things just happen in there, dont fight em, cause thats whatll make your tree interesting is having all these little wiggles in"
Bob Ross,"your trunk. Alright. Go back to my brush here that has the highlight colors on it and well take a little of the red and yellows, mix em together. Alright and lets go up here"
Bob Ross,"Maybe this tree has some beautiful colors on him too. I think Ill go a little bit more into the red-ish color. Oh yeah, thats nicer, I like that"
Bob Ross,"Just find the flavor that you like and drop it in there. There. Put some little leaves on him here, give him some little arms and there, see em"
Bob Ross,"And its just the corner of the brush, thats all were using, all were using, just the corner. Dont get greedy and get it all. There"
Bob Ross,"Little bit right in there, well just let it drift right into nothing. Lets try a little bit of the Yellow Orchre on the brush too, right there"
Bob Ross,"See, well put a nice little bush lives there like that. Okay. And maybe, Ill tell ya what, let me find a little more of the Sap Green, there it is"
Bob Ross,"Maybe back here is a little, oh yeah, there it is, you knew it was there, you knew it was there, didnt ya. Just drop that right in. Alright. Okay, Ill tell ya what"
Bob Ross,"Maybe well have a little water in there, we talked about the possibility of a little water. Find a fan brush, there, I like that one better"
Bob Ross,"Im gonna take some white, Liquid White, mix it with Titanium White, be right back, dont go away, dont go away, a little Phthalo Blue mixed right in with it"
Bob Ross,"I put the Liquid White in there only to thin this color a little bit because, as you know, a thin paint will stick to a thick paint"
Bob Ross,"Now that maybe in our world right here, maybe theres a happy little stream just floatin along and it falls off, splashes a little, just works its way on down here"
Bob Ross,"This is just Liquid White, a little Titanium White, a touch of Phthalo Blue in it"
Bob Ross,"Push here and there to give it a little ripple and splash cause theres stones underneath the water that you dont see and it causes little do-ers to happen in the water, all these little things"
Bob Ross,"Just think about a little stream bubbling along here and playing now, all kinds of little things. There we go. Now, where does it go, where does it go. I have to make some big decisions here"
Bob Ross,"I dont know where it goes. Well just let it run right on off the canvas, then well worry bout it later. Little ripples here and there"
Bob Ross,"I did that in a super easy, nice way to make a stream, it looks pretty good that quick"
Bob Ross,"Ill tell ya what, we need somethin on this side to hold that stream together and well use some more of that same ol brown color and lets have a nice tree right there. There he comes"
Bob Ross,"And all were doing, all were doing, once again, is just putting in a basic shape, maybe well have a nice tree on this side too, we dont want it left out. There we are"
Bob Ross,"And well take our brush that has the highlight color on it, tap a little color and lets come right in here, oh yeah, oh yeah, there it comes and well put some nice little leaves and stuff on there,"
Bob Ross,"change the flavor a little here and there. And off we go. There. See, you can create beautiful, beautiful things just using the corner of a two-inch brush, you really can do that"
Bob Ross,"Imma go into a little of the red-ish color, oh yeah, a sparkler, theres a sparkler right there, right there. Now that one will attract your eye to it"
Bob Ross,"When you start using these bright red ones, be careful not to put too many in because itll make your eye go sort of crazy. Maybe theres one in there. Wherever, wherever. I see where I wanna go now"
Bob Ross,"Maybe lets do this, lets just do this. Take a little of that brown color, just fill this in, come right on out, thatll hold our stream in so it doesnt get away"
Bob Ross,"Them son-of-a-guns sometime will get away on you, just run off and leave you. So lets come right down here, put some little grassy things right on that stream, there they are"
Bob Ross,"Just tapping though, all were doing is just tapping. There"
Bob Ross,"And maybe back in here, yeah, youre right, you were right, theres some more little bushes and all kind of little things that hide in there, there they are"
Bob Ross,"Now then, lets get crazy, shoot, we got a minute left here"
Bob Ross,"Take a little bit of the Liquid White, put it out, to that Im gonna add a little Dark Sienna, a little bit of the Bright Red, not much, but I have a very, very thin color now"
Bob Ross,"Take our fan brush, load it full of Dark Sienna and Van Dyke Brown, just mix em together like so and then were gonna go down here and run one side through that light color"
Bob Ross,"So now I have dark on one side, light on the other, maybe we have a big tree, we do now, vocal noises lives right there. And that way you can do both sides at once. vocal noises Have another one"
Bob Ross,"And you put as many or as few in your world as you want. Maybe heres a, oh my gosh, theres a huge one there. There is a huge one there, darken him up a little. Alright"
Bob Ross,"Were gonna have a big tree, we might as well have a big tree, maybe well have another one. Sometimes you get started with this and you cant stop, it gets to be fun"
Bob Ross,"Now, you take our liner brush, liner brush, come in here, maybe theres a few ol limbs that hang out here, this is that same brown color. Just let a ol limb hang off in here, wherever, wherever"
Bob Ross,"And you just put as many or as few as you want in here, as many or as few. Theres some back here on this one, maybe theyre behind that one. There"
Bob Ross,"Ill tell you what, maybe well put a few leaves on this so we dont have to be real careful about where we put these limbs. Alright"
Bob Ross,"Now then, sometimes I like to show a little reflected light on the back of these trunks, so Im gonna take, lets use a little touch of Prussian Blue and Ill mix a little white, we use Prussian Blue"
Bob Ross,"because its very dark and very strong and Im just gonna tap the least little touch of a little reflected light on the back of some of these tree trunks down here, the least little touch, the least"
Bob Ross,"little touch. And well take a little dark and just tap and this is a way you can create a feel of bark on your tree, I mean, when it dries it will feel like real bark. There"
Bob Ross,"Lets come up in here and just take that little brush and tap in an indication of a few little branches that live up in here, just black, touch of Prussian Blue, or you could use brown if you wanted"
Bob Ross,"to, its up to you, up to you. There. Oh, right over my mountain, thats alright, we know its back there. There we go. Alright"
Bob Ross,"Now then, just leave that color on there and go in a little yellow, thatll instantly turn green cause it has blue in it and well tap in a few highlights. There we are. Just here and there"
Bob Ross,"And with that, shoot, I think we got a pretty nice ol painting, gonna call that one finished. So, from all of us here, happy painting and God bless. light music"
Bob Ross,"- Hi, welcome back. Certainly glad you could join us today cause I thought today wed just do a fantastic little painting I think youll enjoy"
Bob Ross,"So lets start out, have them run all the colors across the screen that youll need to paint along with us. While theyre doing that, let me show you what Ive got going up here today"
Bob Ross,"And today, Ive got all three of the mediums being used on this one canvas here"
Bob Ross,"We have in the top here, I put a mixture of liquid white and liquid clear because I want to have some transparence in this. If you dont have the clear, you can just use white"
Bob Ross,"Down here I put the liquid black, and Ive just taken a brush and sort of stirred it up a little bit. And thats basically all that we have done"
Bob Ross,"And with that, brush rattling against metal if everything goes well, well just do a fantastic little painting. Lets start out today with a touch of the yellow ochre"
Bob Ross,"Just a little bit of yellow ochre. Dont need much on the two inch brush. And lets go right up in here. And well just put in a little, just a little thing like so. There we are. There, okay"
Bob Ross,Then Im gonna add at least a little touch of cad yellow to the brush so it gets a little bit brighter. Im going to come back in a minute and put white in there and brighten that center up even more
Bob Ross,There. Just want a nice yellow color in here. Like that. Youre just using little criss-cross strokes. Here we are
Bob Ross,"Now, without cleaning the brush, I want to touch a little yellow ochre and dark sienna. So I have a nice brownish-yellow color, yellow brown color, whatever you want to call it"
Bob Ross,But a little bit of each. Then well come right in here. Still using the little criss-cross strokes. Like so. Get a little more of the paint and well go on the other side and do the same thing
Bob Ross,I like these little paintings where it looks like the suns glowing through from the back. Theyre very nice and very easy to do with some of these mediums that we have
Bob Ross,A little more of the dark sienna. Want it to get progressively darker as it works away from the light. Progressively darker. There we go. Alright
Bob Ross,"Now, Im gonna begin adding the least little touch of van dyke brown. Not much, just a little. Just a little so it gets a little darker"
Bob Ross,"And then its gonna pick up the liquid black thats already here, and automatically, its gonna get darker. Let these mediums work for you. Let em work for you. Alright. Okay, now then"
Bob Ross,Let me just pick up a clean brush. Ive got brush rattling against metal several of each brush going. And lets go up in here and just blend this together. Just really want to blend it together
Bob Ross,"There. Let these colors just go right to each other. The transition between colors then will be very smooth, very gentle. They wont distract the eye"
Bob Ross,"Sort of looks like a big old egg I fried the other morning. Im not much of a cook. There. Okay, now then. Time to clean a brush. Thats the fun part of this. Thats the fun part"
Bob Ross,"chuckling There we go. Now then, Im gonna take that same little brush and go right into some titanium white. And we dont need much, just a little on the brush"
Bob Ross,Start here and begin working around and around and around and around. We want this to be the brightest spot in the sky. Just work it and blend it. Let it work outward
Bob Ross,But dont go back into the center with a dirty brush. Youll lose that nice glow and we want to save that
Bob Ross,"You could even take a little paint on your finger if you wanted to and make the indication, maybe theres a little sun up here. Who knows. Who knows"
Bob Ross,"And then very lightly, very lightly, then just blend it all together. But itll give you the impression that theres a little sun up in the sky. Alright"
Bob Ross,"Now then, today, I say lets just have some fun and enjoy it. Let our imagination take us to some beautiful places and see what happens"
Bob Ross,"brush rattling against metal We got the brush clean, thats the most important part of it. Now then, lets take some dark sienna. Pick up a little of the titanium white"
Bob Ross,"Maybe put a little black in there with it. There we go, make sort of a, sort of a gray with a little brown in it. Oh, its getting nice there, its getting nice"
Bob Ross,"Just sort of work it back and forth to you. Find the flavor that you like. There. There we go, lets try that. Well have a fan brush. This is a number six fan brush"
Bob Ross,"Or you could use a number three or whatever. Its up to you. Color on the brush, both sides. Well go up here. And I want this to be like little distant trees back in here"
Bob Ross,"Im gonna add a little more white. Its a little brighter than I wanted it to be. I want it to be a little more subdued. Oh, thats much better, much better. Im happier about that"
Bob Ross,"There, maybe theres some little trees that live back in there. And all Im doing is touching with the fan brush and sort of pulling downward. Just pulling downward very gently"
Bob Ross,This is a super way of making a lot of trees very rapidly. Or the indication of a lot of trees. There. Just sort of let it taper right on off into nothing
Bob Ross,"Now then, take a clean, brush rattling against metal dry two inch brush. Just want to tap the base of this to create that illusion of mist. A lot of mist. And very light, very lightly lift upward"
Bob Ross,"Just upward. Okay, go back to the same brush, same little brush, and I want it to be just a little bit darker, so just load the brush up again. Same colors, just a little darker"
Bob Ross,"Now then, maybe in our world there lives, yep youre right, another little layer here. This helps create that illusion of depth in your painting, distance. There"
Bob Ross,"Maybe it comes right on down like that. On up here somewhere. We dont even know where it goes. There. And once again, back to the two inch brush"
Bob Ross,"I want to tap the base of that to help create that illusion of mist. Just tap it. Let it just disappear. Okay, and very lightly, two hairs and some air. Just lift it upward"
Bob Ross,But look at the amount of distance weve created in that just by playing with a little color. Alright. Let me clean off a spot to work here. Well lay that over there out of the way
Bob Ross,"Might need it later. Lets go into a little bit of, little black, little van dyke, dark sienna. Now Ill put just a little bit of white in it, not much. I want this to be quite a bit darker"
Bob Ross,Maybe a little more of the white. There we go. There. Makes a very nice color. But its sort of toward the dark sienna color. Thats what were sort of looking for
Bob Ross,"Tell you what, whoops, let me get a bigger fan brush. Goes a little faster. Picked up the number three and I think Ill use the number six. Number three would work just as well. There"
Bob Ross,"Its just that I want to go a little bit faster. So, well use this one and well drop an indication here and there of some happy little evergreen trees"
Bob Ross,"But these are closer, so you see a lot more detail. See how that darker color stands out against that light. Mmm. Just sparkles. Just sparkles. Maybe theres some little indications, I dont know"
Bob Ross,"Maybe they come right on down like that. See a few little more little indications behind those trees. There, another one. I think we see some detail there. Okay. Lets have a few on the other side too"
Bob Ross,"I dont want that side left out. Maybe, shoot, maybe theres a big one right there. But the same way, use a corner of the brush"
Bob Ross,"As you work down the tree, push harder and harder just to add more pressure. Make the bristles bend down much more. Like that, look at that. You can do that. There we go. Have another one"
Bob Ross,"Shoot, we just painting a whole forest here. And thats alright. Thats alright. Put as many or as few in your world as you want cause painting is very individual"
Bob Ross,"Everybody, everybodys gonna see this differently and thats the way it should be. Thats the way it should be. There. Okay, maybe. I know, lets have one more over here"
Bob Ross,"Well have one more of them little devils. Right on out. Now, sometimes its interesting to show different depths. Maybe Ill add more black to that"
Bob Ross,"Maybe back in here, you can see a few more back in there. There. Just let em sort of fade in there. Whoa, we really do have a forest, dont we. Now, once again, two inch brush"
Bob Ross,"I want to create that illusion of mist. Oh, let me show you a trick. Let me show you a trick, let me show you. Let me show you. Just, I saw something. I get excited sometimes, please excuse me"
Bob Ross,"Now see here, if you want to take these trees right here and push them further back. Let me put some mist and well take. Lets just strengthen this tree here a little bit because that mist is there"
Bob Ross,"Watch here, watch here. Look how I push that tree back just by doing that. Thats a little trick that helps show distance in a painting. That misty area is so important"
Bob Ross,"Now, when we create the mist here, we dont want to destroy that edge. We just want to tap in here. Just sort of let em blend together. Look at there though. But look at the layers in there now"
Bob Ross,"And when youre doing your painting, look at these things. Pick em out, make em work for you. Shoot, but theyre lazy if you dont find em and force em a little bit"
Bob Ross,Theyll just lay there and sleep. Like me when the alarm clock goes off in the morning. There. Same thing over here. Well just let that blend right in to just about nothing
Bob Ross,"In fact, Ill put a little color on the brush. Maybe theres a big tree that lives right here, I dont know. Some nice little bushy things back in here. Add a little bit more of the dark color. There"
Bob Ross,"But see, each layer gets darker and look at the amount of distance in this little painting already. Theres so many plains in there. And these little plains are what create that illusion"
Bob Ross,"And theyre really not hard to do. Theyre really not hard to do. There, just work on one level at a time though"
Bob Ross,Sometimes we get in a hurry because it starts to work real well and it feels good and we just wanna on. You know what Im saying. We get carried away. I bet its happened to you if you painted
Bob Ross,"Certainly happens to me. I start seeing all these different things and next thing I know, Im out in left field somewhere. There, we put one here too, what the heck. Maybe, maybe, maybe"
Bob Ross,"There I go with that maybe again. Maybe we have, yep. Maybe theres a little bush lives right there. Right there. See. You see these things and you drop them in. Alright. Okay, now then"
Bob Ross,"We can take our knife and just sort of make the indication here and there of some little trunks. I dont want these to be too distinct, too far away, or too subdued"
Bob Ross,"But you can see a few little things here and there. And we can take that same little brush that has a color and Im gonna add a least little touch of maybe some yellow ochre, a little bright red to it"
Bob Ross,A least little touch. I dont want much color on the brush. Very small amount
Bob Ross,"And just here and there, I want to pop in a little of that color to make it look like theres a little highlight on some of these. But its real easy to overdo here"
Bob Ross,Too much will distract and youll lose that softness. And thats one of the things thats so great about using the liquid black
Bob Ross,That liquid black will always make things look very misty and very soft because it grays color. It adds a gray color. Lets see here. Find my old brush
Bob Ross,"Well just use the same old brush, what the heck. Im gonna go right into a little touch of the yellow ochre. All the yellows. Indian yellow. Be right back, dont go away. Get a little white"
Bob Ross,"intakes breath Oh, thats nice. I want a bright one right here. If our suns right there and its shining down. Look at there. I want a sparkler. The lights gonna strike that"
Bob Ross,"Its really gonna be pretty. There we go. Look at all those beautiful little colors. Maybe right there. Put a nice little red color in there, let it just work its way back"
Bob Ross,"Just using the corner of the brush, thats all you need. Its really all you need. water splashing I want to take a little paint thinner and go into some van dyke brown"
Bob Ross,"Here and there, well put the indication a little tree trunk. Some little sticks and twigs and all those little things that live in there. Maybe back here, we can see some things. Old dead tree maybe"
Bob Ross,"Wherever, wherever. Theres one, mmm. Thats an old crookedy one. That ones crooked. water splashing brush tapping Okay, tell you what lets do. Lets get crazy here"
Bob Ross,"Lets get crazy and have some fun. Maybe theres a little house sets here. You know me, I like little houses and big trees. Thats my thing. If you dont want a house in yours, dont put it in"
Bob Ross,"Every once in a while, I get a letter from somebody said, I didnt want a house in that painting.  And you have that right. When you do yours, do it any way that you want. There"
Bob Ross,We get a lot of letters from people all over the country who are painting and doing fantastic things
Bob Ross,"The photographs that people send me, sometimes its almost unreal that people are doing such beautiful paintings. Every so often, we like to put em together and show em here"
