person,text
Bob Ross,"instrumental music - Hello, Im Bob Ross, and Id like to welcome you to the 20th Joy of Painting series"
Bob Ross,"Son of a gun, its hard for me to believe this is the 20th series, but it is, and Id like to thank you very much for inviting me back for another series of painting shows"
Bob Ross,"If this is your first time with us, let me extend a personal invitation for you to drag out your brushes and your paints and paint along with us each show. I think youll enjoy it"
Bob Ross,"Tell you what, lets start out today and have em run all the colors across the screen that you need to paint along with me. And I think well just do a happy little picture today"
Bob Ross,"So, let me tell you what Ive got done up here. We have our standard old 18 by 24 inch canvas, but you use whatever size you want"
Bob Ross,"And we have it covered with a little bit of liquid white, just a thin, even coat, just enough to make the canvas wet. And with that, well just take off, and well have a super time"
Bob Ross,"Start today, I think well use a little one-inch brush and well go into a very, very small amount of the phthalo blue. Just a little bit. Dont want much"
Bob Ross,"And lets make some, lets make some happy little clouds in our world. Lets come right up here. And, well just take this brush, and well just bounce in some nice shapes"
Bob Ross,"Now, when were doing this, were interested in the white area, not the dark. So dont worry about the dark area. Were gonna blend that all out"
Bob Ross,"All were doing is putting in some color for the shadows of our clouds. And this is one of the nicest, easiest ways of making very effective, great big ol clouds. There"
Bob Ross,"See, were interested in this white area, once again. Maybe theres another little cloud that lives in our world, right along there"
Bob Ross,"Wherever you think they should be, then thats exactly where they should be. Just wherever. And just use the old little one-inch brush, and just, Im making tiny little circles"
Bob Ross,"Just tiny little circles. There we are. Okay, maybe Ill add a little color right in here too. Just so therell be a little color at the base of this cloud. There"
Bob Ross,"Now then, lets take our little brush, this is a two-inch brush, and go right up in here, and very gently, Im using just the corner of the brush"
Bob Ross,"Well make little, round circle patterns here, just sort of wind it up, blend it together. Allow it to blend with the white thats already on the canvas"
Bob Ross,"And thats the joy of this wet-on-wet painting technique. The fact that its wet allows you to blend color, right on the canvas. Right on the canvas. There you go"
Bob Ross,"Now, its beginning to make a little sense. See how those dark areas end up being the nice shadows and the white areas will end up being our clouds"
Bob Ross,"This is a great way to make clouds for seascape paintings. Just great, big, fluffy clouds. Works very nice. There we are. Now then, while we have this old brush dirty, tell you what lets do"
Bob Ross,"Lets go back into a little bit more of that phthalo blue. Phthalo blue is a very nice color, its a very warm blue. I like that. Just a little color on the brush. Okay, lets go back up here"
Bob Ross,"Lets have some water in this painting. If youve painted with me before, you know Im a fanatic for water. I love water. And its one of the nicest, easiest things to paint in this technique"
Bob Ross,"And today, maybe this one will be still water. So we want these lines to be basically straight across here. Cause as you know, still water is always flat, always level. There"
Bob Ross,"Now, just very lightly, go all the way across, and sort of bring it together. and that light area here, itll remain in there. There. Okay"
Bob Ross,"Now, the most fun part of this whole technique is washing the brush. So lets do that. We wash our brushes with odorless thinner. Shake off the excess. laughs And just beat the devil out of it"
Bob Ross,This is where you take our all your frustrations and hostilities and just have a good time. Lets go into a little titanium white. Well use the old fan brush. Well make some little clouds
Bob Ross,"Ill be right back, let me grab the least little touch of the bright red. Just enough, a little bit more. There. Just enough to put a little pinkish glow into our little clouds"
Bob Ross,"Dont want much, dont want much. Okay, lets go up here. Now we gotta make big decisions. Well just use this brush and decide where our little clouds live"
Bob Ross,"And, we just come along here and sort of drop em in. This also works very well with a little one-inch brush. Very well. Either way that you wanna do it. Either way"
Bob Ross,"If you havent painted with us before, one of the things that we try to do here, we try not to teach you just to copy. All were trying to do is teach you a technique and turn you loose on the world"
Bob Ross,"We use no patterns, no tracings. All we do is sort of have an idea in our mind, and we just sorta let it happen"
Bob Ross,"And if youll practice this a little bit, very soon you can enjoy the freedom of creating a painting right on the canvas. Right on the canvas. And to me, thats where it really becomes fun"
Bob Ross,"Its when you can literally create a painting right on the canvas as youre working on it. You look at what youre doing, and youll see things. Theyll just sort of happen"
Bob Ross,And you learn to take advantage of whatever happens and use it to make your painting special. And you can do that
Bob Ross,"Okay, lets go back, bangs brush on easel get our old two-inch brush, and I just wanna now blend all that together. Just blend together. Im being careful not to touch these top edges yet"
Bob Ross,"Im just blending the blue and the white down here together, very gently, still using little circular strokes. There we go. Just sort of let that mix together"
Bob Ross,"Im getting very close to the top, but Im trying not to touch it at this point. Very close, but not touching. There. A little bit up in here. See. Just sorta blend it together"
Bob Ross,"Mix it up, just like youre making a cake or something. Just mix it up. A little bit in here, right there. Okay. Good. But this is a beautiful way"
Bob Ross,"bangs brush I just beat the brush like that to knock off excess paint. Its a beautiful way to create a very effective, big, fluffy clouds. Now were just sorta lifting it up"
Bob Ross,"This will blend it all together, smooth it out. There. See there. And then, very lightly, two hairs and some air, just gently, gently, gently blend the entire sky"
Bob Ross,"And with that, shoot, we have a pretty nice looking little sky. And there wasnt anything to it. Now then, lets get crazy. Lets take, well use some midnight black, little Prussian blue"
Bob Ross,"Now, Prussian blue is much darker than phthalo blue, its strong, whew. Very strong color. Well put some Van Dyke brown, a little Alizarin crimson in there too"
Bob Ross,"But were looking for a very dark color, it should look black. Pull it out as flat as you can get it, and go straight down with the knife, and well just cut off a little roll of paint. There it is"
Bob Ross,"Its right out at the edge of the knife. Lets go up here. Now, I want to make some tiny little mountains up in here, that are far away"
Bob Ross,"I dont want these to be very big, because we wanna create the illusion of distance here. Using a very firm pressure, just literally push this right into the fabric"
Bob Ross,"And I dont want a lot of mountains today, thats about all we need. With a two-inch brush, Im gonna grab this and pull it. Just pull it"
Bob Ross,"It does two things, removes excess paint and it blends all this together. There we go"
Bob Ross,"Now, when were painting mountains, as you know, you always want the top of the mountain to be more distinct than the bottom of the mountain"
Bob Ross,"Because at the bottom, we have mist and now we have wonderful pollution, and we have all these things that break up and diffuse light, and it creates this softness at the base of the mountain"
Bob Ross,"Lets go into a little titanium white, what the heck. Very small amount. Get a very, very small amount of paint on the knife. Now then, barely touch, no pressure. No pressure"
Bob Ross,"And I dont want this to be very distinct. I want this to be very quiet, subdued, far away, gentle, soft"
Bob Ross,"Think about those types of words and stuff when youre painting, and itll help your hand go much more gentle. But very soft. Dont want a lot of detail in this"
Bob Ross,"And well take a little bit of blue and white, and just the indication of some shadows, dont even want a lot of shadow back here. Too much detail will ruin that illusion of distance"
Bob Ross,"Just enough, just enough to give the feeling that theres a nice mountain living back in there"
Bob Ross,"Now with a clean, dry brush, following the angles, always follow the angles, were gonna very gently, very gently tap it and then lift it upward"
Bob Ross,"And thatll help also create that illusion of mist at the base of the mountain. Shoot, lets get crazy. Find another one-inch brush. Or you could use your fan brush, whatever"
Bob Ross,"Take a little bit more of the titanium white. Maybe in our world, maybe this old cloud right here, it just sort of drift right down in front of the mountain. So, just a little white"
Bob Ross,"Little circles, tiny little circles. Shoot, maybe theres one right here. I dont know. I dont know, just sorta look at your painting and make a decision"
Bob Ross,"Maybe it just sorta wraps this old mountain up. Well take a two-inch brush and just blend it together. This is a super way of making mountains, that look like their just laying out here in the mist"
Bob Ross,"I lived in Alaska for many, many years, and you see some of the most beautiful scenery there. God was having a good day when He made Alaska. Beautiful. Beautiful"
Bob Ross,"There, see that old mountain just lays up here in the mist now, and floats around, has a good time all day. Now then. Maybe well have some little foothills back here. I like to do little foothills"
Bob Ross,"And well take some of that same mountain color, add the least little touch of sap green to it. Little sap green, there we are. But its predominantly blue"
Bob Ross,"The one thats farthest away here, well make predominantly blue. Okay, let me wipe my knife off. And lets use, well use a one-inch brush, what the heck"
Bob Ross,"You could use your fan brush or two-inch brush, it doesnt matter. Load a little color in there. And lets go right up in here. Now, we have to make a big decision"
Bob Ross,"Where does our little foothills live. Maybe well have one coming right over here. Well start this one out back here, just using the corner of the brush and pulling straight down, gently"
Bob Ross,"Maybe a little foothill comes right over like that. Wherever. Once again, this is a very individual thing, painting is. So, just sorta look at it and make up your mind how you want your painting to be"
Bob Ross,"Now then, when youre doing the foothills, especially layers of foothills, you want a little misty area in between, thats your separator"
Bob Ross,"So take the brush, two-inch brush, and just tap the base of it. And you can tap quite firmly. You can probably hear how hard Im hitting the canvas here"
Bob Ross,"And then, very lightly, just lift it upward a little bit. There. Okay, now then, maybe well have several layers in here"
Bob Ross,"When youre doing landscapes, each layer, each plane, as it comes closer to you, should get darker in value. So well use that same color, and Ill just add a little bit of that mountain color"
Bob Ross,"See, its right here, Ill just add a little of that into it. Thatll make it a little darker. Maybe a touch more of the green. There we go. Okay"
Bob Ross,"Now, maybe over here, well hold the brush up like this. And thatll make tops that are a little taller, a little more distinct, cause theyre getting a little closer to you. There"
Bob Ross,But you can create just layer after layer after layer like this. And it enhances your painting tremendously because it creates that illusion of depth
Bob Ross,"Back to our two-inch brush, and once again, once again, we wanna create that mist. See how that mist in between separates. Its your best friend. Take care of it. Take care of it. There we go"
Bob Ross,"Now lift upward. And maybe, Ill tell you what, lets have one more. Lets have one more. Im adding a little more of that dark color right into that same original pile. One more"
Bob Ross,"And then, maybe it lives right here. But its darker in value. Its a little darker. There we go. And well let him come, maybe, right down in here. I dont know. There"
Bob Ross,"But each layer, each layer needs to get darker in value. To keep that feeling of distance in the painting. And I know I repeat that over and over, but its so important. So important"
Bob Ross,"You dont want just a flat old painting. Shoot. We want a masterpiece here. And you can do that. Once again, were gonna tap that base, just like so. Very lightly, lift it upward. There"
Bob Ross,"And maybe, were beginning to get down here to where there are a few reflections, so well take a little paint on the two-inch brush, grab it and pull it straight down"
Bob Ross,"Its most important that these reflections come straight down. Most important. If you go at an angle like this, it wont look right. See, even there, it doesnt look right. Now very lightly, go across"
Bob Ross,"Very, very lightly. Just enough to blend it and give it the feeling of water. Its one of the nicest things about this technique, its instant reflections"
Bob Ross,"chuckles Now then, well take a little of the liquid white, put the least little touch of the bright red in it. Just, least little touch. Just enough to flavor it a little bit"
Bob Ross,"Be careful, because very quickly, this can get really intense in color. Now we just cut across. Thats all there is to it"
Bob Ross,"Go up here, and well just put in, just the indication of a happy little waterline that lives here. Now, if you get one thats maybe a little too strong or too bright, just go back and rub it"
Bob Ross,"The more you rub it, the lighter itll get, because itll just be absorbed right into the color thats underneath. No big deal"
Bob Ross,"And if youve painted with me before, you know without question that we dont make mistakes here. We just have happy accidents. But you learn to use anything that happens. Okay, maybe, right there"
Bob Ross,"And, little ripples. But notice how all these lines are basically straight"
Bob Ross,"If theyre not, its gonna look like your waters gonna run right outta your painting and get your floor wet, and youll have to tie a bucket on one side"
Bob Ross,"chuckles We dont want you to have to do that. Now, tell you what. Clean off a little spot"
Bob Ross,"Lets take some black, Prussian blue, brown, crimson, sap green, all those same colors, but with no white in it. So very, very dark. Very dark. Looks black on the palette. There"
Bob Ross,"Okay, let me clean my knife. And I just wipe the knife on an old paper towel. Find a fan brush here. Lets take the fan brush, and go right into that color. Load a lot of paint onto the brush"
Bob Ross,"Both sides. See, the bristles are, theres a lot of paint in there. Okay, lets go up here"
Bob Ross,"Maybe back in here, in our world, there lives, well there does now, anyway, there lives a happy little evergreen tree. And we just use the corner of the brush"
Bob Ross,"Just the corner, and as you work down the tree, add more and more pressure so that the bristles bend downward much, much more. Look at there. Isnt that a nice way to make a happy little evergreen"
Bob Ross,"Lets give him a friend. You know me. I think everybody, everybody should have a friend. Friends are so important. There. Alright. Maybe, shoot. In our world, maybe theres three trees here"
Bob Ross,You can put as many or as few as you want. The only thing that we would like to teach you here is how to make a tree. You decide how many trees you have in your world
Bob Ross,"Maybe well have some, maybe theres a little reflection down here. Just put some general shapes, were not looking for detail. Not looking for detail. Just very basic little shapes. Shoot, who knows"
Bob Ross,"Maybe theres some land there too. You can just push up with the fan brush, a little bit down for the reflection"
Bob Ross,"And lets take, well use the old two-inch brush, and grab this, decide where water and land meet, and pull straight down once again. Straight down. Son of a gun. Instant reflections"
Bob Ross,"Go across, and that easy. That easy. And see, these reflections, you can push em. See how you can push em. Because the canvas is wet, you can do that. You can do anything here"
Bob Ross,"Oh this canvas, you have total and absolute power. Unlimited power here. laughs When I go home, the only thing I can do is take the garbage out. But here, I can do anything that I wanna do"
Bob Ross,"Lets take a little of the dark sienna and a little white, get a little roll of paint on the knife, and lets put a little indication here and there of a little tree trunk that lives in these. There"
Bob Ross,"Dont want a great deal. Dont want a great deal, just enough to Just enough to indicate theres something in there"
Bob Ross,"And you can just take the point of the knife, and just scrape through and make little lines and sticks and all those little things. Tell you what, let me grab another fan brush"
Bob Ross,"And lets take and go into a little yellow, this is cad yellow, a little touch of that color we made the tree out of, since it has blue in it, as soon as we touch the yellow, turns beautiful green"
Bob Ross,"color. Maybe a little yellow ochre too. I want a dark green here. Once again, load the bristles quite full. A lot of color. Lets go up here. Now then, lets put some highlights on these little trees"
Bob Ross,"Dont wanna overdo. If you put too much highlights on here, too many highlights, then it loses its effectiveness. We want these to be quite dark. Look at there. And thats all there is to it"
Bob Ross,"Darker, darker, darker. Now, maybe down here, theres some little grassy things that grow on this. And you can just make those by pushing up with the brush, thats all. Very easy. Now"
Bob Ross,"Lets have some land under there. We need something to hold those trees up so they dont fall over in the water and make a big splash. There. Little Van Dyke brown, little dark sienna mixed together"
Bob Ross,"Like so, well take a little touch of that brown and white. Just make the indication of a little land there. Little bit of the liquid white that we had left over"
Bob Ross,"And well just put in a little waterline. This waterline is your separator. Its a light between two darks, and that separates it, and makes it, makes it stand out. Alright"
Bob Ross,"Tell you what, well just use this big brush. Ready to have some fun. If youve painted with me before, you know that I love to make big trees. So lets do that. Ill use the old two-inch brush today"
Bob Ross,"The old two-inch brush. So often we avoid this brush because its big and were afraid of it. A lot of paint. Wiggle. Wiggle, wiggle, then sharpen it, just like you would a knife"
Bob Ross,"Look how sharp this brush is. There, you can see. Its very sharp. Lets go up here. Now then, maybe in our world lives a big evergreen tree. Right there. Just touch the canvas"
Bob Ross,"Now, we use just the corner. Just the corner of the brush. And just go back and forth, and begin laying in all of these beautiful little limbs and stuff that live here on this tree. There. Okay"
Bob Ross,"Tell you what, well have another one. You knew that, didnt you. You knew Id have a friend out here. There. Okay"
Bob Ross,"Now then, lets have some, maybe theres some big, leafy trees, not evergreens that live here. There. Lets just push in some, push in some nice leaf and branch shapes. Look at there"
Bob Ross,"And when you use a big brush, you can do this very rapidly. Now, lets go on the other side. We need some over here too. Now, you can do this with a one-inch brush if you wanted to. Works just as well"
Bob Ross,"Just as well. This is just a little bit faster. A little bit faster. There we are. Okay. Just bring it right on down, right on down. Now you have to start making big decisions"
Bob Ross,"Okay, well just put it there. A nice bush lives there. Tell you what, lets get crazy. Maybe. Maybe it just goes all the way across. In your world, you can do anything that you want"
Bob Ross,"If you want this shrubbery and bushes and trees to come all the way across, then do it. Do it. Alright"
Bob Ross,"Now then, we can just take a clean knife, and just make the indication of little sticks and twigs, just by scraping, just the point of the knife"
Bob Ross,"Were gonna cover most of those up, but some of em will show. We can even use a little brown and white, come right up in here, put the indication of a trunk. Not a great deal of detail, just a little"
Bob Ross,"Little over here. Cause these are gonna be deep in the old tree here, youre not gonna see much of them. But theyre there. Now then, lets take, well dip the brush into a little of the liquid white"
Bob Ross,"One-inch brush. Well go right through, Ill use a little cad yellow, grab some sap green up here. There we are. Cad yellow, sap green, pull the brush in one direction, load a lot of color in it"
Bob Ross,"Okay, lets go up here. Now then, think about all your little leaves and stuff here that would just shine and, oh, they would sparkle out here in the sun under this big mountain"
Bob Ross,"And when youre painting, make up little stories. Think about the scene that youre painting, become part of it. Make friends with a tree. Shoot, you can just drop all this stuff in. And let it go"
Bob Ross,"Darker, darker, darker as you work down toward the base of the tree, though, darker, darker. Add a little yellow ochre here or there, a little Indian yellow sometimes, just just to change the flavor"
Bob Ross,"Wherever you want em. There we are. Little touch of bright red even, here and there. Its up to you. Up to you. There. And you choose even the time of year. Lets go on this other big tree over here"
Bob Ross,"Maybe over here, there lives, there lives this big tree. Think about individual shapes and form inside of this tree. Dont just throw it on at random"
Bob Ross,"Think about, think about the limbs inside the tree that give it shape and form. There. Okay. Darker, darker, darker, down here toward the base. Much darker"
Bob Ross,"Lets have a bush right here that has red flowers on it. Look at that. See there. Just by putting a little bit of red on the end of the brush, you can do that. Here lives another one"
Bob Ross,"Just do one bush at a time, though. One at a time. There they go. Okay. Just wherever you want em. Shoot. Its coming along pretty nice. There. Okay"
Bob Ross,"And the other side, over here, well put in some little bushes here. And you can use the brush sidewards. Just push upward and create all kinds of little things. Just like so. Alright"
Bob Ross,"Im gonna put a little path in here, use a little Van Dyke brown, we got just a second left, so Ill throw that in. A little brown and white. Give this indication of a little path"
Bob Ross,"Then all we need to do is put a little bush over the top of it, and it sets it right down into the painting. Shoot, I think we have a finished painting"
Bob Ross,"With that, Im gonna wish you happy painting, and God bless, my friend, Ill see you next show. instrumental music"
Bob Ross,"- Hi, welcome back. Im glad you could join me today. Today I have one of my little friends here thats having lunch while were doing this, so I thought Id share her with you"
Bob Ross,"This is a little baby fox squirrel, and shes just having a little lunch with me. Oo, whats there. Too much. Huh. There. Isnt she somethin. Shes only a few weeks old, and just as cute as a button"
Bob Ross,"Thought Id show her to you today. There. Alrighty, enough of that. This is just one of my many friends. Im gonna set her down, and well get started here. Okay, if I can get her off my shirt. There"
Bob Ross,"They have about 9,000 claws and they can all seem to grab you at once. Alrighty, tell you what. Come on up to the canvas, let show you what Ive got done today"
Bob Ross,"Today we have our standard ol 18x24 canvas, or any size that you want, and Ive done something a little bit different today"
Bob Ross,"Ive taken in this area up here, the white area, this is a mixture of liquid clear and liquid white. I put the clear in there because I want some transparence today"
Bob Ross,"Then the rest of it Ive just covered with a little bit of liquid black, and just sort of swirled it around a little bit. Just sort of let em blend together"
Bob Ross,"So, we have liquid white and liquid clear mixture, and liquid black, and just blended together. Lets just have some fun today. I thought wed just do a happy little painting"
Bob Ross,"If you dont have all three of these mediums, you can do this with liquid white, but you wont have the transparence and the bottom will be a little bit more difficult. But you could do it"
Bob Ross,"Lets go into a tiny, tiny little bit of the Yellow Ochre. Maybe add a little Cad Yellow into it. Just mix them up together, here. like so"
Bob Ross,"Were gonna run all the colors across the screen so youll know exactly what were using here. There. Alright, lets go up in here. Lets make a big decision"
Bob Ross,"Now then, not even gonna clean the brush, but Im gonna go right into a small amount of Alizarin Crimson, and the crimson is strong enough that you dont have to clean the brush, itll go right over"
Bob Ross,"it. There, now then. Lets just go right around the edges here, like so. Just add a little touch of that crimson. There"
