person,text
Bob Ross,"There we are, lets go up here. Maybe theres some little bushes that live right in here, and theres some light zinging through, and just makinem sparkle"
Bob Ross,"Take the corner of the brush, and I have the number three fan brush here, and all Im gonna do is go to push upward, just push it, just sort of scrub it, and push it. There we are. See there"
Bob Ross,Theres all there is to it is very simple but you can make little bushes that are back in the distance. Very quiet little devils that live back in here. There
Bob Ross,"And sort of vary the colors so there all not just exactly, ooh thats nice. That ones got a little more ochre in it. I sort of like it. Maybe Ill put a little more in here too"
Bob Ross,"I like it thats good, effective. Somewhere right in there, we dont know where they go. Any ol where that you wantem"
Bob Ross,"Lets take our knife, a little dark sienna, a little van dyke brown, put a little white in there. Just mix it with the knife right here on the ol pallet"
Bob Ross,"Now we need a little land in here and I want this to be very dark so Im just rubbing it so it picks up the liquid white thats underneath here and all these things just, they just sort of come"
Bob Ross,"together. But I dont want it to be real dark. Maybe it comes all the way across here, just, whatever"
Bob Ross,"Now then, our little fan brush that we had the little bush color on, the white and yellow ochre, you can go back and just pop in some little bushy areas that come down on this land"
Bob Ross,"Just sort of bring it together so you dont see distinct edges. There. Now I have several fan brushes going but maybe in our world here, lets do it. I see something here"
Bob Ross,"Were gonna a little bit of the liquid white, titanium white, mix them together. Be right back, dont go away, there. A little touch of the phthalo blue, little touch"
Bob Ross,"Maybe in our world there lives just a little happy waterfall that comes along, drops in there, splashes a little bit, play, comes right over that, so now you can see a little dark right through it,"
Bob Ross,"like as a little stone or some dirt or something under there, whatever you want. Maybe, this is pretty rough water. There it went but think about that"
Bob Ross,"Think about water just floating along here and having a good time, a real good time, and somebody says bloop, pulls the bottom out. And thats the way to make the water look correct"
Bob Ross,"Just straight and then over. There we go, little splashes here and there, and there and here. We can begin working that out, kay. Shoot, we better put something in here before we get to far along"
Bob Ross,"Im gonna make that nice brown color. Tell you what, let me clean off a spot to work here well just set that over there in case we need it later"
Bob Ross,"I wanna take sap green, well make a very nice brown, and alizarin crimson. And about equal parts, roughly equal parts, and you wanna really mix these up good"
Bob Ross,"Sap green and alizarin crimson, this makes one of the most beautiful browns but you really have to mix it well. All right, there"
Bob Ross,"And when youre mixing paint to mix it well lift it completely off the palete, turn it over. That way both sides get stirred up. All right, lemme clean off the ol knife"
Bob Ross,"Now then, well use the two inch brush. Im gonna go right in, load a little color onto the bristles, just load a little color, like so"
Bob Ross,"All right, maybe theres some happy little bushes that live right here. Using just the corner, just begin tapping in some very basic little shapes wherever you think they should live"
Bob Ross,"There we are, see. Maybe in our world they come right out through here, I dont know. Theres a nice little bush. He lives there"
Bob Ross,"He lives right there and hes got a friend there, and maybe another one up here, whatever. Just think about all these little critters that live out here, make friends withem"
Bob Ross,"Now then, we had all that, thered be some reflections in the water so well just take a little of that color, pull straight down, like so"
Bob Ross,"Now, if you wanted to paint this picture without the oval you certainly can do that, just leave it off. Can do easy, no big deal"
Bob Ross,"Maybe on the other side over here, Im gonna use that same color but I wanna add a little white to it. I want it to be a little lighter. Same color loaded the same way, just by pushing"
Bob Ross,"Lets go up in here. Maybe in this side, lets do this. Maybe we have some bigger trees that live over here. And in my mind these are farther away then these so I want them to be a little lighter"
Bob Ross,"And we just sort of let them, maybe they go all the way to the top, what the heck, lets go all the way up here"
Bob Ross,"Sort of big ol tree that hangs over here and watches the little water fall back in the background. Just watches that little water fall, has a good time out here, enjoys life. There"
Bob Ross,"And some darker color and maybe it comes right out here to the ground area. All right, see you begin seeing things here"
Bob Ross,After youve painted a little while and you get over the initial fear of touching brush to canvas then it becomes so much fun because you not worried about making mistakes
Bob Ross,"When our instructors like, well like Dana that you met in the last series or my son Steve, when these instructors are teaching people one of the first things they tellem is dont worry about making"
Bob Ross,"mistakes because theres nothing on the canvas that they cant fix. Now Im gonna add a little touch of lavender, that same lavender color, right here"
Bob Ross,"I wanna pull a little of that dark down, I wanna little dark in here. This is just that same lavender, alizarin crimson, phthalo blue, I wanna add it right in there. There, Iike it"
Bob Ross,"Maybe a little on this side too, just to darken it up a little and put a little of the same background color into our reflections but not a great deal. There we go, very nice"
Bob Ross,"And add a little more to that tree. Im gonna put another tree in front of him I think so not to worried about that. Probably just use the same brush, it doesnt matter"
Bob Ross,"Go right into a little yellow ochre, little touch of cad yellow, Indian yelliow, maybe even a little of the bright red there. Ooh, I like a little more of that bright red. I like that"
Bob Ross,"Push though, you want that little ridge of paint, see it comin up there, push. Lets go right up here. You know what I wanna do"
Bob Ross,"I think Il just go in there and put a little branch or two, what the heck. I think we have time to do that"
Bob Ross,Maybe we can see just a few little sticks and twigs that are living in here and coming through. See. There
Bob Ross,Just sort of makes it a little more interesting when you see some of these little things that live deep in your trees and just brings it together cause there always there
Bob Ross,"Theres something thats holding all these leaves up, there we go. Now we can use that nice color we made"
Bob Ross,"Corner the brush, think about shape, and form, and how these little rascals would live in there, and jut begin working with them"
Bob Ross,"Now if you had trouble making the stick add the least little touch of paint thinner or liquid white. Now the liquid white will slightly change your color, of course, itll make it a little lighter"
Bob Ross,"So it just depends on what it is that you want, there. Think about shape and form. I know you get tired of hearing me say that but it is so important. It will make you happy when you get done"
Bob Ross,"Itll be worth the effort. There. Now then, over here on this other side, lets put a little something over there. Im gonna reach up and grab a little of the titanium white and add to that same color"
Bob Ross,"Now, over here I added the white because in my mind the light zinging through there and its gonna be a little bit brighter. See, gonna have those little spots on there that shine. There we go"
Bob Ross,Did you ever think you can do such delicate little things with a great big ol two inch brush
Bob Ross,"You can, you really can, in fact you can do anything that you believe you can do, anything and I know you can. There. Now then, tell you what lets do"
Bob Ross,"Im going back to my old brush here, let me find a brush, its got nothing but brown on it. This is the brown that we made from the sap green and the alizarin crimson"
Bob Ross,"Im gonna load some color in it, lets go up here, in my mind I wanna very dark tree right here, right there. There he is"
Bob Ross,"There, watch how this dark contrasting color push that first color back and itll stand out. Itll really stand out. There we go. Nice big ol happy tree lives right there"
Bob Ross,"Maybe theres a big ol limb that hangs out here. There we go. This contrast is very pleasing. In fact, we may not do much more to that"
Bob Ross,I like that dark so well I may not even highlight it because in my mind this is gonna be way back in the shadows anyway
Bob Ross,Theres not gonna be a great deal of light coming through there and its a good way for me to keep the dark back there that I want. If you want to highlight it you certainly could
Bob Ross,"Im gonna take a little paint thinner with the same color and here and there just like we did before, add the indication that theres some limbs, and sticks, and stuff going on in here too"
Bob Ross,"We dont want this on left out but not a great deal. Shoot, maybe right in here is one thats a little lighter. As we mentioned earlier you have a lot of those in the woods"
Bob Ross,"There sort of pretty, they standout. Now then, back to our brush with a dark brown and we can come in here, and just begin tapping in some, maybe theres a little land area under here"
Bob Ross,"Grab that, pull it down too. Let me get a little sap green, and a little cad yellow, and make it very dark. Maybe even a little black in it, dull it down"
Bob Ross,Now theres brown on the brush and thats really gonna dull it also
Bob Ross,"All these colors are gonna dull it and in our world, maybe theres a little green grass that lives back here under this tree, just a little. There, nice place to sit"
Bob Ross,"Try to catch that big ol trout that lives out there, swims around all day. I like to fish, Im a pretty good ol fisherman"
Bob Ross,"But Im one these people that puts a bandaid onem, givesem a little CPR, pets him on the too-too, putsem back in the water"
Bob Ross,"Come back the next day and catch him again, cause the fun is in the catching of them. Little more of the brown. Maybe theres a little ledge right there, we dont know. Something like so"
Bob Ross,"Little brown and white, and we can put a little highlight on that, just a touch. We could use a fan brush with a little of that same green color"
Bob Ross,Just pop in some little areas so they come right down and bring that all together. There we go. Thought maybe today wed have some fun and wed make some rocks
Bob Ross,"So I want to take quite a bit of liquid white to put out here, just put it out here. Im gonna take then some dark sienna and mix it in there. I want a very thin paint"
Bob Ross,"This is dark sienna, liquid white, with the least little touch of yellow ochre. May even put a little van dyke brown in there, really dull it down, there. See there"
Bob Ross,"I wanna go right through the browns, both browns, van dyke and dark sienna, and Ill reach over here, both sides are covered, and Im gonna pull at one side through that thin paint so we have light"
Bob Ross,"color on one side, dark on the other. And in my world I see all kinds of happy little stones that live here"
Bob Ross,"Maybe theres just a whole group of little stones that live all down in here, wherever you wantem. Just sort of decide where they at and putem in"
Bob Ross,"The other side over here I wanna have some, something like that. There we go. And we dont know, shoot out in the water here there may be several more. Ran out of dark"
Bob Ross,"Just little things that live out here in the water. There. Now then, we can come right back. I want to have a little bit of land projecting right out through here, same ol dark color"
Bob Ross,"Little bit of reflection under it, little bit of the same color, and in yellow, cad yellow, little bit. And here there may be the least little touch of the bright red mixed in with it, just like so"
Bob Ross,"Now then, and I think there might be a few little stones down here too, maybe this one lives out here, just wherever you wantem, like so. And shoot, lets go up here"
Bob Ross,Maybe theres some little stones that live in here and you put a many or few stones in your world as you want. Little liquid white with a little of the blue in it and well come right in here
Bob Ross,Let this water just play right along through here. That sort of cleans up all these edges and brings it all together. And place some water all around these little stones that you laid in here
Bob Ross,"There, see. See, it just brings it all together. There. All right, now. Shoot, thats fantastic. Tell you what lets do. Im gonna take the contact paper off and lets see what we have"
Bob Ross,"Just grab it, pull it, and off we go. Isnt that a nice little painting. Now, you know me. I always like to put a big tree or two"
Bob Ross,"So Im gonna go right into that brown color that I made, use a fan brush, single brown color. And in my world, I think, all right theres your bravery test. There live a tree right there"
Bob Ross,"And hes got a friend. Dont makeem just straight, giveem some character. Letem move around and play in there. Our liner brush, paint thinner, and well put an arm or two on this tree"
Bob Ross,"There, if your paint doesnt flow it only means that you need more paint thinner. There we go. Maybe that limbs a little fatter. There. See"
Bob Ross,"And just put in all kinds of little limbs and doers and there we are. And this is up to you once again, you decide how many limbs are on your tree"
Bob Ross,"Shoot, you might wanna put some leaves or something on there, I dont know. Once again each person will see nature different. Each painting should be different and thats what makes it so much fun"
Bob Ross,"There we go. You just put in limb, after limb, after limb, many as you want or as few as you want"
Bob Ross,"Maybe, Ill tell you what, look here, heres one thats, groans you have to make your little noises see. It just sorta hangs off there like the wilderbrush, shoot"
Bob Ross,"Now we can take the knife, and you can take a little touch of brown and white, and heres our light source, and we can come in here, and just by touching, we can begin adding the illusion of bark"
Bob Ross,Thats what my puppy does barks bark. Thousand comedians that are working and me tryin to be one here. Okay. Something like so
Bob Ross,"And well come back with our brushes, cut a little of the yellow on it, put a little something something for around these trees foots to hold him in"
Bob Ross,"And I tell you what Im gonna take a little touch of the bright red, think well sign this one. Well sign him right out here on the rock. Well call it finished. Hope youve enjoyed this one"
Bob Ross,These little ovals are fantastic. Since we introduced them in several series back theyve become one of the most popular things we ever done. Artists all over the country are using this idea
Bob Ross,"So, try it, I think youll like it and from all of us here happy painting and God bless, my friend. lighthearted music"
Bob Ross,"Joy of Painting theme music smooth jazz electric guitar - Hi, welcome back. Certainly glad you could join me today"
Bob Ross,"Think today, well just do a fantastic little painting thatll just make you happy. So, I tell you what"
Bob Ross,"Lets start out and have em run all the colors across the screen, that you need to paint along with us here. While theyre doing that, let me show you what Ive got done up here"
Bob Ross,"Have my standard ol 18 x 24 inch pre-stretched, double-primed canvas, as we always use. I found some masking tape here in the studio, so I just sorta put that around like so"
Bob Ross,Took a can of spray paint and painted the edges. I thought wed just do something easy. Its a lot of fun. Something a little different. So lets do it. Lets start out with ol two-inch brush today
Bob Ross,"Well go right into a little Phthalo Blue, what the heck. Lets go into a little Phthalo Blue. We dont need much, its quite strong. Just a little. Just tap the bristles right in there"
Bob Ross,"Lets go up in here. Lets just build us a happy little sky today. As I say, its a fantastic day here. I hope it is wherever youre at. So I thought wed do a painting that just reflects that. There"
Bob Ross,Just using little criss-cross strokes. Lets just drop in a quick little sky. Ive chosen Phthalo Blue because its very similar to the color that we sprayed the canvas with
Bob Ross,"And you can do this in any color. It just happens to be what we had here, so thats what we used. There. Okay, and that easy, weve got a nice little sky"
Bob Ross,"Just blend it till its nice and soft, and its continually mixing with the Liquid White which is on the canvas. That way it gets softer and softer toward the horizon"
Bob Ross,"Thats exactly what were looking for today. All right, tell you what"
Bob Ross,"While we have that color on the brush, lets add a little more and Im gonna reach over here and get the least little touch of Phthalo Green"
Bob Ross,"Dont need much, just want enough just to flavor the blue a little. Just a tiny bit, okay. Now then, maybe well have a little water in here"
Bob Ross,"Shoot, if you painted with me before, you know that Im an absolute fanatic for water, I love it. There. Okay, little bit more color. Well come from the other side. Just like so. There"
Bob Ross,"And then very lightly and very gently, well just go across the entire water area here. That sorta blends it together and makes it nice and soft. Now, most fun part of all this is washing the brush"
Bob Ross,"Lets do that. Just shake it off. brush splashing and thwacking Bob laughing You can cover everybody in the room. All right, maybe in our world today. Maybe we have a little cloud"
Bob Ross,Maybe well use a fan brush today to make a little cloud. Just load both sides full of Titanium White. Lets go right up in here and decide where our little cloud lives
Bob Ross,"Maybe we have a little cloud in our world. That just sorta hangs around right here, like so. There he is. And Im using just the corner of the brush, making tight little circles"
Bob Ross,"Thats all were doing. Just very tight little circles. There. Now, Im gonna get a two-inch brush. Be sure its dry. And very gently, using just the corner again"
Bob Ross,"Just blend it, just blend the base of the cloud out. Then very gently, fluff it up a little bit. Do like that. That easy, you have a very effective little cloud"
Bob Ross,"Maybe, tell you what, maybe in our world, maybe theres several layers of clouds floating around up here. So well just have another one, right here. Right there"
Bob Ross,"When youre doing your painting, you put as many or as few clouds in it as you want. Up to you. brush banging Good clean, dry brush. Be sure your brush is dry"
Bob Ross,"If its got thinner in it, when you touch a cloud, its gonna get very thin and diluted and youre not gonna be able to blend it like this"
Bob Ross,"But you can put as many layers of these in as you want, just one after the other. See there. There we go. brush banging I always beat the brush, just to knock out any excess paint"
Bob Ross,"Because its continually picking up a little paint. So, just by beating it, you dont have to go through that entire cleaning procedure. There"
Bob Ross,"brush beating Maybe today in our world, we have, lets see. Tell you what, lets have a nice mountain in here. For that, I want to go in to some black. Well use a little of the blue"
Bob Ross,"We use a little Prussian Blue, Alizarin Crimson. Maybe even a little brown, what the heck"
Bob Ross,"knife tapping palette Just mix it up, pull it out as flat as you can get it and cut off a little roll of paint. That lives right out on the edge of your knife. Maybe our big mountain lives"
Bob Ross,"Where does it live. Maybe it comes right down here. I dont know, maybe it goes right on off the canvas. knife scraping on canvas Thats always sorta interesting"
Bob Ross,"When you hvae one that just sorta lives way up there in the sky. knife tapping palette Maybe, back in here. Wherever, wherever. Put another little one right there"
Bob Ross,"Just sorta let him float around in that direction. Just sorta make a decision and put it wherever you think it should be. Thats really all you have to do. There, now then"
Bob Ross,"With a clean, dry, two-inch brush, we wanna grab this and pull it. That does two things, two things. It removes excess paint, so the next layer sticks easier"
Bob Ross,"And it makes your mountain get lighter and lighter, toward the base. Thats exactly what were looking for. There we go, just blend it till it just sort of floats up there in the sky. There"
Bob Ross,"brush sweeping across canvas That easy, weve got our base color for a very nice little mountain. Lets take. Well use a little Titanium White today, what the heck"
Bob Ross,"Take a little white, also pull it out as flat as you can get it and go down, cut across, and get our little roll of paint. Its very important. Maybe well start right here"
Bob Ross,"You can play little games and have fun with this. No pressure. Absolutely no pressure with a knife. Youre just barely, barely touching it. Well take a little touch of"
Bob Ross,"Oh, well use a little touch of Phthalo Blue. Maybe a little touch of black in it. Make us a nice shadow color. Something like so. Okay, once again our little roll of paint"
Bob Ross,"We go right up here, and decide where the shadows are. Theres one. Here comes one. soft wooshing sound Goes distinctly through that one. There. You can put shadows"
Bob Ross,"Just wherever you think the light would strike. Now, nice clean brush. I wanna just create the illusion of mist. Tap that, very gently. Very gently. Two hairs and some air"
Bob Ross,Sometimes its fun when youre doing mountains to play games with which ones in front and which ones in back. But make up little stories in your mind
Bob Ross,"Maybe this mountain lives right here and it comes, looky there, see. Distinctly in front. knife scraping canvas There we go"
Bob Ross,"Also, sometimes its very nice to have a little cloud that floats along and goes right in between those"
Bob Ross,"So, Im going to add the least little touch of Liquid White to the paint, right on the fan brush. The Liquid Whites to make it a little thinner"
Bob Ross,"Because a thin paint will stick right up here without messin everything up. We can put a happy little cloud, that lives right in here, between these two. Clean, dry brush. Very gently"
Bob Ross,"Float it a little bit, there. Thatll give us the impression that theres a little cloud up there, and we can bring this right on distinctly through. Okay. Now then, back to my Titanium White"
Bob Ross,"Lets begin putting some highlights on this mountain over here. No pressure, absolutely no pressure. The most gentle touch. Just float right through here. soft zooming sound Absolutely no pressure"
Bob Ross,"Lets go to this big one here. soft whooshing sound knife scraping and tapping Here it comes, right there. Your paint has to be very firm. Very firm, or you wont get this breaking"
Bob Ross,"And this breaking is what makes your mountains so pretty. There. Just begin working it. Let it go. Just let it go. On the other side, were gonna have shadows coming right down through here"
Bob Ross,"No pressure though, once again. soft zooming sound Gotta make those little noises, or it doesnt work right. knife scraping and tapping There. Now, you can continue to work back and forth"
Bob Ross,Maybe we wanna put some nice bumps and ridges out here on this mountain. There they come. Just sorta let your imagination be your guide here. There. Back to our shadow color
Bob Ross,"Because every time you have a little projection out here, you need a shadow behind it. It needs its own, distinct shadow"
Bob Ross,"Here and there you can touch a dark base color a little bit, just let a little of that flow right down. Just play games with light and dark. Thats whatll make your mountains so fantastic"
Bob Ross,"There, wherever you think these little things should be. knife tapping palette Little bit of our shadow color here and there. Right in there"
Bob Ross,"Shoot, were gonna mess around and have us a mountain here. brush banging Okay, lets just tap now. We wanna create the illusion of mist down at the base of this big ol mountain"
Bob Ross,"Tap and then we lift upward. Following the angles in the mountain. All this does is remove the tap marks and blends everything together. Just blends it together. Over here, youll follow these angles"
Bob Ross,"Its most important though, that you follow these angles. There. Right in here. Sometimes, its a lot of fun just to play some games. Watch here"
Bob Ross,"Maybe in our world, theres another little mountain that lives right there. Put a little dark in and this is a way of creating the illusion of distance"
Bob Ross,"In your painting, when you have layer after layer of these things. Scrape off the excess. We go back to our Titanium White. Put a little highlight right here on this one too"
Bob Ross,"zooming sound Just let him go. No pressure, I cant say that enough times. I say it over and over because this is one of the major problem areas that I hear in letters and stuff"
Bob Ross,"Hard time making the paint break. The reason normally is, either one of two things. Too much pressure, or the paint is too thin. Mix up a little more shadow color here, ran out"
